Seed Round - Deno,Seed,Seed,"$4,900,000","Mar 29, 2021",Deno,A secure runtime for JavaScript and TypeScript and a globally distributed JavaScript VM,Software,—,"Brooklyn, New York, United States, North America",deno.com,,"$25,900,000",Early Stage Venture,3,Four Rivers Group,4
Pre Seed Round - Sustainability Creative Co.,Pre-Seed,Seed,"$15,000","Apr 8, 2021",Sustainability Creative Co.,Blockchain Innovations in Sustainable Energy,"Clean Energy, Energy, Energy Storage, Fuel Cell, Power Grid, Real Estate, Real Estate Investment, Renewable Energy, Vacation Rental","Women Founded, Women Led","Clearwater, Florida, United States, North America",sustainabilitycreative.solutions,,"$15,000",Seed,1,—,—
Seed Round - Volastra Therapeutics,Seed,Seed,"$32,000,000","Apr 6, 2021",Volastra Therapeutics,Volastra Therapeutics is a biotechnology company developing novel therapies for the treatment of metastatic cancers.,"Biotechnology, Life Science, Medical",—,"New York, New York, United States, North America",volastratx.com/,,"$104,000,000",Early Stage Venture,3,"Catalio Capital Management, Vida Ventures",6
Seed Round - Volexion,Seed,Seed,"$1,100,000","Apr 8, 2021",Volexion,Volexion is a battery manufacturing and graphene coating technology for commercial Li-ion cathode materials with 10x performance.,"Battery, Chemical, Chemical Engineering, Manufacturing",—,"Evanston, Illinois, United States, North America",www.volexion-inc.com,,"$3,280,068",—,4,"Clean Energy Ventures, Energy Foundry",3
Seed Round - Advocate Condell Ambulatory Surgery Center,Seed,Seed,"$498,375","Mar 12, 2021",Advocate Condell Ambulatory Surgery Center,Advocate Condell Ambulatory Surgery Center is operates in the healthcare industry.,"Health Care, Medical",—,"Libertyville, Illinois, United States, North America",,,"$564,375",Seed,2,—,—
Seed Round - Kingdom Scene Endeavors,Seed,Seed,"$572,650","Feb 26, 2021",Kingdom Scene Endeavors,Kingdom Scene Endeavors offers a virtual world for kids filled with inspiring stories and games designed to teach values and biblical faith.,"Children, Gaming, Virtual Reality",Women Founded,"St Louis, Missouri, United States, North America",www.kingdomscene.com,,"$4,212,650",Seed,6,—,—
Pre Seed Round - Dieta Health,Pre-Seed,Seed,"$50,000","Feb 18, 2021",Dieta Health,AI-driven digestive health,"Apps, Big Data, Health Care, Machine Learning, Mobile Apps, Personal Health",Middle Eastern / North African Founded,"Los Angeles, California, United States, North America",www.dietahealth.com/,,"$1,520,000",Seed,5,Cedars-Sinai Accelerator,1
Seed Round - The Face Companies,Seed,Seed,"$12,500","Apr 1, 2021",The Face Companies,The Face Companies is a breakthrough technologies in Energy Harvesting and Construction.,"Energy, Energy Efficiency, Energy Management",—,"Norfolk, Virginia, United States, North America",facecompanies.com/,,"$748,622",Seed,2,—,—
Seed Round - Namic Group Inc.,Seed,Seed,"$1,000,000","Mar 4, 2021",Namic Group Inc.,Namic Group Inc. focuses on information technology advancements.,Information Technology,—,"New York, New York, United States, North America",namicgroup.com,,"$4,500,000",Early Stage Venture,2,—,1
Seed Round - Decodable,Seed,Seed,"$5,500,000","Mar 2, 2021",Decodable,Decodable is a serverless data integration and engineering platform for streaming data.,"Developer Platform, Information Technology, Software",—,"San Francisco, California, United States, North America",decodable.co/,,"$25,500,000",Early Stage Venture,2,—,7
Seed Round - Hero Technologies,Seed,Seed,"$520,000","Feb 18, 2021",Hero Technologies,Hero Technologies is a publicly traded acquisition company. We focus on acquiring technology and manufacturing companies.,"Manufacturing, Software",—,"Dover, Delaware, United States, North America",herotechnologiesinc.com/,,"$520,000",Seed,1,—,—
Seed Round - Online Web Services,Seed,Seed,"$320,000","Mar 1, 2021",Online Web Services,Online Web Services is developer of victim services tracking and crime management solutions.,"Information Technology, Security, Software, Web Development",—,"Durango, Colorado, United States, North America",onlinewebservices.us/,,"$320,000",Seed,1,—,—
Seed Round - Kubecost,Seed,Seed,"$5,500,000","Mar 23, 2021",Kubecost,Kubecost provides real-time cost visibility and insights for teams using Kubernetes.,"Developer APIs, Information Technology, IT Infrastructure, Software",—,"San Francisco, California, United States, North America",kubecost.com/,,"$30,500,000",Early Stage Venture,2,First Round Capital,1
Seed Round - 4Blind,Seed,Seed,"$13,500","Mar 5, 2021",4Blind,Help to socialize and improve the health and well-being of people with visual disabilities with the help of technologies.,"Apps, Communication Hardware, Hardware, Health Care, iOS, Mechanical Engineering, Medical, Mobile Devices, Software, Technical Support",—,"Boston, Massachusetts, United States, North America",4blind.com/,,"$496,192",Seed,13,—,—
Seed Round - Moray Medical,Seed,Seed,"$5,700,000","Apr 12, 2021",Moray Medical,Moray Medical develops a structural heart robotic delivery systems for edge-to-edge valve leaflet repair.,"Health Care, Medical Device",—,"Mountain View, California, United States, North America",moraymedical.com/,,"$5,700,000",Seed,1,"415 CAPITAL, Heal Capital",3
Seed Round - Gryps,Seed,Seed,"$1,500,000","Mar 30, 2021",Gryps,Gryps provides access to quality information to make better decisions during the project life-cycle.,"Document Management, Information Technology, Software","Women Founded, Women Led","Bronx, New York, United States, North America",gryps.io/,,"$7,698,626",Seed,2,LDV Capital,4
Seed Round - Gondola,Seed,Seed,"$2,400,000","Mar 25, 2021",Gondola,Gondola is a sales enablement tool that builds deal momentum by enabling productive sales conversations.,"CRM, SaaS, Sales",—,"Denver, Colorado, United States, North America",demoflow.io,,"$4,000,000",Seed,3,Surface Ventures,5
Seed Round - euphor.ai Inc.,Seed,Seed,"$1,000,000","Mar 5, 2021",euphor.ai Inc.,"SaaS, Media, Social Media","Advertising, Cannabis, Digital Media, Information Services, Media and Entertainment, SaaS, Social Media",—,"Campbell, California, United States, North America",www.euphor.ai,,"$1,000,000",Seed,1,—,—
Seed Round - Calixa,Seed,Seed,"$4,250,000","Mar 9, 2021",Calixa,Calixa is the Product-Led Sales platform that turns product data into closed won.,"Analytics, B2B, SaaS, Software",—,"San Francisco, California, United States, North America",calixa.io,,"$16,250,000",Early Stage Venture,2,Kleiner Perkins,3
Seed Round - Abfero Pharmaceuticals,Seed,Seed,"$1,000,000","Mar 19, 2021",Abfero Pharmaceuticals,Abfero Pharmaceuticals is a clinical stage pharmaceutical company that specializes in healthcare and medical industry.,"Biotechnology, Health Care, Medical, Pharmaceutical",—,"Boston, Massachusetts, United States, North America",www.abferopharmaceuticals.com,,"$6,680,000",M&A,4,DeepWork Capital,1
Pre Seed Round - Vesti Social,Pre-Seed,Seed,"$200,000","Apr 1, 2021",Vesti Social,The social investing ecosystem that connects to your existing brokerage and crypto accounts.,"Financial Services, FinTech, Information Technology, Social Media",—,"San Francisco, California, United States, North America",www.vestisocial.com/,,"$200,000",Seed,1,—,—
Seed Round - Magical,Seed,Seed,"$3,300,000","Feb 18, 2021",Magical,Time Operating System,"Productivity Tools, Software, Virtual Workforce",—,"Los Angeles, California, United States, North America",www.magical.so,,"$3,300,000",Seed,1,Resolute Ventures,6
Pre Seed Round - Because Intelligence,Pre-Seed,Seed,"$650,000","Apr 1, 2021",Because Intelligence,Because helps high-SKU stores manage product page content at scale to grow their revenue.,"Business Intelligence, E-Commerce, Information Technology, Marketing, Retail Technology, SaaS",Women Founded,"Boston, Massachusetts, United States, North America",www.becauseintelligence.com/,,"$3,650,000",Seed,2,—,4
Pre Seed Round - Breaker Nation,Pre-Seed,Seed,"$100,000","Mar 9, 2021",Breaker Nation,Breaker Nation social networking application that provides access to the music industry.,"Apps, Media and Entertainment, Music",—,"Atlanta, Georgia, United States, North America",www.breakernation.com/,,"$100,000",Seed,1,—,—
Pre Seed Round - BeetsDAO,Pre-Seed,Seed,"$600,000","Mar 1, 2021",BeetsDAO,"BeetsDAO connects the world's creativity by incubating, tokenizing, and creating shared incentives for creators and audiences on Web 3.","Blockchain, Gaming",—,"Miami, Florida, United States, North America",www.beetsdao.xyz,,"$2,200,000",Seed,2,—,—
Pre Seed Round - EyeGage,Pre-Seed,Seed,"$36,455","Mar 23, 2021",EyeGage,"Data-driven drug screening tech, powered by eyes.","Artificial Intelligence, Computer Vision, Construction, Insurance, Law Enforcement, Mobile Apps, Software, Transportation","Black / African American Founded, Black / African American Led, Women Founded","Atlanta, Georgia, United States, North America",eyegage.com/,,"$625,455",Seed,5,—,—
Seed Round - SpIntellx,Seed,Seed,"$50,000","Mar 12, 2021",SpIntellx,Shaping the Future of Spatially Intelligent Biology,"Artificial Intelligence, Biopharma, Biotechnology, Life Science, Machine Learning",—,"Pittsburgh, Pennsylvania, United States, North America",www.spintellx.com/,,"$1,673,256",Seed,9,—,2
Seed Round - OpenBots,Seed,Seed,"$5,000,000","Mar 30, 2021",OpenBots,OpenBots is the first Business Automation Platform with a Zero Bot License model in the world.,"Information Services, Information Technology",—,"Edison, New Jersey, United States, North America",openbots.ai,,"$20,000,000",Private Equity,2,—,—
Seed Round - Quantum Loophole,Seed,Seed,"$13,000,000","Mar 6, 2021",Quantum Loophole,Quantum Loophole is a company that operates a data center campuses in gigawatt scale.,"Cloud Data Services, Data Center, Information Technology",—,"Austin, Texas, United States, North America",quantumloophole.com,,"$24,620,000",Seed,2,—,—
Seed Round - Sibel Health,Seed,Seed,"$2,206,775","Mar 17, 2021",Sibel Health,Sibel Health develops a neonatal epidermal system designed for wireless vital signs monitoring.,"Artificial Intelligence, Health Care, Medical, Medical Device",—,"Niles, Illinois, United States, North America",www.sibelhealth.com,,"$35,206,775",Early Stage Venture,2,—,—
Seed Round - 6P Color,Seed,Seed,"$2,276,202","Mar 31, 2021",6P Color,6P Color develops a color imaging system that captures and displays still and motion pictures.,"Image Recognition, Photography, Video",—,"Waco, Texas, United States, North America",,,"$5,772,183",—,2,—,—
Seed Round - MDRisks,Seed,Seed,"$205,000","Apr 1, 2021",MDRisks,MDRisks is a health information technology company driven by a mission to improve clinical outcomes and regulatory compliance.,"Health Care, Medical, Medical Device",—,"Boston, Massachusetts, United States, North America",www.mdrisks.com/,,"$205,000",Seed,1,—,—
Seed Round - Encrypgen,Seed,Seed,"$200,000","Mar 1, 2021",Encrypgen,"Encrypgen develops software for genomic data, empowering patients and donors, facilitating health, business, and science.","Biotechnology, Blockchain, Computer, Software",Women Founded,"Coral Springs, Florida, United States, North America",www.encrypgen.com/,,"$1,700,000",M&A,3,—,—
Seed Round - ECFX,Seed,Seed,"$1,250,000","Feb 22, 2021",ECFX,The leader in automated electronic court filing notice management for law firms and corporate legal departments.,"Legal Tech, Software",—,"Venice, California, United States, North America",www.goecfx.com/,,"$9,750,000",—,4,Brick Capital Ventures,1
Pre Seed Round - Corevest,Pre-Seed,Seed,"$50,000","Mar 1, 2021",Corevest,Brokerage-Validated Social Trading Platform,"Consumer Applications, Finance, FinTech, Personal Finance",—,"San Diego, California, United States, North America",www.Corevest.co,,"$50,000",Seed,1,—,—
Pre Seed Round - New Dawn Crop Performance,Pre-Seed,Seed,"$200,000","Apr 12, 2021",New Dawn Crop Performance,New Dawn Crop Performance is an agribusiness that is dedicated to removing waste from the crop input supply chain.,"Agriculture, AgTech, Farming",—,"Steele, North Dakota, United States, North America",newdawncropperformance.com/,,"$200,000",Seed,1,—,—
Seed Round - ClubNFT,Seed,Seed,"$875,000","Apr 1, 2021",ClubNFT,ClubNFT provides much-needed tools and solutions for the NFT collector community.,"Art, Blockchain, Information Technology",—,"Framingham, Massachusetts, United States, North America",www.clubnft.com/,,"$3,875,000",Seed,2,Motown Capital,2
Pre Seed Round - Cameraah,Pre-Seed,Seed,"$120,000","Apr 5, 2021",Cameraah,Cameraah is a no-code tool to create AR experiences for Social & Commerce in minutes,"Augmented Reality, E-Commerce, Virtual Reality",—,"Palo Alto, California, United States, North America",www.cameraah.com/,,"$120,000",Seed,1,Techstars,1
Pre Seed Round - Speechki,Pre-Seed,Seed,"$750,000","Apr 5, 2021",Speechki,"The easiest way to convert ChatGPT texts to ready-to-use audio — download link, audio player page, or embed!","Artificial Intelligence, Audio, Audiobooks, Podcast, Publishing, Software",—,"Austin, Texas, United States, North America",speechki.io/,,"$750,000",Seed,1,Greycroft,2
Seed Round - Onward,Seed,Seed,"$3,000,000","Mar 31, 2021",Onward,Onward is a FinTech platform designed to help co-parents manage shared expenses for their children more easily.,"Apps, FinTech","Women Founded, Women Led","Los Angeles, California, United States, North America",onwardapp.com,,"$12,700,000",Early Stage Venture,2,TTV Capital,3
Pre Seed Round - Everytale,Pre-Seed,Seed,"$650,000","Mar 30, 2021",Everytale,"Everytale is a virtual events platform that also offers event planning, promotion and production.","Education, Event Management, Event Promotion, Events, Human Resources, SaaS",—,"New York, New York, United States, North America",www.everytale.net,,"$3,750,000",Seed,5,—,—
Seed Round - SJK Energy Solutions,Seed,Seed,"$430,000","Mar 18, 2021",SJK Energy Solutions,"SJK Energy Solutions is an Ashton, MD-based energy company.","Energy, Natural Resources",—,"Ashton, Maryland, United States, North America",,,"$830,000",Seed,2,—,—
Seed Round - Curio Digital,Seed,Seed,"$1,200,000","Mar 5, 2021",Curio Digital,Curio Digital is a marketplace for tokenized digital collectibles.,"E-Commerce, Marketplace",—,"Los Angeles, California, United States, North America",oncurio.com/,,"$8,220,000",Seed,3,Future\Perfect Ventures,5
Pre Seed Round - Figwe,Pre-Seed,Seed,"$65,000","Feb 15, 2021",Figwe,Figwe is an e-commerce platform small and medium businesses.,"E-Commerce, E-Commerce Platforms, Enterprise Software, Information Technology",—,"Delaware City, Delaware, United States, North America",figwe.Com,,"$65,000",Seed,1,—,—
Pre Seed Round - evrmore,Pre-Seed,Seed,"$235,000","Feb 23, 2021",evrmore,evrmore is the wellness GPS combining voice + emotion AI for Gen Z’s digital mental health,"Artificial Intelligence, Consumer Software, EdTech, Electronic Health Record (EHR), Health Care, Machine Learning, Natural Language Processing, Personal Health, Psychology, Wellness","East Asian Founded, Women Founded, Women Led","New York, New York, United States, North America",www.evrmore.io,,"$235,000",Seed,1,—,—
Seed Round - Unybrands,Seed,Seed,"$25,000,000","Feb 17, 2021",Unybrands,Unybrands is an e-commerce platform aimed at acquiring successful fulfillment by Amazon and direct-to-consumer sellers looking to scale.,"Brand Marketing, Business Development, E-Commerce, E-Commerce Platforms",—,"Miami Beach, Florida, United States, North America",unybrands.com,,"$325,000,000",Private Equity,2,—,7
Seed Round - Xeni,Seed,Seed,"$500,000","Mar 5, 2021",Xeni,Operating System for Travel,"B2B, Blockchain, Software, Tourism, Travel",—,"New York, New York, United States, North America",xeni.com/,,"$8,145,000",Seed,7,—,—
Pre Seed Round - thisapp,Pre-Seed,Seed,"$975,000","Feb 15, 2021",thisapp,The first AI-Assisted Messenger that syncs with your calendar.,"Apps, Mobile Apps, Software",—,"San Francisco, California, United States, North America",www.thisapp.com,,"$2,225,000",Seed,3,—,6
Pre Seed Round - SprigHub Inc,Pre-Seed,Seed,"$300,000","Feb 26, 2021",SprigHub Inc,"Leverage AI & machine-learning to measure, attribute and optimize marketing spend in real-time.",Machine Learning,—,"San Francisco, California, United States, North America",www.sprighub.ai,,"$600,000",Seed,3,—,1
Seed Round - OpsCruise,Seed,Seed,"$6,350,000","Feb 24, 2021",OpsCruise,OpsCruise automates the performance assurance of modern cloud applications using a model-based open source based observability platform.,"Application Performance Management, Cloud Infrastructure, Cloud Management, Developer Platform, Enterprise Software, Information Technology, Software Engineering",—,"Santa Clara, California, United States, North America",www.opscruise.com,,"$6,750,000",M&A,2,The Fabric,5
Pre Seed Round - Jax Rideshare Rentals,Pre-Seed,Seed,"$500,000","Mar 31, 2021",Jax Rideshare Rentals,Jax is a car rental marketplace connecting rideshare & delivery drivers without vehicle access to fleet owners with excess vehicle inventory,"Advertising, Automotive, Collaborative Consumption, Electric Vehicle, Marketplace, Rental",—,"Atlanta, Georgia, United States, North America",www.ridewithjax.com,,"$1,200,000",Seed,3,Collab Capital,1
Seed Round - DIMA,Seed,Seed,"$110,000","Mar 1, 2021",DIMA,"Corporate data assistant. Derives insights, forecasts and visualizes data in natural language.","Artificial Intelligence, Big Data, Business Intelligence, Data Visualization, Machine Learning, Predictive Analytics",—,"New York, New York, United States, North America",dima.website,,"$110,000",Seed,2,—,1
Seed Round - Trace,Seed,Seed,"$8,300,000","Mar 23, 2021",Trace,"Trace provides collaborative workflows and analytics for companies to better manage financial services like budgeting, spending, and hiring.","Analytics, Enterprise Software, Financial Services, FinTech, Information Technology, SaaS, Software",—,"San Francisco, California, United States, North America",www.tracehq.com,,"$8,300,000",Seed,1,"Greylock, Uncork Capital",5
Pre Seed Round - Jeevam Health,Pre-Seed,Seed,"$150,000","Feb 20, 2021",Jeevam Health,"Holistic care app to treat chronic conditions: Thyroid, PCOS, Pregnancy Challenges.",Health Care,—,"San Francisco, California, United States, North America",www.jeevamhealth.com/,,"$700,000",Seed,2,—,1
Seed Round - Brella,Seed,Seed,"$7,791,342","Apr 6, 2021",Brella,Brella is a child care center that provides flexible scheduling and quality care.,"Child Care, Children, Education, Health Care","Women Founded, Women Led","Los Angeles, California, United States, North America",www.hellobrella.com/,,"$12,791,342",Seed,2,—,3
Seed Round - Amplify Additive,Seed,Seed,"$1,107,733","Mar 29, 2021",Amplify Additive,Amplify Additive is an early-stage private company that focuses on metal additive manufacturing.,"3D Printing, Industrial, Manufacturing",—,"Scarborough, Maine, United States, North America",amplifyadditive.com/,,"$3,114,733",M&A,4,—,—
Seed Round - Coverlease,Seed,Seed,"$1,000,000","Mar 15, 2021",Coverlease,Coverlease helps derive trends and insights into commercial real estate markets.,"Analytics, Business Intelligence, Commercial Real Estate",—,"Bayport, Minnesota, United States, North America",coverlease.com/,,"$2,373,860",Seed,3,—,1
Seed Round - Upside Health,Seed,Seed,"$50,000","Feb 18, 2021",Upside Health,"At Upside Health, we’re transforming the way chronic pain is assessed and treated.","Health Care, Software, Wellness","Women Founded, Women Led","South Orange, New Jersey, United States, North America",upside.health,,"$635,000",Seed,9,Cedars-Sinai Accelerator,1
Seed Round - Wayfinder,Seed,Seed,"$1,500,000","Mar 3, 2021",Wayfinder,Project Wayfinder designed for all students to develop lives of meaning and purpose.,"EdTech, Education",—,"Berkeley, California, United States, North America",www.projectwayfinder.com/,,"$8,100,000",Early Stage Venture,2,—,3
Seed Round - Lopaus Point,Seed,Seed,"$350,000","Feb 19, 2021",Lopaus Point,"Lopaus Point offers gluten-free waffles that use whole, organic fruit to lightly sweeten its batters.","Food and Beverage, Organic Food, Snack Food",—,"Columbus, Ohio, United States, North America",www.lopauspoint.com/,,"$450,000",Seed,2,—,—
Seed Round - Apotheka Systems Inc.,Seed,Seed,"$128,168","Mar 31, 2021",Apotheka Systems Inc.,Decentralizing Self-sovereign Identity and Personal Records Securely On Blockchain,"Blockchain, Cloud Computing, Cyber Security, Digital Entertainment, Enterprise Software, Information Technology, Sports",—,"Beverly Hills, California, United States, North America",www.apotheka.co/,,"$378,168",Seed,2,—,—
Seed Round - COI Energy Services,Seed,Seed,"$2,500,000","Mar 16, 2021",COI Energy Services,COI Energy Services provides energy technology solutions to electric utility companies.,"Electronics, Energy, Renewable Energy","Black / African American Founded, Black / African American Led, Women Founded, Women Led","Tampa, Florida, United States, North America",www.coienergyservices.com/,,"$2,500,000",Seed,4,—,—
Seed Round - SchoolHouse,Seed,Seed,"$8,100,000","Apr 8, 2021",SchoolHouse,SchoolHouse is an EdTech startup that provides micro schooling and home education solutions.,"E-Learning, EdTech, Education",—,"New York, New York, United States, North America",www.getschoolhouse.com/,,"$8,100,000",Seed,1,Pace Capital,6
Seed Round - CopyAI,Seed,Seed,"$2,900,000","Mar 17, 2021",CopyAI,CopyAI is a startup building AI-powered copywriting tools for business customers.,"Analytics, Artificial Intelligence, Marketing Automation, Productivity Tools",—,"Memphis, Tennessee, United States, North America",www.copy.ai,,"$13,900,000",Early Stage Venture,3,Craft Ventures,3
Seed Round - Docyt,Seed,Seed,"$1,500,000","Feb 25, 2021",Docyt,Docyt is a real-time accounting automation platform.,"Accounting, Artificial Intelligence, Machine Learning, Mobile",—,"Sunnyvale, California, United States, North America",www.docyt.com,,"$13,000,000",Early Stage Venture,5,First Rays Venture Partners,2
Seed Round - Praxis,Seed,Seed,"$3,200,000","Feb 26, 2021",Praxis,Praxis is a 501c3 venture group that equips entrepreneurs motivated by their faith to create cultural and societal impact.,"Finance, Financial Services, Venture Capital",—,"New York, New York, United States, North America",www.praxislabs.org,,"$3,200,000",Seed,1,—,4
Pre Seed Round - Indie Apps,Pre-Seed,Seed,"$50,000","Feb 13, 2021",Indie Apps,Indie Apps is a community-oriented mobile and web applications development venture by Witty Idiots.,"Android, Apps, Developer APIs, EdTech, Information Technology, iOS, Mobile Apps, PaaS, Software",—,"Austin, Texas, United States, North America",www.indieapps.us,,"$60,000",Seed,2,Sagar Gulati,1
Pre Seed Round - AccurKardia,Pre-Seed,Seed,"$340,000","Apr 1, 2021",AccurKardia,AccurKardia offers automated clinical-grade ECG interpretation software to cardiac monitoring companies.,"Analytics, Artificial Intelligence, Health Diagnostics, Internet of Things, Medical","Hispanic / Latine Founded, Hispanic / Latine Led, South Asian Founded, South Asian Led","New York, New York, United States, North America",www.accurkardia.com/,,"$4,270,000",Seed,5,—,—
Seed Round - Area4 Labs,Seed,Seed,"$1,500,000","Apr 8, 2021",Area4 Labs,Hearby is a live music discovery app providing information on live music shows.,Music,—,"Cambridge, Massachusetts, United States, North America",www.hearby.com,,"$2,530,000",Seed,2,"Namier Capital Partners, Simon Murdoch",2
Seed Round - Fanbase,Seed,Seed,"$3,500,588","Apr 9, 2021",Fanbase,"Fanbase is a photo, video, audio chat, live streaming, and long-form video app that enables users to monetize their posts via subscribers.",Social Media,—,"Atlanta, Georgia, United States, North America",fanbase.app/,,"$9,520,588",Seed,5,—,—
Seed Round - Spot,Seed,Seed,"$1,700,000","Apr 8, 2021",Spot,Spot is the virtual hub for the organization– bringing the spirit and utility of being in the same physical office to a digital experience.,"Internet, Virtual Workforce, Virtual World, Web Design",—,"Seattle, Washington, United States, North America",www.spotvirtual.com/,,"$7,200,000",Seed,2,Founders' Co-op,1
Seed Round - Blaze Global,Seed,Seed,"$150,000","Apr 1, 2021",Blaze Global,"SaaS platform that simplifies, activates and measure social and emotional development among students, teachers and parents.","Education, Family, SaaS, Social Impact, Software, Web Apps",—,"Chicago, Illinois, United States, North America",blaze.school,,"$526,000",Seed,3,—,—
Pre Seed Round - Reyets: Social Justice Network,Pre-Seed,Seed,"$60,000","Apr 1, 2021",Reyets: Social Justice Network,"Reyets empowers safer community / police interactions through mobile enabled education, resource sharing, reporting and data analysis.","CivicTech, Communities, GovTech, Journalism, Law Enforcement, Legal, Legal Tech, Mobile Apps, Public Safety, Video Streaming","Black / African American Led, Middle Eastern / North African Founded, Middle Eastern / North African Led","Arlington, Virginia, United States, North America",www.reyets.com,,"$295,000",Seed,6,—,—
Seed Round - Malomo,Seed,Seed,"$5,000,000","Apr 7, 2021",Malomo,Malomo is a shipment tracking platform for ecommerce businesses.,"E-Commerce, Information Technology, SaaS, Shipping, Software",Black / African American Founded,"Indianapolis, Indiana, United States, North America",gomalomo.com,,"$8,300,000",Seed,3,Base10 Partners,10
Pre Seed Round - Nine Times Bakery,Pre-Seed,Seed,"$125,000","Feb 15, 2021",Nine Times Bakery,"Nine Times Bakery sells gifts, cakes, cake balls, and cookies.",Food and Beverage,—,"Chicago, Illinois, United States, North America",www.ninetimesbakery.com,,"$125,000",Seed,1,—,—
