Seed Round - Shotzr,Seed,Seed,"$929,054","Apr 8, 2021",Shotzr,Shotzr’s AI makes sure you deliver the perfect image for every marketing moment – from your image library or ours.,"Artificial Intelligence, Digital Marketing, Digital Media, Machine Learning, Photography, Social Media, Social Media Marketing",—,"Denver, Colorado, United States, North America",www.shotzr.com/,,"$3,729,054",M&A,2,—,—
Seed Round - Forcyte Biotechnologies,Seed,Seed,"$25,000","Mar 25, 2021",Forcyte Biotechnologies,Forcyte Biotechnologies is a Biotech Company.,"Biotechnology, Health Care",—,"Los Angeles, California, United States, North America",forcytebio.com/,,"$25,000",—,5,—,1
Seed Round - Vitalink,Seed,Seed,"$15,000","Apr 12, 2021",Vitalink,Vitalink is a biotech smartwatch accessory company that will increase users quality of life by-altering.,"Biotechnology, Life Science",—,"San Francisco, California, United States, North America",,,"$15,000",Seed,1,Sunstone Innovation Challenge,1
Seed Round - Empathy,Seed,Seed,"$13,000,000","Apr 6, 2021",Empathy,Empathy is a platform for families to deal with the loss of a loved one.,"Apps, Health Care, Information Technology, Software",—,"New York, New York, United States, North America",www.empathy.com/,,"$43,000,000",Early Stage Venture,2,"Aleph, General Catalyst",2
Pre Seed Round - Canid,Pre-Seed,Seed,"$1,000,000","Feb 24, 2021",Canid,Canid simplifies pediatricians’ work by redesigning how the vaccination process works.,"Data Center Automation, Health Care, Wellness",—,"New York, New York, United States, North America",www.canid.io/,,"$1,000,000",—,3,—,6
Pre Seed Round - Konduit,Pre-Seed,Seed,"$1,165,000","Mar 1, 2021",Konduit,Konduit is a no-code fintech infrastructure allowing banks quickly onboard and adopts third-party fintech solutions.,"Financial Services, FinTech","South Asian Founded, Southeast Asian Led","Reston, Virginia, United States, North America",www.konduitworks.com,,"$1,285,000",Seed,2,—,2
Pre Seed Round - OPiO,Pre-Seed,Seed,"$250,000","Feb 22, 2021",OPiO,Hardware as a Service (HaaS),"Hardware, Medical, Robotics",—,"Kalispell, Montana, United States, North America",opioconnect.com,,"$2,525,000",Seed,2,—,—
Seed Round - RECUR,Seed,Seed,"$5,000,000","Mar 25, 2021",RECUR,"RECUR designs and develops on-chain branded experiences for fans to buy, collect, and re-sell NFTs.","Blockchain, Information Technology, Marketplace, Software",—,"Miami, Florida, United States, North America",www.recurforever.com,,"$55,000,000",Early Stage Venture,2,—,12
Pre Seed Round - Phalanx,Pre-Seed,Seed,"$160,000","Mar 22, 2021",Phalanx,Phalanx stops cyber threats at the human layer with zero trust data security and provides seamless data security designed for productivity.,"Big Data, Cyber Security, Data Integration, Data Storage, Database, Information Technology, Software",—,"Arlington, Virginia, United States, North America",www.phalanx.io/,,"$160,000",Seed,2,Techstars,1
Seed Round - KAUEL,Seed,Seed,"$700,000","Mar 13, 2021",KAUEL,AI Specialists - Software Develpoment.,"Artificial Intelligence, Augmented Reality, Big Data, Software, Virtual Reality",—,"Menlo Park, California, United States, North America",kauel.com/,,"$2,500,000",Seed,3,Invexor Venture Partners,1
Seed Round - Light Wave,Seed,Seed,"$240,000","Mar 22, 2021",Light Wave,Light Wave Dental provides non-clinical management services to top tier dental practices.,"Consumer, Dental, Health Care",—,"Stafford, Virginia, United States, North America",www.lightwavedental.com/,,"$1,460,603",M&A,4,—,—
Seed Round - AMPM,Seed,Seed,"$219,000","Mar 1, 2021",AMPM,A marketing communications agency.,"Advertising, Marketing",—,"Midland, Michigan, United States, North America",www.ampminc.com/,,"$219,000",Seed,1,—,2
Pre Seed Round - WEVO,Pre-Seed,Seed,"$4,100,000","Feb 19, 2021",WEVO,WEVO is a UX research platform that uncovers statistically significant user insights in a fraction of the time of typical tools.,"Artificial Intelligence, Enterprise Software, Machine Learning, Predictive Analytics, UX Design, Web Design",Women Founded,"Boston, Massachusetts, United States, North America",www.wevo.ai,,"$12,801,470",Seed,7,—,—
Pre Seed Round - Khenda,Pre-Seed,Seed,"€220,000","Apr 5, 2021",Khenda,Khenda offers a SaaS platform to increase efficiency in manufacturing lines with AI-powered Video Analytics.,"Analytics, Artificial Intelligence, Information Technology, Machine Learning",—,"Lewes, Delaware, United States, North America",www.khenda.com/,,"$1,259,973",Seed,2,Diffusion Capital Partners,1
Seed Round - AIBrew Corp,Seed,Seed,"CN¥10,000,000","Mar 24, 2021",AIBrew Corp,"iGulu the world’s smartest beer brew appliance, selected as an CES 2017 Innovation Award that will change the conventional way of beer brew","Brewing, Craft Beer, Electronics",—,"Los Angeles, California, United States, North America",www.igulu.com,,"$2,351,661",Seed,2,—,—
Seed Round - EZE,Seed,Seed,"$133,000","Feb 28, 2021",EZE,"EZE is a DeFi cryptocurrency investment management platform that connects new retail investors with professional traders, benefiting both.","Blockchain, Cryptocurrency, Finance, Financial Exchanges, FinTech, Information Technology",—,"New York, New York, United States, North America",eze.finance,,"$133,000",Seed,1,—,2
Seed Round - hampr,Seed,Seed,"$1,500,000","Mar 17, 2021",hampr,hampr is an app-based laundry delivery service company that features transparent pricing and next-day service.,"E-Commerce, Home Services, Laundry and Dry-cleaning, Mobile Apps","Women Founded, Women Led","Lafayette, Louisiana, United States, North America",tryhampr.com,,"$9,168,495",—,7,—,—
Pre Seed Round - Beemmunity,Pre-Seed,Seed,"$250,000","Mar 5, 2021",Beemmunity,Pollinator rewilding kits. Sustainably made and released in batches to rebridge pollinator habitats from your backyard.,"AgTech, Natural Resources, Social Impact, Sustainability",—,"Boulder, Colorado, United States, North America",www.beemmunity.co,,"$250,000",Seed,1,SOSV,2
Seed Round - Rinsed,Seed,Seed,"$3,000,000","Mar 22, 2021",Rinsed,Rinsed is a provider of easy-to-use customer relationship management software for the car wash industry.,Software,—,"New York, New York, United States, North America",www.rinsed.co/,,"$35,000,000",Early Stage Venture,3,—,3
Pre Seed Round - Whelp,Pre-Seed,Seed,"$120,000","Apr 5, 2021",Whelp,Conversational Commerce Platform,"Artificial Intelligence, Big Data, Call Center, Customer Service, E-Commerce, Information Technology, SaaS, Small and Medium Businesses, Software",—,"New York, New York, United States, North America",whelp.co,,"$250,000",Seed,5,Techstars,1
Seed Round - Tile Five,Seed,Seed,"$1,500,000","Mar 1, 2021",Tile Five,Tile Five is is currently operating in Stealth mode.,Technical Support,—,"Kansas City, Missouri, United States, North America",www.tilefive.com/,,"$1,500,000",Seed,1,—,1
Seed Round - FlickPlay,Seed,Seed,"$5,000,000","Mar 20, 2021",FlickPlay,FlickPlay is a Web3 social app where users may use NFTs to create AR films by unlocking them in the physical world.,"Blockchain, Consumer Software, Internet",—,"Los Angeles, California, United States, North America",www.flickplay.co/,,"$5,000,000",Seed,3,—,8
Seed Round - HowMuchTravel,Seed,Seed,"$110,000","Mar 1, 2021",HowMuchTravel,"Planning a travel budget in 3 minutes. We calculate the estimated budget of the trip, recommend places and help to save money.","Information Technology, Travel",—,"New York, New York, United States, North America",howmuchtravel.com,,"$110,000",Seed,1,—,1
Pre Seed Round - MiPro,Pre-Seed,Seed,"$350,000","Mar 1, 2021",MiPro,A global sports technology startup dedicated to developing tools and resources to support underserved athletes.,Software,—,"Atlanta, Georgia, United States, North America",www.miprohub.com/,,"$350,000",Seed,1,—,—
Seed Round - SafeStamp Inc,Seed,Seed,"$1,442,393","Mar 17, 2021",SafeStamp Inc,SafeStamp seeks to redefine protection against counterfeit products in the pharmaceutical industry.,"Biotechnology, Health Care",—,"Austin, Texas, United States, North America",safestamp.com/,,"$2,073,593",Seed,2,—,—
Pre Seed Round - Black Oak TV,Pre-Seed,Seed,"$120,000","Feb 16, 2021",Black Oak TV,"Black Oak TV focuses on digital media, film, television, video streaming, and content such as black web series.","Film, Film Production, Video Streaming","Black / African American Founded, Black / African American Led","New York, New York, United States, North America",beta.blackoak.tv,,"$1,620,000",Seed,2,Techstars,2
Seed Round - Overland-E,Seed,Seed,"£250,000","Mar 1, 2021",Overland-E,"Overland-E focuses on building vehicles, automotive capability, experiences, and technology.",Automotive,—,"Wilmington, Delaware, United States, North America",www.overland-e.com/,,"£250,000",Seed,1,Pario Ventures,1
Pre Seed Round - Volv,Pre-Seed,Seed,"$150,000","Feb 16, 2021",Volv,An app that uses AI to curate content from the internet and deliver it to you in 9-second reads.,"Media and Entertainment, Mobile Apps, News",—,"New York, New York, United States, North America",www.volvmedia.com,,"$150,000",Seed,1,—,1
Seed Round - Jasper Health,Seed,Seed,"$6,750,850","Mar 12, 2021",Jasper Health,"Jasper Health provides personalized support to patients living with cancer, regardless of income.","Health Care, Medical, Wellness",—,"Boise, Idaho, United States, North America",www.hellojasper.com,,"$31,750,850",Early Stage Venture,2,7wire Ventures,1
Pre Seed Round - PetroFunders,Pre-Seed,Seed,"$878,140","Feb 26, 2021",PetroFunders,PetroFunders is a fintech-powered investment platform creating access to oil and gas income.,"Financial Services, FinTech, Funding Platform, Oil and Gas",—,"Lakewood, Colorado, United States, North America",petrofunders.com/,,"$878,140",Seed,1,—,—
Seed Round - ScopeStack,Seed,Seed,"$250,000","Mar 30, 2021",ScopeStack,ScopeStack develops a web-based platform for IT and engineering professionals that provides a simple-step pricing tool.,"Information Technology, Software",—,"Greenville, South Carolina, United States, North America",scopestack.io/,,"$2,050,000",Early Stage Venture,4,"SC Launch, Inc.",1
Pre Seed Round - True-Tickets,Pre-Seed,Seed,"$1,697,500","Mar 12, 2021",True-Tickets,"A secure contactless digital ticket delivery service that aims to make buying, selling and transferring live event tickets simple and safe.","B2B, Blockchain, Information Technology, PaaS, Ticketing",—,"Boston, Massachusetts, United States, North America",www.true-tickets.com,,"$11,332,501",Seed,9,—,—
Seed Round - Lovd.com,Seed,Seed,"$4,500,000","Mar 1, 2021",Lovd.com,Buy and sell previously Lovd goods. We'll pick up and deliver in 24 hours.,"Advertising Platforms, E-Commerce, Internet, Marketplace, Sharing Economy, Social, Social Shopping",—,"New York, New York, United States, North America",www.lovd.com,,"$4,500,000",Seed,1,—,14
Seed Round - City-State Brewing,Seed,Seed,"$60,000","Apr 12, 2021",City-State Brewing,City-State Brewing is a packaging craft microbrewery that sells and distributes its beers.,"Manufacturing, Product Management, Wine And Spirits",Women Founded,"Washington, District of Columbia, United States, North America",citystatebrewing.com,,"$60,000",Seed,1,—,—
Pre Seed Round - Casatera,Pre-Seed,Seed,"$300,000","Apr 1, 2021",Casatera,"Premium, zero sugar, zero carb Tequila seltzer brand using Tequila from an award-winning distillery in Mexico.",Wine And Spirits,—,"New York, New York, United States, North America",www.drinkcasatera.com,,"$1,650,800",Seed,3,—,—
Seed Round - Droplet,Seed,Seed,"$2,000,000","Apr 1, 2021",Droplet,Droplet offers digital process automation solutions that eliminate the need for paper documents and time-consuming approval workflows.,"Document Management, Information Technology, Professional Services, Software, Web Design",—,"Lehi, Utah, United States, North America",droplet.io,,"$2,100,000",Seed,2,Pelion Venture Partners,1
Pre Seed Round - FloVision Solutions,Pre-Seed,Seed,"$270,000","Mar 3, 2021",FloVision Solutions,"FloVision Solutions is a food analytic platform that optimizes supplier comparative analysis, meal performance, and food wastage.","Analytics, Food and Beverage, Machine Learning, Software, Waste Management",—,"South Bend, Indiana, United States, North America",flovisionsolutions.com,,"$1,370,000",Seed,4,Plug and Play Ventures,5
Seed Round - ZwitterCo,Seed,Seed,"$5,900,000","Mar 18, 2021",ZwitterCo,ZwitterCo provides membrane solutions for the treatment of highly-impaired wastewater.,"Environmental Consulting, Health Care, Renewable Energy",—,"Cambridge, Massachusetts, United States, North America",www.zwitterco.com,,"$40,375,000",Early Stage Venture,5,MANN+HUMMEL,2
Seed Round - California Ethanol + Power,Seed,Seed,"$56,250","Feb 22, 2021",California Ethanol + Power,California Ethanol + Power produces sustainable renewable low-carbon energy from the right renewable resource sugarcane.,"Energy, Environmental Consulting, Renewable Energy",—,"Brawley, California, United States, North America",www.californiaethanolpower.com/,,"$12,274,250",Seed,5,—,—
Seed Round - Simetric,Seed,Seed,"$1,000,000","Mar 1, 2021",Simetric,Simetric is a software company providing real-time insights across carriers for the global scale of connected devices.,"Analytics, Information Technology, Internet, Internet of Things, Predictive Analytics, Software",—,"Alpharetta, Georgia, United States, North America",simetric.com,,"$3,228,000",Seed,4,Ocean Azul Partners,2
Seed Round - Popl,Seed,Seed,"$2,200,000","Mar 23, 2021",Popl,Popl allows users to share their social media and contact info with a tap.,"Consumer Electronics, Social Entrepreneurship, Software",—,"Los Angeles, California, United States, North America",popl.co,,"$2,375,000",Seed,3,—,5
Seed Round - DepositLink,Seed,Seed,"$3,500,000","Mar 17, 2021",DepositLink,DepositLink is a digital solution for real estate companies and their agents to collect deposits and commissions electronically.,"FinTech, Mobile Payments, Real Estate, Web Apps",—,"Boston, Massachusetts, United States, North America",www.depositlink.com/,,"$6,500,000",Seed,2,—,—
Pre Seed Round - Tessera,Pre-Seed,Seed,"$500,000","Mar 31, 2021",Tessera,"Tessera is where you go to own, govern, and experience extraordinary things through NFTs, together.","Blockchain, Cryptocurrency",—,"New York, New York, United States, North America",tessera.co,,"$43,944,987",Early Stage Venture,4,Robot Ventures,1
Seed Round - PLLAY Labs,Seed,Seed,"$1,000,000","Apr 6, 2021",PLLAY Labs,PLLAY Labs is an AI-driven video game mobile wagering app creating the most exciting competitive gaming entertainment.,"Artificial Intelligence, Blockchain, Cryptocurrency, Gaming, Media and Entertainment, Video Games, Video Streaming","Black / African American Founded, Black / African American Led, East Asian Founded, Women Founded","Philadelphia, Pennsylvania, United States, North America",www.pllay.me/,,"$4,000,000",Seed,3,Gayle Jennings O'Byrne,1
Pre Seed Round - Smartbin,Pre-Seed,Seed,"$120,000","Apr 5, 2021",Smartbin,Automated Indoor Waste & Recycling System,"Internet of Things, Sensor, Smart Building, Waste Management",—,"Walnut, California, United States, North America",www.smartbin.io,,"$240,000",Seed,6,Techstars,1
Seed Round - Babylon Micro-Farms,Seed,Seed,"$3,000,000","Mar 7, 2021",Babylon Micro-Farms,Babylon Micro-Farms offers on-demand indoor farming technology to make sustainable indoor farming accessible.,"Agriculture, AgTech, Horticulture",—,"Richmond, Virginia, United States, North America",www.babylonmicrofarms.com,,"$19,097,158",Early Stage Venture,12,Center for Innovative Technology,4
Pre Seed Round - Truly O2,Pre-Seed,Seed,"$100,000","Mar 12, 2021",Truly O2,Truly O2 is a manufacturer of anti-aging and Oxygen-enriched skincare products.,"Consumer Goods, Cosmetics, Manufacturing",—,"Boulder, Colorado, United States, North America",www.trulyo2.com/,,"$100,000",Seed,1,—,—
Seed Round - UptimeAI,Seed,Seed,"$1,500,000","Feb 16, 2021",UptimeAI,UptimeAI specializes in AI-based predictive maintenance software for heavy industries.,"Artificial Intelligence, Industrial, Machine Learning, Software",—,"San Francisco, California, United States, North America",www.uptimeai.com/,,"$5,006,792",Seed,3,YourNest Venture Capital,1
Seed Round - Thomas Johnson Surgery Center,Seed,Seed,"$185,000","Mar 9, 2021",Thomas Johnson Surgery Center,Thomas Johnson Surgery Center is a healthcare facility that combines a comfortable and relaxed atmosphere with the latest technology.,"Health Care, Hospital, Wellness",—,"Frederick, Maryland, United States, North America",tjsurgery.com/,,"$185,000",Seed,1,—,—
Seed Round - Partnered,Seed,Seed,"$200,000","Mar 1, 2021",Partnered,Partnered provides sponsorship management solutions.,"CRM, Professional Networking, Sales Automation",—,"San Francisco, California, United States, North America",www.partnered.com,,"$200,000",Seed,2,—,2
Seed Round - Slapdash,Seed,Seed,"$3,700,000","Mar 18, 2021",Slapdash,A unified interface for cloud applications,"Information Technology, Internet, Software",—,"San Francisco, California, United States, North America",slapdash.com,,"$3,700,000",M&A,2,—,7
Seed Round - GO Sleeves,Seed,Seed,"$175,000","Mar 4, 2021",GO Sleeves,"GO Sleeves offers a compression sleeve that reduces inflammation, lactic acid build-up, and accelerates muscle recovery.","Consumer Goods, Fitness, Sports, Wellness",—,"Minden, Nevada, United States, North America",gosleeves.com/,,"$175,000",Seed,1,—,—
Seed Round - Manetu,Seed,Seed,"$2,372,225","Mar 4, 2021",Manetu,Manetu is a data security platform that allows sensitive data to be protected while still being used for legitimate purposes.,"Consumer, Identity Management, Information Services",—,"Ridgewood, New Jersey, United States, North America",www.manetu.com/,,"$5,872,225",Seed,4,—,—
Seed Round - Esprezzo,Seed,Seed,"$2,000,000","Mar 24, 2021",Esprezzo,No-code automation platform for crypto and blockchain,"Blockchain, Cryptocurrency, Developer Platform, Developer Tools, Mobile, PaaS, Software, Web Development, Web Hosting",—,"Boston, Massachusetts, United States, North America",esprezzo.io,,"$2,000,000",Seed,2,Mark Cuban,10
Seed Round - Marché Health,Seed,Seed,"$1,000,000","Mar 9, 2021",Marché Health,Marché Health is the world's leading digital health and health IT software and services review platform.,"Health Care, SaaS, Software",—,"Rochester, New York, United States, North America",marche.health,,"$1,000,000",Seed,1,Pandion Optimization Alliance,1
Pre Seed Round - The Defiant,Pre-Seed,Seed,"$1,400,000","Apr 12, 2021",The Defiant,The Defiant operates as an information company at the intersection of tech and finance.,"Finance, Information Services, News",—,"New York, New York, United States, North America",thedefiant.io/,,"$1,400,000",Seed,1,—,27
Seed Round - O'MY Foods,Seed,Seed,"$337,000","Apr 1, 2021",O'MY Foods,"O’MY is a women-owned business that crafts creamy, simply made gelato that more people can enjoy.","Food and Beverage, Food Processing, Nutrition","Women Founded, Women Led","Richmond, Virginia, United States, North America",omygelato.com/,,"$1,849,500",Seed,3,—,—
Pre Seed Round - Nala Robotics,Pre-Seed,Seed,"$1,900,000","Mar 1, 2021",Nala Robotics,Worlds first fully automated restaurant kitchen,"Food and Beverage, Restaurants, Robotics",—,"Arlington Heights, Illinois, United States, North America",nalarobotics.com/,,"$1,900,000",Seed,1,—,—
Pre Seed Round - Delos Insurance,Pre-Seed,Seed,"$560,000","Feb 15, 2021",Delos Insurance,Delos is a digital property insurance provider for customers in high catastrophe risk regions.,"Aerospace, Big Data, Computer Vision, Financial Services, Insurance, InsurTech, Predictive Analytics, Property Insurance","South Asian Founded, Women Founded","San Francisco, California, United States, North America",getdelos.com,,"$13,600,000",Seed,7,—,—
Pre Seed Round - Vinohead,Pre-Seed,Seed,"$150,000","Feb 16, 2021",Vinohead,Vinohead is a wine community and digital media platform.,"Content, Digital Media, Publishing, Wine And Spirits",—,"Los Angeles, California, United States, North America",www.vinohead.co,,"$150,000",Seed,1,—,1
Seed Round - Belliwelli,Seed,Seed,"$1,000,000","Mar 10, 2021",Belliwelli,"Belliwelli offers four gut-friendly, plant-based snack bars that caters to people with IBS.","Food and Beverage, Nutrition, Snack Food",—,"Los Angeles, California, United States, North America",belliwelli.com/,,"$16,393,200",—,4,Michael Costello,5
Seed Round - effa,Seed,Seed,"$310,000","Apr 12, 2021",effa,Effa is the first world's 100% renewable and recyclable toothbrush made of paper.,"CleanTech, Consumer Goods, Industrial Design, Manufacturing, Sustainability","Women Founded, Women Led","San Francisco, California, United States, North America",www.effa.one/,,"$560,000",Seed,5,—,—
Seed Round - Freeing Returns,Seed,Seed,"$55,000","Apr 2, 2021",Freeing Returns,Freeing Returns is a mobile phone app that offers users a unique way to return bought items to stores.,"Big Data, E-Commerce, Enterprise Software, Fraud Detection, Retail Technology, SaaS","Black / African American Led, Women Founded, Women Led","Atlanta, Georgia, United States, North America",www.freeingreturns.com,,"$480,000",Seed,5,—,1
Seed Round - Specificity,Seed,Seed,"$40,000","Feb 25, 2021",Specificity,Specificity is a digital marketing company that provides digital marketing campaigns for all sorts of businesses.,"Advertising, Digital Marketing, Marketing",—,"Largo, Florida, United States, North America",specificityinc.com/,,"$40,000",Seed,1,—,—
Seed Round - Heard Technologies,Seed,Seed,"$1,300,000","Mar 17, 2021",Heard Technologies,Heard Technologies operates as a financial back office for therapists.,"Accounting, Finance, Financial Services, Health Care, Software, Wellness",—,"San Francisco, California, United States, North America",www.joinheard.com/,,"$26,300,000",Early Stage Venture,4,Founders' Co-op,4
Pre Seed Round - Celeris Therapeutics,Pre-Seed,Seed,"€400,000","Mar 28, 2021",Celeris Therapeutics,Harnessing deep learning and lab automation to accelerate drug discovery in targeted protein degradation.,"Artificial Intelligence, Biotechnology, Information Technology, Life Science, Pharmaceutical",—,"Menlo Park, California, United States, North America",www.celeristx.com,,"€16,500,000",—,5,Longevitytech.fund,2
Seed Round - Daasity,Seed,Seed,"$3,400,000","Mar 26, 2021",Daasity,"Daasity enables Consumer Product Brands to make better data-driven decisions, leading to faster and more profitable growth.","Analytics, Data Integration, Data Visualization, E-Commerce",—,"San Diego, California, United States, North America",www.daasity.com,,"$20,700,000",Early Stage Venture,4,VMG Partners,9
Pre Seed Round - Rejoy Health,Pre-Seed,Seed,"$400,000","Mar 25, 2021",Rejoy Health,AI powered platform to manage musculoskeletal conditions,Health Care,—,"New York, New York, United States, North America",www.rejoyhealth.com/,,"$7,125,000",Early Stage Venture,4,—,—
Pre Seed Round - Boundless Robotics,Pre-Seed,Seed,"$765,000","Mar 1, 2021",Boundless Robotics,On a mission to help people effortlessly grow 5% of their food by 2030.,"Artificial Intelligence, Health Care",—,"Boston, Massachusetts, United States, North America",boundlessrobotics.com,,"$1,955,000",Seed,3,Dux Capital,1
Seed Round - Crave Hospitality Group,Seed,Seed,"$4,900,000","Mar 15, 2021",Crave Hospitality Group,"First Technology Platform that integrates kitchens, marketing, ordering and delivery logistics",Food Delivery,—,"Boise, Idaho, United States, North America",www.cravehospitalitygroup.com,,"$16,450,000",Seed,4,StageDotO,1
Seed Round - LetusCloud,Seed,Seed,"$88,000","Apr 3, 2021",LetusCloud,LetusCloud is a company specialized in virtualization & cloud computing.,"Cloud Computing, Virtualization",—,"Anaheim, California, United States, North America",www.letuscloud.com,,"$592,500",Seed,5,—,1
Pre Seed Round - Retell,Pre-Seed,Seed,"$100,000","Mar 5, 2021",Retell,Retell is to build the biggest Audio AD network with websites converted into podcasts narrated by hight quality synthetic voices.,"Advertising, Audio, Digital Media, Internet Radio, Media and Entertainment, Music, News, Podcast",—,"Delaware, Ohio, United States, North America",retell.cc/,,"$600,000",Seed,3,—,—
Seed Round - Biodock,Seed,Seed,"$2,100,000","Mar 29, 2021",Biodock,Biodock offers a cloud AI platform that extracts answers from image data.,"Analytics, Artificial Intelligence, Machine Learning",—,"Austin, Texas, United States, North America",www.biodock.ai,,"$2,100,000",Seed,2,Andreessen Horowitz,6
Seed Round - Aloft Appraisal,Seed,Seed,"$5,000,000","Mar 1, 2021",Aloft Appraisal,Aloft Appraisal is a real estate valuation company.,"Information Services, Real Estate",—,"Seattle, Washington, United States, North America",aloftappraisal.com,,"$25,000,000",Early Stage Venture,2,Andreessen Horowitz,1
Seed Round - Reframe,Seed,Seed,"$1,400,000","Mar 8, 2021",Reframe,Reframe is an app to help people cut back on alcohol use and build healthier habits,"Apps, Fitness, Health Care, Wellness",—,"Atlanta, Georgia, United States, North America",www.joinreframeapp.com/,,"$27,425,000",—,5,Atlanta Ventures,4
Pre Seed Round - HiCounselor,Pre-Seed,Seed,"$600,000","Mar 10, 2021",HiCounselor,HiCounselor is a career accelerator that combines technology & professional mentorship to help job seekers land a job in tech faster,"Education, Internet, Training",—,"San Francisco, California, United States, North America",hicounselor.com/,,"$1,890,000",Seed,2,Heroic Ventures,1
