Seed Round - Facet Data,Seed,Seed,"$8,000,000","Jun 22, 2021",Facet Data,Facet Data provides exploratory analytics platform services.,"Analytics, Productivity Tools, Software",—,"New York, New York, United States, North America",www.facetdata.com/,,"$8,000,000",Seed,1,Harrison Metal,7
Seed Round - CarrTech,Seed,Seed,"$1,100,000","May 20, 2021",CarrTech,"CarrTech has built an all-in-one filter and needle combined pioneering a safer, more efficient, cost-effective way of medication delivery.","Health Care, Medical Device",Women Led,"Frederick, Maryland, United States, North America",carrtechcorp.com,,"$2,150,000",Seed,4,TEDCO,1
Seed Round - Scholars App,Seed,Seed,"$2,550,000","Jun 2, 2021",Scholars App,"Scholars App is a platform for scholarship providers to track, manage, and receive more qualified and completed applications.","Apps, EdTech, Education, Higher Education",—,"San Francisco, California, United States, North America",scholarsapp.com,,"$2,550,000",Seed,2,—,1
Seed Round - Brinter,Seed,Seed,"€1,200,000","Jun 10, 2021",Brinter,"Brinter is a BioTech/MedTech company. Our core business to develop, license and sell our in-house applications.","3D Printing, Biopharma, Biotechnology, Health Care, Life Science, Medical Device, Pharmaceutical",—,"Santa Monica, California, United States, North America",www.brinter.com/,,"€1,200,000",Seed,1,Innovestor,1
Pre Seed Round - ClearSpend,Pre-Seed,Seed,"$2,587,788","Jun 1, 2021",ClearSpend,Tomorrow's expense management platform. Designed and built specifically for small businesses and their accountants.,"Financial Services, FinTech",—,"Charlotte, North Carolina, United States, North America",www.clearspend.com,,"$2,587,788",Seed,1,—,—
Pre Seed Round - Minti,Pre-Seed,Seed,"$1,000,000","Jun 1, 2021",Minti,Minti helps creators auto-mint social posts as non-fungible tokens.,"Cryptocurrency, Social Media",—,"New York, New York, United States, North America",www.mintiapp.com/,,"$1,000,000",Seed,1,—,8
Seed Round - Echofi,Seed,Seed,"$4,200","Jun 1, 2021",Echofi,"Echofi is a social investing platform where anyone can share, make money from, and invest in great investment portfolios","Finance, Financial Services, FinTech",—,"New York, New York, United States, North America",echofi.co,,"$4,200",Seed,1,—,1
Pre Seed Round - Gyfted,Pre-Seed,Seed,"$630,000","Jun 20, 2021",Gyfted,Your Recruiting Assistant on AI steroids. Personalized using scalable assessments,"Artificial Intelligence, Marketplace, Predictive Analytics, Psychology, Recruiting, Skill Assessment",—,"Palo Alto, California, United States, North America",www.gyfted.me/,,"$630,000",Seed,3,—,—
Seed Round - Shappi,Seed,Seed,"$1,000,000","May 18, 2021",Shappi,Connecting Consumers with Verified Travelers to deliver international products by renting the Traveler’s luggage space.,—,"Hispanic / Latine Founded, Hispanic / Latine Led, Women Founded, Women Led","Los Angeles, California, United States, North America",shappi.com/,,"$3,150,000",Seed,3,"Concrete Rose Capital, Sixers Innovation Lab",6
Seed Round - Skyfish,Seed,Seed,"$20,000,000","Jun 29, 2021",Skyfish,SkyFish is architected to seamlessly connect to all your third party sensor hardware.,"Hardware, Sensor, Software",—,"Missoula, Montana, United States, North America",skyfish.ai,,"$20,000,000",Seed,1,Henry Wolfond,2
Seed Round - oak9,Seed,Seed,"$5,900,000","Jun 2, 2021",oak9,Cybersecurity SaaS Platform for Developers,"Cyber Security, Developer Platform, Information Technology, SaaS, Security, Software",—,"Chicago, Illinois, United States, North America",www.oak9.io/,,"$13,900,000",—,2,Menlo Ventures,3
Seed Round - Myno Carbon,Seed,Seed,"$216,804","May 24, 2021",Myno Carbon,Myno Carbon develops and focuses on operations that restore the natural environment.,"CleanTech, Environmental Engineering, Sustainability",—,"Bainbridge Island, Washington, United States, North America",mynocarbon.com,,"$316,804",Seed,2,—,—
Seed Round - Ash Wellness,Seed,Seed,"$3,350,000","Jul 1, 2021",Ash Wellness,Ash Wellness is a remote diagnostics company that offers at-home diagnostic testing for customers and patients.,"Health Care, Health Diagnostics, mHealth, Wellness",Women Founded,"New York, New York, United States, North America",www.poweredbyash.com,,"$6,550,000",Seed,3,Merus Capital,5
Seed Round - ShelfLife,Seed,Seed,"$3,000,000","Jun 9, 2021",ShelfLife,The B2B Marketplace for Wholesale Ingredients,"E-Commerce, Food and Beverage, Supply Chain Management","Black / African American Founded, Women Founded, Women Led","New York, New York, United States, North America",www.shelflife.us,,"$3,000,000",Seed,2,"Kindred Ventures, Switch Ventures",6
Seed Round - DealCoachPro,Seed,Seed,"$150,000","Jun 29, 2021",DealCoachPro,"DealCoachPro enables Enterprise Sales organizations to use strategic, data-driven deal coaching, and deal execution to improve win rates.","B2B, Computer, SaaS, Software",—,"Boca Raton, Florida, United States, North America",www.dealcoachpro.com,,"$930,000",Seed,3,—,—
Seed Round - Mica Energies: Wireless Power,Seed,Seed,"$1,000","Jun 30, 2021",Mica Energies: Wireless Power,Mica Energies is developing a “Far-Field Communications (FFC)” approach to extracting RF energy from the surrounding environment.,Telecommunications,—,"Irvine, California, United States, North America",www.micaenergies.com,,"$125,700",Early Stage Venture,11,—,—
Pre Seed Round - Lula Convenience,Pre-Seed,Seed,"$1,000,000","Jun 10, 2021",Lula Convenience,Transforming the US Convenience Industry with a Business-in-a-Box Solution,"Business Intelligence, Delivery, Last Mile Transportation, Point of Sale, Retail, Retail Technology",—,"Philadelphia, Pennsylvania, United States, North America",www.lulaconvenience.com,,"$6,610,000",Seed,6,—,3
Seed Round - Thiozen,Seed,Seed,"$3,000,000","Jun 8, 2021",Thiozen,Thiozen develops novel hydrogen gas production technology designed to reduce greenhouse gases.,"Energy, Environmental Engineering, GreenTech",—,"Belmont, Massachusetts, United States, North America",thiozen.com,,"$3,254,400",Seed,2,Eni Next,3
Seed Round - HonestRobin,Seed,Seed,"$2,000,000","Jun 28, 2021",HonestRobin,The personal finance app for unwealthy,"Apps, Finance, Financial Services, FinTech, Gamification, Mobile Apps, Personal Finance",—,"New York, New York, United States, North America",www.honestrobin.com,,"$2,125,000",Seed,2,Global Founders Capital,3
Pre Seed Round - Ex-human,Pre-Seed,Seed,"$550,000","Jun 1, 2021",Ex-human,"Platform for AI Humans for immersive conversations. Our hyper-realistic characters boost engagement for games, datings and influencers.","Artificial Intelligence, Digital Entertainment, Machine Learning, Natural Language Processing, SaaS, Software",—,"San Francisco, California, United States, North America",exh.ai,,"$2,850,000",Seed,2,—,2
Seed Round - Dimension,Seed,Seed,"$1,500,000","Jun 1, 2021",Dimension,Dimension brings the waste management industry into the modern world.,"Information Technology, Internet, Mobile Apps, Software, Waste Management","Women Founded, Women Led","San Francisco, California, United States, North America",getdimension.com/,,"$12,500,000",Seed,4,—,1
Seed Round - Cooklist,Seed,Seed,"$2,805,309","Jun 22, 2021",Cooklist,"All-in-one grocery planning, inventory & cooking app","Apps, E-Commerce, Food and Beverage, Internet, Software",—,"Dallas, Texas, United States, North America",www.cooklist.co,,"$2,925,309",Seed,4,—,—
Seed Round - PechaKucha,Seed,Seed,"$2,700,000","Jul 2, 2021",PechaKucha,"PechaKucha is a communication platform that connects people through concise, visual storytelling.","Communities, Event Management, Events, Presentation Software, Presentations",—,"Chicago, Illinois, United States, North America",www.pechakucha.com,,"$2,700,000",Seed,1,—,4
Seed Round - Luxonis,Seed,Seed,"$2,000,000","Jul 1, 2021",Luxonis,Luxonis is a technology company that specializes in developing advanced computer vision and AI solutions for a wide range of applications.,"Artificial Intelligence, Computer, Information Technology, Machine Learning, Robotics",—,"Littleton, Colorado, United States, North America",www.luxonis.com,,"$4,775,042",—,2,—,—
Seed Round - Nicslab,Seed,Seed,"$120,000","Jun 7, 2021",Nicslab,Nicslab offers chip-scale and OEM/ODM solutions.,"Artificial Intelligence, Information Technology, Product Design",—,"Palo Alto, California, United States, North America",www.nicslab.com/,,"$120,000",—,3,Techstars,1
Seed Round - Building4Health,Seed,Seed,"$700,000","May 13, 2021",Building4Health,Building4Health is a development stage company that defines and evaluates the impact of the indoor environment on occupant health.,"Analytics, Health Care, Information Technology, Software",—,"Gordonsville, Virginia, United States, North America",www.b4hinc.com,,"$700,000",Seed,1,—,—
Seed Round - Park Place Payments,Seed,Seed,"$1,500,000","May 26, 2021",Park Place Payments,"Park Place Payments provides payment processing solutions and personalized support, catering to businesses of various sizes and industries.","Financial Services, FinTech, Payments, Security","Women Founded, Women Led","Woodland Hills, California, United States, North America",www.parkplacepayments.com,,"$2,500,000",M&A,2,Curate Capital,8
Pre Seed Round - Pardigm,Pre-Seed,Seed,"$100,000","May 26, 2021",Pardigm,Pardigm is a biotech start-up company that develops a rapid test to measure cortisol at home.,"Apps, Biotechnology, Computer Vision, Life Science",—,"Redwood City, California, United States, North America",www.pardigm.com,,"$100,000",—,2,—,1
Seed Round - SquadOV,Seed,Seed,"$100,000","Jun 28, 2021",SquadOV,SquadOV is an app that allows users to record the gameplay for sharing and analysis.,"eSports, Gaming, Video Games",—,"New York, New York, United States, North America",www.squadov.gg,,"$100,000",Seed,1,—,1
Seed Round - Naborforce,Seed,Seed,"$2,500,000","Jun 23, 2021",Naborforce,Naborforce connects older adults to a network of “Nabors” for social engagement and on-demand support for errands.,"Health Care, Information Services, Software, Wellness","Women Founded, Women Led","Richmond, Virginia, United States, North America",www.naborforce.com/,,"$12,315,000",Early Stage Venture,5,Claritas Capital,2
Pre Seed Round - Jobsho,Pre-Seed,Seed,"$25,000","Jun 1, 2021",Jobsho,SaaS recruiting and job search platform in development.,—,—,"Tualatin, Oregon, United States, North America",jobsho.com/,,"$25,000",Seed,1,—,—
Seed Round - Nomad,Seed,Seed,"$2,400,000","May 28, 2021",Nomad,Nomad is an online real estate management that offers guaranteed rent and long-term leases.,"Information Technology, Internet, Property Management, Real Estate",—,"Denver, Colorado, United States, North America",nomadlease.com/,,"$23,600,000",Early Stage Venture,3,Kickstart,3
Seed Round - Direcon,Seed,Seed,"$360,000","Jul 7, 2021",Direcon,Direcon is a social audio analytics platform that helps brands to know their audience and level up their marketing campaigns.,"Analytics, Information Technology, Social Media, Software",—,"Washington, District of Columbia, United States, North America",direcon.com,,"$460,000",Seed,2,—,1
Pre Seed Round - Fragment,Pre-Seed,Seed,"$1,500,000","Jun 1, 2021",Fragment,The database for money.,"Database, Financial Services",—,"Seattle, Washington, United States, North America",fragment.dev/,,"$10,485,000",Seed,3,Gradient Ventures,2
Seed Round - MedCompli,Seed,Seed,"$100,000","Jun 28, 2021",MedCompli,MedCompli provides commercial compliance services and solutions through cloud based pharma reporting software.,SaaS,—,"Gainesville, Florida, United States, North America",medcompli.com/,,"$100,000",Seed,1,—,1
Pre Seed Round - Caut!on Tech,Pre-Seed,Seed,"$5,000","Jun 16, 2021",Caut!on Tech,Accessible Safety Platforms,"Internet, Software",—,"Winona, Minnesota, United States, North America",cautiontechllc.com,,"$5,000",Seed,1,Lawal Bada,1
Seed Round - BEASY,Seed,Seed,"$472,500","May 20, 2021",BEASY,BEASY was formed to make the benefits of blockchain easy to achieve throughout the consumer and enterprise value chains.,"Blockchain, Enterprise Software, Software, Sports",—,"Wakefield, Massachusetts, United States, North America",www.easybeasy.com/,,"$472,500",Seed,2,—,—
Pre Seed Round - H2cryptO,Pre-Seed,Seed,"$50,000","Jun 17, 2021",H2cryptO,"H2cryptO is a Next-Gen Cryptocurrency Exchange that will be the First to offer True 24/7/365 Live Support for assistance, education and help","Bitcoin, Cryptocurrency, Financial Exchanges, FinTech",—,"Atlanta, Georgia, United States, North America",h2crypto.io,,"$1,050,000",Seed,2,Draper Goren Holm,1
Seed Round - Uptrust,Seed,Seed,"$2,000,000","May 18, 2021",Uptrust,Uptrust is a software company that provides criminal justice system.,"Information Technology, Legal, Security, Service Industry, Software",—,"San Francisco, California, United States, North America",www.uptrust.co,,"$3,550,000",M&A,3,"De-Carceration Fund, Luminate Group, Stand Together Ventures Lab",3
Seed Round - GiveBlue,Seed,Seed,"$250,000","Jul 1, 2021",GiveBlue,"GiveBlue is a digital marketplace platform connecting supporters directly to the progressive campaigns and causes. Marketplace, E-Commerce.","E-Commerce, Marketplace, Politics","Women Founded, Women Led","Washington, District of Columbia, United States, North America",www.giveblue.com,,"$250,000",Seed,1,—,—
Pre Seed Round - Breath Hub - Your Breath Journey,Pre-Seed,Seed,"$380,000","Jun 15, 2021",Breath Hub - Your Breath Journey,"Breath Hub is the world's first and only personalized, all inclusive breathwork app.","Apps, Fitness, Health Care, Personal Health, Wellness",Women Founded,"San Francisco, California, United States, North America",breathhub.app,,"$858,000",Seed,2,—,—
Pre Seed Round - Verifiably,Pre-Seed,Seed,"$61,000","May 26, 2021",Verifiably,"Confidential cloud, secure private data sharing, collaboration & monetization","Cloud Security, Privacy",—,"Miami, Florida, United States, North America",www.verifiably.com,,"$61,000",Seed,1,—,—
Seed Round - Opulence Images Atlanta Georgia,Seed,Seed,"$3,500,000","May 23, 2021",Opulence Images Atlanta Georgia,Opulence Images is the leading provider of Brand photography for leaders in there industry,"Angel Investment, Media and Entertainment, Photo Editing, Photo Sharing, Photography, Video, Video Editing, Video Streaming",—,"Greenville, South Carolina, United States, North America",opulenceimages.com/,,"$3,750,000",Seed,2,"Adobe, Sony",2
Seed Round - Acquire.com,Seed,Seed,"$6,300,000","Jul 6, 2021",Acquire.com,Acquire.com (formerly MicroAcquire) is the world's largest startup acquisition marketplace that helps startups find buyers and get acquired.,"Business Intelligence, FinTech, Marketing, Marketplace, Social Entrepreneurship",—,"San Mateo, California, United States, North America",acquire.com,,"$11,300,000",—,2,Bessemer Venture Partners,17
Seed Round - Rocketmat,Seed,Seed,"$1,500,000","Jul 8, 2021",Rocketmat,"Rocketmat is an AI/ML, SaaS/B2B, focused on Human Resources.","Artificial Intelligence, Human Resources, Information Technology, Machine Learning, Recruiting, SaaS",—,"Dallas, Texas, United States, North America",rocketmat.com/,,"$1,500,000",Seed,1,Smart Money Ventures,3
Pre Seed Round - Gradient Health,Pre-Seed,Seed,"$120,000","Jun 9, 2021",Gradient Health,Gradient Health develops an open research platform that offers AI-based medical imaging diagnostics and infrastructure.,"Artificial Intelligence, Health Care, Medical, Wellness",—,"Durham, North Carolina, United States, North America",gradienthealth.io,,"$5,700,000",Seed,4,Techstars,1
Pre Seed Round - Tasq,Pre-Seed,Seed,"$210,000","Jun 29, 2021",Tasq,Tasq is a developer of a task management system powered by machine learning.,"Machine Learning, Management Information Systems, Oil and Gas, Software",—,"Denver, Colorado, United States, North America",www.tasq.io/,,"$490,000",Seed,2,—,—
Seed Round - Givingli,Seed,Seed,"$4,000,000","Jun 29, 2021",Givingli,Givingli develops customizable digital greeting cards that allow users to send greetings and gifts from their mobile phones.,"Apps, E-Commerce, Gift, Gift Card, Mobile Apps","Women Founded, Women Led","Los Angeles, California, United States, North America",www.givingli.com,,"$14,000,000",Early Stage Venture,2,Seven Seven Six,6
Seed Round - Kitzuma,Seed,Seed,"$450,000","Jun 4, 2021",Kitzuma,"Kitzuma provides shipping solutions for cyclists, manufacturers, and resellers.","Logistics, Shipping, Transportation",—,"Asheville, North Carolina, United States, North America",www.kitzuma.com,,"$450,000",Seed,1,—,—
Pre Seed Round - Paleo,Pre-Seed,Seed,"$38,000","Jul 5, 2021",Paleo,Paleo is a platform and technology for global trade.,"Retail Technology, Software",—,"Los Angeles, California, United States, North America",www.paleo.technology/,,"$66,000",Seed,2,Max Pauwels,1
Pre Seed Round - Zing Drone Solutions,Pre-Seed,Seed,"$75,000","May 31, 2021",Zing Drone Solutions,Universal drone solutions that reduce operational risk and complexity.,"Autonomous Vehicles, Delivery, Delivery Service, Drones, Food Delivery, Mobile Apps, Same Day Delivery",—,"Palm City, Florida, United States, North America",zingdrones.com/,,"$205,411",—,3,—,—
Seed Round - BloodQ,Seed,Seed,"$4,500,000","Jul 1, 2021",BloodQ,BloodQ develops an analytical platform designed for cancer drug treatment.,"Biotechnology, Health Care, Medical","Women Founded, Women Led","Orinda, California, United States, North America",www.bloodq.com/,,"$4,500,000",Seed,1,—,1
Seed Round - Maximus,Seed,Seed,"$5,000,000","May 31, 2021",Maximus,Maximus increases your own natural testosterone with a safe & effective doctor-prescribed program.,"Consumer, Health Care",—,"Santa Monica, California, United States, North America",maximustribe.com,,"$15,000,000",Early Stage Venture,2,"8VC, Founders Fund",10
Seed Round - Vantage,Seed,Seed,"$4,000,000","Jun 22, 2021",Vantage,"Vantage is a cloud cost management and optimization platform that allows developers to analyze, report on, and reduce cloud costs.","Cloud Infrastructure, Data Visualization, Developer Tools, Software",—,"New York, New York, United States, North America",www.vantage.sh,,"$25,000,000",Early Stage Venture,2,Andreessen Horowitz,12
Seed Round - Zolt,Seed,Seed,"$3,000,000","Jun 11, 2021",Zolt,"Zolt is an event marketing platform, helping brands and organizations run successful events.","Fitness, Wellness",—,"New York, New York, United States, North America",www.zolt.so,,"$3,000,000",Seed,2,True Ventures,4
Seed Round - LeanLaw,Seed,Seed,"$450,000","Jun 9, 2021",LeanLaw,"LeanLaw offers legal billing software programs for accounting, timekeeping, invoicing, and more for various sized law firms.","Advice, Consulting, Legal",—,"Boise, Idaho, United States, North America",leanlaw.co,,"$6,382,000",Early Stage Venture,7,—,—
Pre Seed Round - Clutch,Pre-Seed,Seed,"$350,000","Jun 30, 2021",Clutch,Clutch is the digital marketplace elevating emerging brands’ digital marketing by connecting them to creators.,"Apps, Digital Marketing, Marketing, Marketplace, Professional Services, Social Media","Hispanic / Latine Founded, Hispanic / Latine Led","Houston, Texas, United States, North America",www.thatsclutch.com/,,"$1,700,000",Seed,3,—,—
Seed Round - Haystack,Seed,Seed,"$1,200,000","Jun 7, 2021",Haystack,"Building elite developer teams by helping prevent burnout, experiment faster and ship reliably.","Analytics, Developer Platform, Productivity Tools, Software",—,"San Francisco, California, United States, North America",www.usehaystack.io/,,"$1,200,000",Seed,2,—,7
Seed Round - ARENA,Seed,Seed,"$5,200,000","Jul 7, 2021",ARENA,ARENA leads the at-home training center that uses engineering and industry.,"Fitness, Wellness",—,"Los Angeles, California, United States, North America",goarena.co/,,"$5,200,000",Seed,1,—,4
Pre Seed Round - Penchantly Co,Pre-Seed,Seed,"$1,000,000","Jul 3, 2021",Penchantly Co,The first All-In-One Ecommerce Platfrom that allows US Based Businesses with US or Non-US Owners to enjoy all it's features.,"E-Commerce Platforms, Financial Services",—,"Houston, Texas, United States, North America",www.penchantly.com,,"$1,050,000",Seed,2,—,—
Seed Round - PatternAI,Seed,Seed,"$4,100,000","Jun 30, 2021",PatternAI,Enterprise conversational AI,"Analytics, Artificial Intelligence, Cloud Data Services, Machine Learning, SaaS, Software",—,"Menlo Park, California, United States, North America",www.getpattern.ai,,"$6,550,000",Seed,4,—,—
Pre Seed Round - HOLLO medical,Pre-Seed,Seed,"$15,000","Jun 8, 2021",HOLLO medical,HOLLO is a building product for inhaler-users who are frustrated with cumbersome valved holding chambers.,"Manufacturing, Medical, Medical Device",—,"Halifax, North Carolina, United States, North America",www.hollomedical.com,,"$55,000",Seed,2,The LAUNCH program,1
Seed Round - Loophire,Seed,Seed,"$300,000","Jun 7, 2021",Loophire,Loophire is attributed to decades of feedback from the hiring and hunting clients in those roles.,"Human Resources, Recruiting, Staffing Agency",—,"Omaha, Nebraska, United States, North America",loophire.com,,"$300,000",Seed,1,U.S. Property,1
Seed Round - Rebound,Seed,Seed,"$20,000","Jun 1, 2021",Rebound,Rebound develops of a business metric platform intended to monitor and gather insights.,Software,—,"Walnut, California, United States, North America",www.rebound.ai/,,"$20,000",Seed,1,Conquer Accelerator,1
Seed Round - Gabbi,Seed,Seed,"$1,000,000","Jun 7, 2021",Gabbi,Gabbi is a woman’s on demand breast specialist.,"Health Care, Personal Health, Women's","Women Founded, Women Led","Portland, Oregon, United States, North America",www.gabbi.com,,"$6,191,000",Seed,6,—,5
Seed Round - Mooven,Seed,Seed,"NZ$5,035,000","Jun 15, 2021",Mooven,"Mooven provides products for the transport sector to help drive efficiency through the use of proactive, real-time decision tools.","Information Technology, Intelligent Systems, Software",—,"San Francisco, California, United States, North America",www.mooven.com,,"NZ$5,335,000",Seed,2,EVP,3
Pre Seed Round - Visura.co,Pre-Seed,Seed,"$10,000","Jun 14, 2021",Visura.co,A platform where members can build websites interconnected to a global network and newsfeed.,"Communities, Content Creators, Content Discovery, Content Marketing, Database, Film, Management Information Systems, News, Photography, Professional Networking",Women Founded,"New York, New York, United States, North America",visura.co,,"$10,000",Seed,2,NYU Summer Launchpad,1
Seed Round - Oisin Biotechnologies,Seed,Seed,"$5,000,000","May 27, 2021",Oisin Biotechnologies,Oisin Biotechnologies is a drug development company focused on mitigating the senolytic technology to combat age-related diseases.,"Biopharma, Biotechnology, Medical",—,"Seattle, Washington, United States, North America",www.oisinbio.com,,"$7,118,936",Seed,4,Althea Ventures,1
Pre Seed Round - Streams,Pre-Seed,Seed,"$1,000,000","Jun 2, 2021",Streams,Streams is the Easiest and Most Secure Way to Earn Passive Income,"Apps, Finance, Financial Services, FinTech",—,"San Diego, California, United States, North America",streams.xyz/,,"$1,000,000",Seed,2,"Arcuate Capital, Centrality, Future Fund, Genblock Capital",18
Seed Round - Eano Home Renovation,Seed,Seed,"$6,000,000","May 20, 2021",Eano Home Renovation,"Delivering easy, affordable renovation and good designs to more homeowners via an end-to-end, all-in-one automated solution.","Construction, Home Improvement, Real Estate, Software","Women Founded, Women Led","San Francisco, California, United States, North America",www.eano.com,,"$17,200,000",Early Stage Venture,3,Builders VC,3
Seed Round - TruStar,Seed,Seed,"$500,000","Jun 3, 2021",TruStar,TruStar develops packaging systems and packing materials for bulk application.,"Consumer Goods, Manufacturing, Packaging Services, Warehousing",—,"Schaumburg, Illinois, United States, North America",trustarholdingsllc.com,,"$500,000",Seed,1,—,—
Seed Round - BRELYON,Seed,Seed,"$2,200,000","May 15, 2021",BRELYON,Brelyon is a developer of a display used to replace traditional monitors and virtual reality headgear.,"Consumer Electronics, Hardware, Software",—,"San Mateo, California, United States, North America",brelyon.com/,,"$20,000,000",Early Stage Venture,4,—,3
Seed Round - Shvasa.com,Seed,Seed,"$1,000,000","Jul 1, 2021",Shvasa.com,Shvasa.com provides online yoga classes and workshops that allow people to practice yoga alongside teachers.,"Health Care, Wellness","Women Founded, Women Led","Claymont, Delaware, United States, North America",shvasa.com,,"$1,000,000",Seed,1,—,—
Seed Round - NOWHERE,Seed,Seed,"$3,000,000","May 28, 2021",NOWHERE,NOWHERE is a social platform for connecting communities through virtual face-to-face contact in 3D space.,"3D Technology, Information Technology, Real Time, Social Media, Social Network, Video Chat",—,"Brooklyn, New York, United States, North America",www.urnowhere.com,,"$3,000,000",Seed,1,—,1
Seed Round - Billy,Seed,Seed,"$3,500,000","Jun 27, 2021",Billy,Billy operates as an insurtech marketplace that makes it easy for contractors to manage and purchase insurance in one place.,"Construction, Insurance, Professional Services, Real Estate",Black / African American Led,"Brooklyn, New York, United States, North America",billyforinsurance.com/,,"$6,750,000",Seed,4,"Coelius Capital, MetaProp",6
Seed Round - The Single Origin Food Co,Seed,Seed,"$1,100,000","Jun 28, 2021",The Single Origin Food Co,The Single Origin Food provides transparency between farmer and consumer by supporting small farmers with their sustainable practices.,"Consumer Goods, Food and Beverage, Health Care, Retail, Sustainability",—,"Wilmington, Delaware, United States, North America",thesofco.com,,"$1,100,000",Seed,1,A'Z Angels,1
