Seed Round - Coast,Seed,Seed,"$6,000,000","Jul 6, 2021",Coast,"Coast is the modern financial services platform that provides solution for managing fleet’s expenses, and a smart Visa fleet and fuel card.","Credit Cards, Financial Services, Payments",—,"New York, New York, United States, North America",coastpay.com,,"$33,500,000",Early Stage Venture,2,Better Tomorrow Ventures,8
Seed Round - Evertas,Seed,Seed,"$5,800,000","May 25, 2021",Evertas,Evertas is a crypto insurance company that develops regulated insurance and risk mitigation solutions for crypto assets.,"Blockchain, Cryptocurrency, Financial Services, Insurance, InsurTech, Risk Management",—,"Chicago, Illinois, United States, North America",www.evertas.com,,"$22,600,000",Early Stage Venture,4,Morgan Creek Digital,9
Seed Round - Aero Therapeutics,Seed,Seed,"$150,000","May 14, 2021",Aero Therapeutics,Aero Therapeutics develops devices that help physicians treat patients in low-resource settings with respiratory issues.,Health Care,—,"San Diego, California, United States, North America",www.breatheaero.com,,"$180,000",Seed,3,—,1
Seed Round - twine,Seed,Seed,"$3,300,000","Jun 17, 2021",twine,"Twine is a platform for deep networking, designed for virtual events and remote teams.","Event Management, Marketing Automation, Software",—,"San Francisco, California, United States, North America",www.twine.us/,,"$3,300,000",—,3,Moment Ventures,6
Seed Round - Astra,Seed,Seed,"$2,000,000","Jun 2, 2021",Astra,Astra is the platform for moving money instantly and securely,"Financial Services, FinTech, Personal Finance, Software",—,"Menlo Park, California, United States, North America",www.astrafi.com,,"$14,900,000",Early Stage Venture,5,—,—
Seed Round - SoftLedger,Seed,Seed,"$2,100,000","May 19, 2021",SoftLedger,SoftLedger is a cloud accounting software company.,"Accounting, Enterprise Software, Internet",—,"Santa Monica, California, United States, North America",softledger.com,,"$2,150,000",Seed,3,Naples Technology Ventures,4
Seed Round - HomeKey Systems,Seed,Seed,"$799,280","May 13, 2021",HomeKey Systems,HomeKey Systems is a home-technology company providing a home maintenance application to make smart homes.,"Home Improvement, Home Renovation, Intelligent Systems, Property Management, Smart Home, Software",—,"Phoenix, Arizona, United States, North America",gethomekey.com,,"$3,419,280",—,6,—,—
Seed Round - Compt,Seed,Seed,"$1,000,002","Jul 8, 2021",Compt,"Compt is a perk management software that helps companies create, manage, and streamline perk stipends that delight employees.","Employment, Human Resources, Software",Women Led,"Cambridge, Massachusetts, United States, North America",www.compt.io,,"$15,500,002",Early Stage Venture,3,—,—
Seed Round - Veloce Energy,Seed,Seed,"$1,950,000","Jun 24, 2021",Veloce Energy,Veloce Energy innovates technology and financing models to reduce physical and financial barriers to EV Charging infrastructure deployment.,"Electric Vehicle, Electrical Distribution, Embedded Software, Energy Storage, Power Grid",—,"Los Angeles, California, United States, North America",www.veloceenergy.com,,"$6,500,000",Early Stage Venture,6,—,—
Seed Round - GiftAMeal,Seed,Seed,"$484,000","Jun 24, 2021",GiftAMeal,GiftAMeal is a charitable marketing program for restaurants.,"Android, Cause Marketing, iOS, Marketing, Mobile, Mobile Apps, Restaurants, Social Entrepreneurship, Social Impact",—,"St Louis, Missouri, United States, North America",www.giftameal.com,,"$794,000",Seed,5,—,3
Seed Round - ARTA,Seed,Seed,"$4,500,000","May 27, 2021",ARTA,ARTA is a logistics software and fulfillment service for goods and collectibles.,"Developer APIs, Logistics, Software",—,"New York, New York, United States, North America",arta.io,,"$19,500,000",Early Stage Venture,5,—,3
Seed Round - Confection,Seed,Seed,"$500,000","May 19, 2021",Confection,Today is your data independence day. Use Confection to take control of your atomic-level digital marketing data.,"Ad Targeting, Analytics, Business Intelligence, Data Integration, Lead Generation, Lead Management, Marketing Automation, Privacy","Hispanic / Latine Founded, Hispanic / Latine Led","Fremont, California, United States, North America",confection.io/,,"$680,000",Seed,3,—,—
Seed Round - Tap Systems,Seed,Seed,"$211,500","May 14, 2021",Tap Systems,Tap Systems is a developer of a wearable Bluetooth keyboard designed to help users type by tapping fingers on any surface.,"Augmented Reality, Consumer Electronics, Software, Virtual Reality, Wearables",Women Founded,"Pasadena, California, United States, North America",www.tapwithus.com,,"$5,248,313",Seed,4,—,—
Seed Round - KarbonPay,Seed,Seed,"$220,000","May 15, 2021",KarbonPay,KarbonPay is a payroll SaaS platform that automates payroll processing across countries.,"Human Resources, SaaS, Software",—,"Dallas, Texas, United States, North America",www.karbonpay.com,,"$1,122,046",Seed,3,—,—
Seed Round - Saucy Brew Works,Seed,Seed,"$282,000","Jul 1, 2021",Saucy Brew Works,Saucy Brew Works is a food service provider company.,Food and Beverage,—,"Cleveland, Ohio, United States, North America",www.saucybrewworks.com/,,"$282,000",Seed,1,—,1
Seed Round - Nestig,Seed,Seed,"$1,300,000","Jun 14, 2021",Nestig,Nestig provides modern nursery essentials such as cribs and mattresses.,"Baby, Consumer Goods, Retail",—,"New York, New York, United States, North America",www.nestig.com,,"$1,300,000",Seed,1,ONEVC,1
Seed Round - Nile,Seed,Seed,"$100,000","Jun 28, 2021",Nile,NILE is an end-to-end real estate transaction platform.,—,—,"Los Angeles, California, United States, North America",www.nilehome.com/,,"$100,000",Seed,2,—,1
Seed Round - Whether,Seed,Seed,"$100,000","Jun 28, 2021",Whether,We deliver insights that help asset managers plan for and react to extreme weather events,"Artificial Intelligence, FinTech, Information Technology, InsurTech, Machine Learning, Predictive Analytics, Software",—,"Stamford, Connecticut, United States, North America",www.whether.ai,,"$100,000",Seed,1,—,1
Seed Round - Bonsai,Seed,Seed,"$3,000,000","May 13, 2021",Bonsai,Bonsai helps recording artists engage and monetize their superfans.,"Consumer, Content Creators, Music",—,"New York, New York, United States, North America",joinbonsai.co/,,"$5,300,000",Seed,2,Activate Venture Partners,2
Seed Round - Non-fungible Technologies,Seed,Seed,"$2,750,000","May 19, 2021",Non-fungible Technologies,Non-fungible Technologies builds financial products and infrastructure for non-fungible assets and the creator economy.,Financial Services,—,"San Francisco, California, United States, North America",www.nonfungibletech.com/,,"$2,750,000",Seed,1,Lemniscap,5
Seed Round - Spot,Seed,Seed,"$5,000,000","May 20, 2021",Spot,Spot is a mobile and browser-based platform for voice conference calls.,"Meeting Software, Software",—,"Chicago, Illinois, United States, North America",www.meetwithspot.com/,,"$6,900,000",Seed,2,Kleiner Perkins,1
Pre Seed Round - Onboardbase,Pre-Seed,Seed,"$70,000","Jul 3, 2021",Onboardbase,Collaboratively work with app secrets and credentials securely with team work and contractors in mind.,"Cloud Security, Developer Tools, Productivity Tools, Software",—,"Miami, Florida, United States, North America",onboardbase.com/,,"$230,000",Seed,3,—,1
Pre Seed Round - Prixview,Pre-Seed,Seed,"$500,000","Jun 1, 2021",Prixview,Sports data and technology for Equestrian Jumping,"Analytics, Fantasy Sports, Information Services, Software, Sports",—,"Brooklyn, New York, United States, North America",www.prixview.com,,"$500,000",Seed,1,—,—
Pre Seed Round - Blockmetrix,Pre-Seed,Seed,"$710,000","Jun 18, 2021",Blockmetrix,Blockmetrix is a Bitcoin mining company that offers a peer-to-peer payment network that helps validate crypto transactions.,"Bitcoin, Blockchain, Cryptocurrency, Peer to Peer, Transaction Processing",—,"Dallas, Texas, United States, North America",www.blockmetrix.com,,"$89,882,000",Early Stage Venture,6,—,—
Pre Seed Round - Rabot,Pre-Seed,Seed,"$100,000","Jun 18, 2021",Rabot,Vision AI for fulfillment operations,Software,—,"San Francisco, California, United States, North America",www.rabot.us,,"$2,100,000",Seed,2,—,1
Seed Round - Sator,Seed,Seed,"$2,000,000","May 18, 2021",Sator,Sator is an open-source P2P platform for the international television market.,"Blockchain, Information Technology, Mobile Apps",—,"Los Angeles, California, United States, North America",www.sator.io,,"$2,000,000",Seed,1,—,9
Seed Round - Place,Seed,Seed,"$1,930,000","Jun 24, 2021",Place,Fast-growing B2B SaaS companies use Place to bridge the gaps between their go-to-market and finance teams.,"Business Intelligence, Finance, SaaS, Software",—,"Austin, Texas, United States, North America",www.placetechnology.com,,"$10,020,000",Seed,6,Brandon Metcalf,1
Pre Seed Round - Claritype,Pre-Seed,Seed,"$2,000,000","Jul 1, 2021",Claritype,Claritype is a provider of data infrastructure that currently operates in stealth mode.,"Data Integration, Information Technology, Software",—,"Mclean, Virginia, United States, North America",claritype.com,,"$8,609,998",—,2,—,3
Pre Seed Round - Whipnotic,Pre-Seed,Seed,"$900,000","Jul 1, 2021",Whipnotic,"Revolutionizing Whipped Cream. Whipnotic is a whipped cream company that aims to disrupt and modernize through flavor, color, and health.","Confectionery, Food and Beverage, Food Processing","Women Founded, Women Led","New York, New York, United States, North America",www.whipnotic.com/,,"$900,000",Seed,3,—,—
Seed Round - Panther,Seed,Seed,"$2,500,000","May 20, 2021",Panther,Panther is a contractor management tool designed to build remote teams.,"Compliance, Employment, Human Resources, Information Technology, Recruiting, Software",—,"Tampa, Florida, United States, North America",panther.co,,"$2,500,000",Seed,2,"Carta Ventures, Eric Ries, Tribe Capital",7
Seed Round - DefineMe,Seed,Seed,"$400,000","Jun 3, 2021",DefineMe,"DefineMe offers a collection of clean, vegan, cruelty-free scents.","Beauty, Cosmetics, Retail, Women's","Women Founded, Women Led","Santa Monica, California, United States, North America",definemefragrance.com,,"$670,000",Seed,2,—,—
Seed Round - Newfangled Confections,Seed,Seed,"$200,000","May 27, 2021",Newfangled Confections,Newfangled Confections is a candy company that offers gluten free handcrafted candy.,"Bakery, Food and Beverage, Gift, Handmade","Women Founded, Women Led","Indianapolis, Indiana, United States, North America",newfangledconfections.com,,"$900,000",Seed,3,—,—
Pre Seed Round - Ramba,Pre-Seed,Seed,"$100,000","Jun 7, 2021",Ramba,"Ramba is the ultimate dental savings club for businesses, freelancers, individuals, and families.","Dental, FinTech, Information Technology, Insurance, Medical, Payments",—,"New York, New York, United States, North America",,,"$340,000",Seed,6,—,1
Seed Round - Driven Data,Seed,Seed,"$4,500,000","Jun 29, 2021",Driven Data,Driven Data is an automotive company that provides unique solutions for automotive dealerships.,"Analytics, Automotive, Software",—,"Indianapolis, Indiana, United States, North America",www.driven-data.com,,"$5,501,543",M&A,3,"JHCapital, Richard Gibbs, Jr.",2
Seed Round - Holy Grail,Seed,Seed,"$2,700,000","Jun 23, 2021",Holy Grail,Holy Grail captures carbon dioxide from the atmosphere and permanently stores it in pyramids,"Energy, Energy Efficiency, Energy Storage, Renewable Energy",—,"Mountain View, California, United States, North America",www.holygrail.ai/,,"$3,040,000",Seed,2,—,10
Seed Round - Terzo,Seed,Seed,"$3,180,000","Jun 15, 2021",Terzo,Terzo is an AI-powered Contract and Spend Intelligence platform to help Finance Procurement teams optimize supplier expenses,SaaS,—,"Los Angeles, California, United States, North America",www.terzo.ai,,"$15,180,000",Early Stage Venture,4,Great Oaks Venture Capital,3
Seed Round - Clearstory.build,Seed,Seed,"$5,300,000","Jun 8, 2021",Clearstory.build,Clearstory is the only Change Order Communication tool designed to reduce risk for all commercial construction stakeholders.,"Construction, Information Technology, Real Estate, SaaS",—,"San Francisco, California, United States, North America",www.clearstory.build/,,"$17,800,000",—,3,Jackson Square Ventures,1
Seed Round - Promising People Enterprises,Seed,Seed,"$350,000","Jun 1, 2021",Promising People Enterprises,Promising People Enterprises provides skills training using the technologies proven in the U.S. Military for the previously incarcerated.,"Communities, Education, Software, Training, Virtual Reality",—,"Orlando, Florida, United States, North America",www.promisingpeople.com,,"$1,550,000",Seed,3,—,—
Seed Round - HomeTown Ticketing,Seed,Seed,"$197,000","Jul 9, 2021",HomeTown Ticketing,"HomeTown Ticketing provides online ticketing solutions for high schools, universities, and athletic conferences.","Internet, Software, Ticketing",—,"Dublin, Ohio, United States, North America",www.hometownticketing.com,,"$75,197,000",Private Equity,2,—,—
Seed Round - Scoperta,Seed,Seed,"$1,500,000","Jun 15, 2021",Scoperta,Scoperta is an online direct to consumer wine marketplace.,E-Commerce,—,"Chicago, Illinois, United States, North America",www.scopertawine.com,,"$1,500,000",Seed,1,—,—
Seed Round - Mosaic,Seed,Seed,"$4,000,000","Jun 3, 2021",Mosaic,"AI Planning, Management, and Forecasting Software","Artificial Intelligence, Collaboration, Enterprise Resource Planning (ERP), Enterprise Software, Machine Learning, Project Management, Software",—,"New York, New York, United States, North America",www.mosaicapp.com,,"$4,000,000",Seed,8,Las Olas Venture Capital,5
Seed Round - Opaque Systems,Seed,Seed,"$9,500,000","Jul 7, 2021",Opaque Systems,Opaque is a startup that helps organizations analyze encrypted data in the cloud.,"Analytics, Cloud Computing, Computer, Privacy",—,"San Francisco, California, United States, North America",opaque.co/,,"$31,500,000",Early Stage Venture,2,"Intel Capital, Race Capital",3
Seed Round - testRigor,Seed,Seed,"$2,625,000","May 24, 2021",testRigor,"testRigor uses AI to help its customers to decrease test maintenance 200X, speed up test creation 20X and empower manual QA to create tests","Artificial Intelligence, Developer Tools, Machine Learning, Quality Assurance, Software",—,"San Francisco, California, United States, North America",testrigor.com,,"$3,677,333",Seed,4,—,11
Seed Round - Portside,Seed,Seed,"PLN1,000,000","Jun 1, 2021",Portside,"Portside is an aircraft data, reporting, and analytics platform for individual and corporate plane owners.","Aerospace, Air Transportation, Analytics, Software, Transportation",—,"San Francisco, California, United States, North America",portside.co,,"$67,273,880",Early Stage Venture,8,—,1
Seed Round - ChannelApe,Seed,Seed,"$7,000,000","Jun 1, 2021",ChannelApe,ChannelApe's enterprise fulfillment SaaS scales direct-to-consumer brands by separating supply chain software from physical operations.,"E-Commerce, Enterprise Software, Internet, Logistics, SaaS, Software, Supply Chain Management",—,"New York, New York, United States, North America",www.channelape.com,,"$9,550,000",Seed,3,Brand Foundry Ventures,5
Seed Round - Topia,Seed,Seed,"$5,000,000","May 26, 2021",Topia,Create social experiences in the metaverse for real-time connection & play.,"Social Media, Software, Video Conferencing",—,"Indio, California, United States, North America",topia.io,,"$5,000,000",Seed,2,Seven Seven Six,2
Pre Seed Round - MoodSpark,Pre-Seed,Seed,"$120,000","Jun 9, 2021",MoodSpark,"Digital companion that detects sadness and uplifts with emotional memories, personalized conversation and video visits.","Health Care, Information Technology, Media and Entertainment",—,"Kansas City, Kansas, United States, North America",www.getmoodspark.com,,"$970,000",Seed,3,—,1
Pre Seed Round - UNPACKING,Pre-Seed,Seed,"$100,000","Jun 1, 2021",UNPACKING,"Unpacking is a gamified learning platform for diversity, equity, and inclusion.","Corporate Training, E-Learning, Education, Enterprise Software, Gamification, Gaming, Human Resources, Training, Virtual Workforce","Black / African American Founded, Black / African American Led, Women Founded, Women Led","Atlanta, Georgia, United States, North America",www.unpacking.co,,"$220,000",Seed,2,Higher Ground Labs,1
Pre Seed Round - Pera Labs,Pre-Seed,Seed,"$1,200,000","May 15, 2021",Pera Labs,Pera Labs develops digiceuticals and AI-powered solutions for fertility.,"Artificial Intelligence, Health Care, Life Science, Livestock, Machine Learning, Medical Device, Software",—,"Philadelphia, Pennsylvania, United States, North America",peralabs.co,,"$1,250,000",Seed,3,"Friends & Family, Malta Enterprise",2
Seed Round - ASENSEI,Seed,Seed,"$2,200,000","Jun 16, 2021",ASENSEI,The easiest way to add technique coaching and correction to sport and fitness products.,"Fitness, Health Care, Personal Health, Wellness",—,"San Francisco, California, United States, North America",www.asensei.ai,,"$6,050,494",Seed,3,KB Partners,3
Seed Round - HELIXintel,Seed,Seed,"$1,600,000","Jun 1, 2021",HELIXintel,HELIXintel creates a platform for inventory and task management to track equipment maintenance.,"B2B, Building Maintenance, Industrial Automation, Marketplace, Software",—,"Buffalo, New York, United States, North America",app.helixintel.com/home,,"$6,700,000",Early Stage Venture,4,"Launch NY, Motivate Venture Capital",4
Pre Seed Round - Beyond Industries,Pre-Seed,Seed,"$60,000","May 14, 2021",Beyond Industries,Beyond - allows game developers to create in-game content and social features without an SDK or changing the game code.,"B2B, eSports, Gaming, Media and Entertainment, Software",—,"Lewes, Delaware, United States, North America",beyondindustries.io/,,"$460,000",Seed,4,—,—
Pre Seed Round - Abode,Pre-Seed,Seed,"$450,000","Jun 21, 2021",Abode,Abode is an early-career retention platform that predict and prevent employee turnover for companies.,"Employment, Information Technology, Software",—,"Denver, Colorado, United States, North America",www.abodehr.com,,"$5,200,000",Seed,4,—,—
Pre Seed Round - Supliful,Pre-Seed,Seed,"$410,000","May 20, 2021",Supliful,Platfrom that makes it easy to launch and operate scalable CPG brands with one click,"Consumer Goods, E-Commerce Platforms, Internet, Nutraceutical",—,"Golden, Colorado, United States, North America",supliful.com/,,"$1,637,000",Seed,3,—,5
Seed Round - Hooray Foods,Seed,Seed,"$2,000,000","Jun 3, 2021",Hooray Foods,Hooray Foods produces plant-based meats.,"Food and Beverage, Food Processing, Organic Food",—,"San Francisco, California, United States, North America",www.hoorayfoods.com,,"$7,223,999",Seed,7,Evolution VC Partners,3
Pre Seed Round - Realbloc Holdings,Pre-Seed,Seed,"$10,000","Jun 17, 2021",Realbloc Holdings,"Realbloc Holding develops blockchain solutions for real estate management, acquisition and trading.","Blockchain, Property Development, Real Estate, Real Estate Investment, Smart Cities, Smart Home, Software",—,"Clearwater, Florida, United States, North America",realblock.io,,"$10,000",Seed,1,—,—
Seed Round - Auxilia,Seed,Seed,"$600,000","Jun 8, 2021",Auxilia,Auxilia develops a cloud-based donor management software for nonprofit organizations.,"Non Profit, Social Impact, Software",—,"Denver, Colorado, United States, North America",www.theauxilia.com,,"$952,915",Seed,2,—,—
Seed Round - LearnYour Benefits,Seed,Seed,"$160,000","Jun 15, 2021",LearnYour Benefits,LearnYour Benefits is a video-first benefits communications & technology company.,"Human Resources, Software",—,"Eden Prairie, Minnesota, United States, North America",learnyourbenefits.com/,,"$610,000",Seed,2,—,—
Seed Round - Solace Cremation,Seed,Seed,"$1,700,000","Jun 2, 2021",Solace Cremation,Solace Cremation offers a family-focused direct cremation service with online arrangements.,"Customer Service, Funerals, Service Industry",—,"Portland, Oregon, United States, North America",www.solacecares.com,,"$1,700,000",M&A,1,Rogue Venture Partners,3
Seed Round - Reclaim.ai,Seed,Seed,"$4,800,000","May 26, 2021",Reclaim.ai,A smart friend for your calendar that automatically makes time for the things you want to get done.,"Enterprise Software, Product Management, Productivity Tools, Software",—,"Portland, Oregon, United States, North America",reclaim.ai,,"$13,325,000",Seed,7,Index Ventures,11
Pre Seed Round - Grove Biopharma,Pre-Seed,Seed,"$4,000,000","Jun 30, 2021",Grove Biopharma,Grove Biopharma is a biotechnology company offering a materials science solution to peptide therapeutic challenges.,"Biotechnology, Medical, Therapeutics",—,"Chicago, Illinois, United States, North America",grovebiopharma.com/,,"$10,500,000",Seed,3,—,1
Seed Round - Explorer Cold Brew,Seed,Seed,"$1,500,000","Jun 4, 2021",Explorer Cold Brew,Explorer Cold Brew is a specialty coffee company that produces cold brew concentrates.,"Brewing, Coffee, Food and Beverage",—,"Brooklyn, New York, United States, North America",explorercoldbrew.com,,"$4,000,000",Seed,3,—,5
Seed Round - Frame,Seed,Seed,"$3,000,000","Jul 2, 2021",Frame,Frame is a mental wellness network that provides a multifaceted approach to therapy.,Health Care,"Women Founded, Women Led","Santa Monica, California, United States, North America",www.tryframe.com/,,"$3,000,000",Seed,1,Maven Ventures,5
Pre Seed Round - Letryx,Pre-Seed,Seed,"$10,000","Jun 14, 2021",Letryx,Letryx is a web-based tool that provides contract and disclosure analytics for M&A attorneys and investment analysts.,Analytics,—,"Austin, Texas, United States, North America",letryx.com/,,"$10,000",Seed,1,NYU Summer Launchpad,1
Seed Round - Framework,Seed,Seed,"$9,000,000","Jun 17, 2021",Framework,"Framework designs high-performance, repairable, upgradeable consumer electronics products that are designed to last.",Consumer Electronics,—,"San Francisco, California, United States, North America",frame.work,,"$27,000,000",Early Stage Venture,2,—,4
Pre Seed Round - Eva.guru,Pre-Seed,Seed,"$1,500,000","Jun 1, 2021",Eva.guru,"Eva provides Advanced Amazon Analytics and Intelligent Repricing Platform to the Brands, Private Label Sellers, and Resellers.","Analytics, Software",—,"San Diego, California, United States, North America",eva.guru,,"$3,500,000",Seed,2,—,2
Seed Round - Sosivio,Seed,Seed,"$4,500,000","May 13, 2021",Sosivio,Predictive Troubleshooting for Kubernetes,"Analytics, Artificial Intelligence, Cloud Computing, Cloud Infrastructure, Cloud Management, Cloud Security, Enterprise Software, Machine Learning, Predictive Analytics, Software",—,"San Francisco, California, United States, North America",sosiv.io/,,"$6,200,000",Seed,2,Seamans Holdings,2
Seed Round - Keypath Education,Seed,Seed,"A$358,909","Jun 10, 2021",Keypath Education,"Keypath Education delivers programs that meet the needs of the future of work and help solve global, social, and economic challenges.","Career Planning, Education, SEM",—,"Lenexa, Kansas, United States, North America",www.keypathedu.com,,"A$358,909",Seed,1,—,—
Seed Round - TheLoops,Seed,Seed,"$8,750,000","Jun 23, 2021",TheLoops,Bring product context to support.,Internet,"Women Founded, Women Led","San Jose, California, United States, North America",www.theloops.io/,,"$8,750,000",Seed,3,—,2
Seed Round - iLife Technologies,Seed,Seed,"$4,000,000","May 21, 2021",iLife Technologies,"iLife Technologies is a life insurance automation platform for insurance agents, brokers, and customers.","Insurance, InsurTech, Software",—,"Sunnyvale, California, United States, North America",ilife.tech,,"$21,000,000",Early Stage Venture,3,Foundation Capital,3
Pre Seed Round - HyperKelp,Pre-Seed,Seed,"$120,000","Jun 7, 2021",HyperKelp,HyperKelp builds hosted payload buoys that provide data access to the ocean's surface.,"Environmental Engineering, Internet of Things, Marine Technology, Sensor",—,"San Diego, California, United States, North America",www.hyperkelp.com,,"$190,000",Seed,2,Techstars,1
Seed Round - ModernTax,Seed,Seed,"$602,500","Jun 15, 2021",ModernTax,ModernTax is API platform that democratizes access to tax records for business services companies.,"Compliance, Developer APIs, Financial Services, FinTech, Information Technology, SaaS, Software","Black / African American Founded, Black / African American Led","San Francisco, California, United States, North America",moderntax.io,,"$2,142,500",Seed,4,—,7
Seed Round - Candidate,Seed,Seed,"$4,000,000","Jun 16, 2021",Candidate,Candidate is a marketplace that helps and incentivizes every person to be a recruiter for their network.,"Internet, Marketplace, Software",—,"Seattle, Washington, United States, North America",candidate.co,,"$5,000,000",Seed,2,Voyager Capital,6
Pre Seed Round - Hop,Pre-Seed,Seed,"$2,100,000","Jun 21, 2021",Hop,"Cloud platform focussing on realtime services, including GPU acceleration and low-latency global video delivery. Creators of Giggl.","Cloud Computing, Cloud Infrastructure, Social Media, Software, Video Streaming",—,"West Hollywood, California, United States, North America",hop.io,,"$2,200,000",Seed,2,Craft Ventures,7
Seed Round - LIT Videobooks,Seed,Seed,"$5,000,000","Jul 8, 2021",LIT Videobooks,LIT is a new platform that allows you to view bestselling business books in a new video book format.,"E-Learning, Virtual World",—,"New York, New York, United States, North America",litvideobooks.com/home,,"$5,000,000",—,2,MaC Venture Capital,11
Pre Seed Round - Wirlix,Pre-Seed,Seed,"$120,000","Jun 1, 2021",Wirlix,Wirlix is a video based social network for conversations and debates.,"Mobile Apps, Social Media, Social News","South Asian Founded, Women Founded","Santa Clara, California, United States, North America",www.wirlix.com/,,"$120,000",Seed,1,—,—
