Seed Round - Smartz,Seed,Seed,"$200,000","Jun 16, 2021",Smartz,Simplifying Property Management.,"Artificial Intelligence, Hospitality, Property Management, Real Estate, Rental Property, SaaS, Smart Building, Smart Home, Software, Transaction Processing","East Asian Founded, East Asian Led","Champaign, Illinois, United States, North America",www.smartz.cloud/,,"$5,300,000",—,4,—,—
Pre Seed Round - Routr,Pre-Seed,Seed,"$550,000","Jul 1, 2021",Routr,Routr is a software suite that automates business processes for transportation companies.,"SaaS, Software",—,"New York, New York, United States, North America",www.routr.com,,"$550,000",Seed,2,—,—
Seed Round - 4Blind,Seed,Seed,"$4,194","Jun 10, 2021",4Blind,Help to socialize and improve the health and well-being of people with visual disabilities with the help of technologies.,"Apps, Communication Hardware, Hardware, Health Care, iOS, Mechanical Engineering, Medical, Mobile Devices, Software, Technical Support",—,"Boston, Massachusetts, United States, North America",4blind.com/,,"$496,192",Seed,13,—,1
Seed Round - AEXLAB,Seed,Seed,"$1,069,000","May 28, 2021",AEXLAB,Advanced Virtual Reality Studio building groundbreaking VR experiences.,"Gaming, Video Games, Virtual Reality",—,"Miami, Florida, United States, North America",www.aexlab.com,,"$7,421,939",Early Stage Venture,3,—,—
Seed Round - Whisper Bidets,Seed,Seed,"$95,000","May 17, 2021",Whisper Bidets,Whisper Bidets is a consumer goods company that transforms old toilets into a modern one that leaves feeling fresh.,"Consumer Electronics, Consumer Goods, E-Commerce, Electronics",—,"Portland, Oregon, United States, North America",whisperbidets.com,,"$95,000",Seed,1,—,—
Seed Round - Prelude,Seed,Seed,"$1,200,000","Jun 28, 2021",Prelude,Prelude provides a platform designed to streamline recruiting operations.,"Information Technology, Recruiting, SaaS, Scheduling, Software",—,"San Francisco, California, United States, North America",prelude.co,,"$2,400,000",M&A,2,Fuel Capital,1
Seed Round - RoofMarketplace Inc.,Seed,Seed,"$1,100,000","Jul 1, 2021",RoofMarketplace Inc.,RoofMarketplacex is an online marketplace platform specifically targeting the property services market.,"Construction, Home Improvement, Internet, Marketplace, Property Management, Real Estate",—,"Whitewater, Wisconsin, United States, North America",www.roofmarketplace.com/,,"$6,100,000",Early Stage Venture,4,"American Family Ventures, Rock River Capital Partners",2
Seed Round - Upgrade Boutique,Seed,Seed,"$1,700,000","May 17, 2021",Upgrade Boutique,Upgrade Boutique is a managed marketplace that provides beauty products and services.,"Beauty, Cosmetics, Marketplace","Women Founded, Women Led","Houston, Texas, United States, North America",upgradeboutique.com,,"$2,720,000",Seed,3,"Mercury, The Artemis Fund",4
Seed Round - Terray Therapeutics,Seed,Seed,"$15,000,000","Jun 30, 2021",Terray Therapeutics,Terray Therapeutics is a biotechnology company that propels drug discovery into the information age.,"Artificial Intelligence, Biopharma, Biotechnology, Life Science, Medical",—,"Pasadena, California, United States, North America",terraytx.com,,"$80,000,000",Early Stage Venture,4,"Digitalis Ventures, Two Sigma Ventures",2
Seed Round - Linq,Seed,Seed,"$2,500,000","May 27, 2021",Linq,Linq is a networking ecosystem for the modern professional.,"Information Technology, Professional Networking, Software",—,"Birmingham, Alabama, United States, North America",linqapp.com,,"$5,500,000",—,3,Mucker Capital,3
Seed Round - BEKHealth,Seed,Seed,"$4,000,000","Jun 21, 2021",BEKHealth,BEKHealth offers R&D platform solutions focused on the efficiency and performance of clinical research operations.,"Hospital, Information Services, Medical",—,"Branford, Connecticut, United States, North America",bekhealth.com,,"$9,474,069",—,2,Excelerate Health Ventures,5
Seed Round - Cove.io,Seed,Seed,"$100,000","May 14, 2021",Cove.io,Cove.io is a technology company that makes infrastructure for running micro-funds.,"Information Technology, Internet, Software",—,"Seattle, Washington, United States, North America",www.cove.io/,,"$100,000",Seed,1,—,—
Seed Round - Sugar,Seed,Seed,"$2,500,000","Jul 12, 2021",Sugar,Sugar builds community and transforms the residential experience by integrating with technology stacks that power modern buildings.,"Hospitality, Information Technology, Property Management, Real Estate, Software","Black / African American Founded, Black / African American Led, Women Founded, Women Led","Los Angeles, California, United States, North America",www.sugarliving.com,,"$3,450,000",Seed,4,—,14
Pre Seed Round - MedScout,Pre-Seed,Seed,"$800,000","Jun 9, 2021",MedScout,MedScout is a revenue acceleration platform for medical device and diagnostic companies.,"Health Care, Medical, Sales, Software",—,"Austin, Texas, United States, North America",www.medscout.io/,,"$5,800,000",Seed,2,LiveOak Venture Partners,4
Pre Seed Round - BRAVE UP!,Pre-Seed,Seed,"$150,000","Jun 23, 2021",BRAVE UP!,"BRAVE UP! helps K-12 schools detect, predict and prevent cases of bullying and cyberbullying","EdTech, Education, Social Impact, Software","Hispanic / Latine Founded, Hispanic / Latine Led","New York, New York, United States, North America",www.braveup.com,,"$750,000",Seed,2,—,—
Seed Round - Specto,Seed,Seed,"$3,250,000","Jun 11, 2021",Specto,Specto is a mobile application performance monitoring platform that collects vital metrics and profiles with just a few lines of code.,"Application Performance Management, Information Technology, Mobile Apps, Software",—,"San Francisco, California, United States, North America",specto.dev,,"$3,250,000",M&A,2,—,7
Pre Seed Round - Intelligent Surveillance,Pre-Seed,Seed,"$150,000","Jun 22, 2021",Intelligent Surveillance,Intelligent Surveillance is a provider of remote intelligence surveillance sensor technology to law enforcement and customers alike.,"Consumer Electronics, Electronics, Manufacturing",—,"Forney, Texas, United States, North America",intelligentsurveillancecorp.com,,"$150,000",Seed,1,—,—
Seed Round - MentorCloud,Seed,Seed,"$1,500,000","Jun 30, 2021",MentorCloud,"MentorCloud is a cloud-based mentoring platform for enterprises to accelerate digital transformation, employee engagement and retention.","Banking, Enterprise Software, Hospitality, Information Technology, SaaS",—,"Menlo Park, California, United States, North America",www.mentorcloud.com,,"$3,000,000",—,3,—,—
Seed Round - Odiggo,Seed,Seed,"$125,000","Jun 1, 2021",Odiggo,Car services in minutes,"Health Care, Software",—,"San Francisco, California, United States, North America",www.odiggo.ai,,"$3,041,000",—,7,Y Combinator,1
Seed Round - Comfort Motion Global,Seed,Seed,"$250,000","May 26, 2021",Comfort Motion Global,"Comfort Motion Global is technology company developing an automotive, commercial trucking, and aerospace seating for spinal problems.","Automotive, Health Care, Software",—,"Indianapolis, Indiana, United States, North America",www.comfortmotion.com,,"$2,700,000",—,3,—,—
Seed Round - Nickels,Seed,Seed,"$20,000","Jun 1, 2021",Nickels,Nickels assist consumers of banks and credit unions in managing their money using behavioral science.,"Finance, Financial Services, Information Services, Mobile Apps",—,"Ann Arbor, Michigan, United States, North America",asknickels.com/,,"$4,020,000",Seed,5,Conquer Accelerator,1
Seed Round - SOMOS,Seed,Seed,"$100,000","May 15, 2021",SOMOS,SOMOS is offering genetic solutions that put at your disposal tests of global ancestry and Latin American ancestry.,"Bioinformatics, Biotechnology, Genetics, Health Care",Hispanic / Latine Founded,"San Francisco, California, United States, North America",www.somosancestria.com,,"$510,000",Seed,4,—,1
Seed Round - vig.io,Seed,Seed,"$1,500,000","Jun 1, 2021",vig.io,"vig.io is a web and mobile iOS/Android app that delivers virtual investing games & decision intelligence for Stocks, ETF, and Crypto.","Apps, Finance, FinTech, Gaming, Mobile Apps",—,"Tampa, Florida, United States, North America",vig.io/,,"$4,600,000",—,5,—,1
Seed Round - Blockfills,Seed,Seed,"$7,000,000","Jun 24, 2021",Blockfills,Blockfills is an institutional digital asset liquidity provider.,"Finance, Financial Services, Information Services",—,"Chicago, Illinois, United States, North America",www.blockfills.com/,,"$44,000,000",Early Stage Venture,2,—,6
Pre Seed Round - Savion Aerospace,Pre-Seed,Seed,"$190,000","Jun 8, 2021",Savion Aerospace,Savion Aerospace is an aircraft manufacturer whose mission is to introduce cleaner energy into aviation.,"Aerospace, Clean Energy, Industrial Manufacturing",—,"San Francisco, California, United States, North America",www.flysavion.com/,,"$190,000",Seed,4,Antler,1
Seed Round - Lumedica,Seed,Seed,"$200,000","Jun 4, 2021",Lumedica,"Lumedica is a technology startup that makes low-cost, high-performance imaging technologies to improve disease detection across the world.","Health Care, Health Diagnostics, Medical Device",—,"Durham, North Carolina, United States, North America",www.lumedicasystems.com,,"$2,439,444",Seed,7,—,—
Pre Seed Round - myAnIML,Pre-Seed,Seed,"$120,000","Jun 9, 2021",myAnIML,myAnIML uses AI to early predict diseases starting with cattle.,"AgTech, Artificial Intelligence, Software",South Asian Founded,"Overland Park, Kansas, United States, North America",myaniml.com,,"$295,000",Seed,2,Techstars,1
Seed Round - Rad Intelligence,Seed,Seed,"$1,000,000","Jun 1, 2021",Rad Intelligence,Rad Intelligence helps enterprise companies engage diverse and global audiences with authenticity at scale.,"Digital Media, Marketing, Marketing Automation",—,"Santa Monica, California, United States, North America",www.radintelligence.com,,"$3,433,773",Seed,11,—,—
Pre Seed Round - Redkik Inc.,Pre-Seed,Seed,"€250,000","Jun 23, 2021",Redkik Inc.,Redkik is a global InsurTech company providing SaaS solutions to transform the insurance industry within transportation.,"Insurance, InsurTech, Marine Transportation, SaaS, Software",—,"Oxford, Maryland, United States, North America",www.redkik.com/,,"$3,913,702",Seed,5,Ilari Schouwvlieger,3
Seed Round - StageConnect,Seed,Seed,"$790,000","Jun 8, 2021",StageConnect,StageConnect is a production-grade remote audience interaction software for Hybrid and Virtual Events.,"Event Management, Events, Software",—,"Nashua, New Hampshire, United States, North America",stageconnect.co,,"$1,482,814",Seed,3,—,—
Pre Seed Round - Awayr A.I.,Pre-Seed,Seed,"$100,000","Jun 24, 2021",Awayr A.I.,"Awayr A.I. develops software solutions for HMI development in automotive, defense, space and other applications.","Automotive, Human Computer Interaction, Machine Learning, Military, Public Safety, SaaS, Software, Space Travel, Transportation",—,"Cambridge, Massachusetts, United States, North America",awayrai.com,,"$135,000",Seed,3,gener8tor,1
Seed Round - Emerald Health Pharmaceuticals,Seed,Seed,"$300,000","Jul 8, 2021",Emerald Health Pharmaceuticals,EHP is a biotech company developing biotechnology and cannabinoids science and technology to treat incurable diseases.,"Biopharma, Biotechnology, Cannabis, Pharmaceutical",—,"San Diego, California, United States, North America",emeraldpharma.life,,"$300,000",Seed,1,—,—
Seed Round - Elephas,Seed,Seed,"$1,000,000","May 15, 2021",Elephas,"Elephas harnesses latest advances in cancer biology, multimodal microscopy, and artificial intelligence to empower clinical decision-making.","Artificial Intelligence, Biotechnology, Health Care, Health Diagnostics, Medical",—,"Madison, Wisconsin, United States, North America",elephas.com/,,"$68,500,000",Early Stage Venture,4,—,—
Seed Round - Lever,Seed,Seed,"$100,000","Jun 28, 2021",Lever,"Lever is a smart digital wallet platform to help consumers optimize credit card rewards, track spending, and improve credit scores.",FinTech,—,"New York, New York, United States, North America",www.levercard.com/,,"$100,000",Seed,1,—,1
Seed Round - ShardSecure,Seed,Seed,"$2,500,000","Jul 12, 2021",ShardSecure,ShardSecure is a cloud data security software company that specializes in data security and privacy with Microshard technology.,"Cloud Security, Information Technology, Network Security",—,"New York, New York, United States, North America",www.shardsecure.com,,"$15,600,000",Early Stage Venture,5,EPIC Ventures,3
Seed Round - Glyphic Biotechnologies,Seed,Seed,"$6,025,000","Jul 8, 2021",Glyphic Biotechnologies,Glyphic Biotechnologies is a biotechnology company that develops a protein sequencing platform.,"Biotechnology, Health Care, Life Science","East Asian Founded, East Asian Led, Native Hawaiian / Pacific Islander Founded, Native Hawaiian / Pacific Islander Led","New York, New York, United States, North America",www.glyphic.bio,,"$9,865,538",Seed,7,OMX Ventures,7
Seed Round - Better Agency,Seed,Seed,"$2,142,200","Jul 12, 2021",Better Agency,"Better Agency is a platform that gives insurance agents a high-tech, easy-to-use solution for marketing, prospecting, sales, and retention.","Insurance, Marketing, Software",—,"Mesa, Arizona, United States, North America",betteragency.io/,,"$10,142,200",Early Stage Venture,2,—,1
Seed Round - Automated Grading Services (AGS),Seed,Seed,"$1,000,000","Jun 25, 2021",Automated Grading Services (AGS),Grading cards and collectibles with artificial intelligence. Accurate. Consistent. Transparent.,"Artificial Intelligence, Collectibles, Machine Learning",—,"Staten Island, New York, United States, North America",agscard.com/,,"$1,000,000",Seed,1,—,—
Pre Seed Round - PWRFWD,Pre-Seed,Seed,"$120,000","Jun 7, 2021",PWRFWD,PWRFWD is an online marketplace that drives the Athlete to Consumer industry.,"Consumer Goods, E-Commerce, Marketplace",—,"Concord, New Hampshire, United States, North America",pwrfwd.co/,,"$750,000",Seed,2,Techstars,1
Seed Round - Omnitron Sensors,Seed,Seed,"$2,400,000","May 15, 2021",Omnitron Sensors,Omnitron sensors provides sensor technology.,"Manufacturing, Semiconductor, Sensor","Hispanic / Latine Founded, Hispanic / Latine Led","San Francisco, California, United States, North America",www.omnitronsensors.com/,,"$4,000,000",—,5,—,3
Seed Round - Naym,Seed,Seed,"$1,000,000","Jun 25, 2021",Naym,Workforce b2b platform for hiring top-class remote engineers.,"Human Resources, Recruiting",—,"Redwood City, California, United States, North America",www.naym.com,,"$1,000,000",Seed,1,Xploration Capital,1
Seed Round - Esusu,Seed,Seed,"$125,000","May 25, 2021",Esusu,Esusu is a financial technology platform that leverages data solutions to help residents and improve property performance.,"Credit, Financial Services, FinTech","Black / African American Founded, Black / African American Led","New York, New York, United States, North America",www.esusurent.com,,"$145,025,000",Early Stage Venture,6,Financial Solutions Lab,1
Seed Round - Singuli,Seed,Seed,"$3,699,998","Jun 30, 2021",Singuli,Singuli is an inventory optimization platform that offers spreadsheet tools for retailers.,"Artificial Intelligence, B2B, Machine Learning, Retail Technology, SaaS",Black / African American Founded,"New York, New York, United States, North America",singuli.co,,"$3,699,998",Seed,3,Harlem Capital Partners,8
Pre Seed Round - Dragon Family Company,Pre-Seed,Seed,"$200,000","Jun 1, 2021",Dragon Family Company,Family Social AI-Powered Edutainment Network,"EdTech, Education, Personal Development",—,"Wilmington, Delaware, United States, North America",dragonfamily.world,,"$2,216,700",Seed,4,—,—
Seed Round - Neatleaf,Seed,Seed,"$2,500,000","Jun 8, 2021",Neatleaf,Data-driven & autonomous agriculture for yield optimization.,"Agriculture, AgTech, Artificial Intelligence, Cloud Computing, Enterprise Software, Robotics, Sensor",—,"San Francisco, California, United States, North America",neatleaf.com,,"$8,000,000",Seed,2,—,1
Seed Round - StreetMetrics,Seed,Seed,"$2,265,000","Jun 2, 2021",StreetMetrics,"StreetMetrics is a SaaS platform, focused on creating measurement & attribution software for the Moving Out-Of-Home advertising industry.","Advertising, Mobile, Ride Sharing, SaaS, Software, Transportation",—,"Birmingham, Alabama, United States, North America",streetmetrics.com/,,"$3,265,000",Seed,3,—,—
Seed Round - Arpio,Seed,Seed,"$2,000,000","Jun 22, 2021",Arpio,Arpio protects and eliminates downtime for AWS applications by making it easy to recover from any outage in just a few minutes.,"B2B, Internet, SaaS",—,"Durham, North Carolina, United States, North America",arpio.io,,"$10,250,000",—,5,Valor Ventures,3
Seed Round - Kindra,Seed,Seed,"$4,500,000","Jun 15, 2021",Kindra,"Kindra, a modern wellness brand for menopause essentials.","Consumer Goods, Personal Health, Women's",—,"Santa Monica, California, United States, North America",ourkindra.com/,,"$4,500,000",Seed,1,Female Founders Fund,7
Seed Round - Ascenum,Seed,Seed,"$1,140,000","Jun 23, 2021",Ascenum,Ascenum provides online business valuation tools and access to a digital marketplace of specialty service providers.,"Marketplace, Service Industry",—,"Key Largo, Florida, United States, North America",ascenum.com,,"$1,140,000",Seed,1,—,—
Seed Round - Lake Street Software,Seed,Seed,"$100,000","Jul 8, 2021",Lake Street Software,Lake Street Software is an IT company developing tools to simplify the deployment and utilization of IoT devices.,"Information Technology, Internet of Things, Software",—,"Boise, Idaho, United States, North America",lakestreetsoftware.com,,"$100,000",Seed,1,—,—
Pre Seed Round - Rewire Neuro,Pre-Seed,Seed,"$50,000","May 21, 2021",Rewire Neuro,Rewire Neuro hosts an AI-as-a-Service platform that provides computer vision services to diagnostic device and microscope partners.,"Artificial Intelligence, Biotechnology, Life Science, Machine Learning",—,"Portland, Oregon, United States, North America",rewireneuro.com,,"$2,639,838",Seed,7,—,1
Seed Round - myYogaTeacher,Seed,Seed,"$3,000,000","Jun 16, 2021",myYogaTeacher,myYogaTeacher is a live and interactive yoga platform that offers group and one-on-one yoga classes.,"Fitness, Personal Health, Wellness",—,"Cupertino, California, United States, North America",www.myyogateacher.com,,"$3,000,000",Seed,2,TSVC,5
Seed Round - Hive Pro,Seed,Seed,"$3,000,000","Jun 22, 2021",Hive Pro,Hive Pro is a cybersecurity company that provides threat exposure management services.,—,—,"Herndon, Virginia, United States, North America",www.hivepro.com/,,"$7,000,000",Seed,2,Simpro Holding,1
Pre Seed Round - ESTOKEN,Pre-Seed,Seed,"$60,000","Jun 10, 2021",ESTOKEN,Bringing the benefits of blockchain to real estate investing,—,—,"American Fork, Utah, United States, North America",ESTOKEN.com,,"$1,060,000",Seed,2,—,—
Seed Round - Bright,Seed,Seed,"$150,000","Jun 1, 2021",Bright,Veronica is a Fully,—,—,"Wellington, Texas, United States, North America",,,"$150,000",Seed,1,—,—
Pre Seed Round - Upside,Pre-Seed,Seed,"$2,300,000","Jul 12, 2021",Upside,Upside is a fully-managed living option for older adults.,"Elder Care, Health Care, Information Technology, Real Estate",—,"Fort Lauderdale, Florida, United States, North America",www.joinupside.com,,"$7,910,000",Seed,5,"Freestyle Capital, Triple Impact Capital",3
Seed Round - Hydrosat,Seed,Seed,"$5,000,000","Jun 17, 2021",Hydrosat,"Hydrosat provides geospatial intelligence for food security, critical infrastructure, and the environment.","Aerospace, AgTech, Analytics, Artificial Intelligence, Big Data, Geospatial, Information Services, Machine Learning",—,"Washington, District of Columbia, United States, North America",www.hydrosat.com,,"$35,623,002",Early Stage Venture,9,Cultivation Capital,10
Seed Round - Ready,Seed,Seed,"$4,000,000","May 31, 2021",Ready,Ready makes software that helps local internet service providers connect more subscribers to better broadband services.,"Financial Services, FinTech, Software",—,"San Francisco, California, United States, North America",ready.net/,,"$15,700,000",Early Stage Venture,3,—,2
Seed Round - Thrivable,Seed,Seed,"$1,780,000","Jun 9, 2021",Thrivable,Thrivable is a platform that helps healthcare organizations tap into a comprehensive patient database to do market research activities.,"Apps, B2B, Consumer Research, CRM, Health Care",—,"Cleveland, Ohio, United States, North America",thrivable.app/,,"$2,105,000",Seed,3,Allos Ventures,4
Pre Seed Round - Cut Above Zero Proof Spirits,Pre-Seed,Seed,"$100,000","Jul 1, 2021",Cut Above Zero Proof Spirits,Cut Above is a selection of zero alcohol spirits made with all-natural ingredients.,"Food and Beverage, Retail, Wine And Spirits","Hispanic / Latine Founded, Hispanic / Latine Led","Houston, Texas, United States, North America",www.drinkcutabove.com,,"$506,000",Seed,2,—,—
Seed Round - FinalPrice,Seed,Seed,"$1,000,000","Jul 5, 2021",FinalPrice,FinalPrice is a private travel club for travel enthusiasts and professionals.,"Tourism, Travel, Travel Accommodations",—,"Los Angeles, California, United States, North America",hotels.finalprice.com,,"$6,200,000",Seed,3,—,2
Seed Round - Ulcer Solutions,Seed,Seed,"$225,000","Jun 23, 2021",Ulcer Solutions,Ulcer Solutions develops an off-loading device designed for pressure ulcer prevention and treatment.,"Health Care, Medical, Medical Device",—,"Ridgefield, Washington, United States, North America",ulcersolutions.com,,"$475,000",Seed,3,—,—
Seed Round - Frizzmo,Seed,Seed,"$20,000","Jun 1, 2021",Frizzmo,Frizzmo is a banking app and an online platform that facilitates parents to guide kids' liable money management and donate for teachers.,"Apps, Financial Services, Payments",—,"Novi, Michigan, United States, North America",frizzmo.com/,,"$20,000",Seed,4,Conquer Accelerator,1
Seed Round - Good Earth Organics,Seed,Seed,"$2,800,000","Jul 1, 2021",Good Earth Organics,Certified organic potting soil and soil amendments,—,—,"Cave Junction, Oregon, United States, North America",goodearthorganics.com/,,"$2,800,000",Seed,2,—,1
Pre Seed Round - Gainy,Pre-Seed,Seed,"$300,000","Jun 4, 2021",Gainy,Thematic investing platform for retail investors,"Financial Services, Software",—,"San Francisco, California, United States, North America",gainy.app,,"$910,000",Seed,4,—,1
Seed Round - Sonic AI — Audio Messenger,Seed,Seed,"$2,500,000","Jun 25, 2021",Sonic AI — Audio Messenger,"Sonic is a company out of Stanford University specializing in Cryptography, NLP, TTS, and ASR as relating to their uses in messaging.",—,—,"Los Angeles, California, United States, North America",sonic.app.link/,,"$2,500,000",Seed,1,—,—
Seed Round - Crediverso,Seed,Seed,"$3,100,000","Jun 18, 2021",Crediverso,Crediverso is a financial technology platform.,"Finance, Financial Services, FinTech, Marketplace, Mobile Apps",Hispanic / Latine Founded,"Los Angeles, California, United States, North America",www.crediverso.com,,"$3,100,000",Seed,1,"Act One Ventures, Bessemer Venture Partners, Clocktower Technology Ventures, Point72 Ventures",4
Seed Round - Neptune,Seed,Seed,"$500,000","Jun 8, 2021",Neptune,"Neptune helps hospitals track, audit, and manage the healthcare supply chain.","Health Care, Medical Device, Supply Chain Management",—,"Keene, New Hampshire, United States, North America",landing.neptuneppa.com,,"$500,000",Seed,1,—,—
Seed Round - Curate,Seed,Seed,"$1,250,000","Jun 18, 2021",Curate,"Curate provides end-to-end event, COGS, and rental management services.","Event Management, Events, Software",—,"Saint Louis, Missouri, United States, North America",www.curate.co,,"$4,249,995",—,3,OCA Ventures,6
Pre Seed Round - Reliabl,Pre-Seed,Seed,"$89,000","Jun 1, 2021",Reliabl,Inclusive content moderation for community platforms.,"Blockchain, Communities, Content","Women Founded, Women Led","San Diego, California, United States, North America",reliabl.ai,,"$89,000",Seed,1,—,2
Seed Round - Everyday Life,Seed,Seed,"$125,000","May 25, 2021",Everyday Life,"Everyday Life is an insurance company that provides life insurance, insurtech, and fintech services.","Financial Services, FinTech, Health Care, Insurance, InsurTech","South Asian Founded, Women Founded","Boston, Massachusetts, United States, North America",everydaylifeinsurance.com,,"$2,700,000",Seed,5,Financial Solutions Lab,1
Pre Seed Round - Zulu Pods,Pre-Seed,Seed,"$425,000","Jul 12, 2021",Zulu Pods,Zulu Pods is an aerospace Technology start-up that develops lubrication systems for jet engines.,"Aerospace, Air Transportation, Military",—,"Fort Lauderdale, Florida, United States, North America",www.zulupods.com,,"$455,000",Seed,2,—,—
Seed Round - Shipium,Seed,Seed,"$8,000,000","Jun 9, 2021",Shipium,Shipium is the Premier Shipping Platform for retail and ecommerce. We make fast shipping the cornerstone of a great shopping experience.,"E-Commerce, Logistics, Retail Technology, SaaS, Software",—,"Seattle, Washington, United States, North America",www.shipium.com/,,"$37,500,000",Early Stage Venture,3,Trilogy Equity Partners,5
Pre Seed Round - HEADLINE,Pre-Seed,Seed,"$25,000","May 31, 2021",HEADLINE,HEADLINE is a Texas-based fintech startup and media company. We build software on the Algorand blockchain.,"Blockchain, FinTech, News, Software, Web Development",—,"San Antonio, Texas, United States, North America",www.xspace.nexus,,"$125,000",Seed,2,—,—
Seed Round - Gravis Finance,Seed,Seed,"$150,000","Jun 3, 2021",Gravis Finance,Gamified DeFi ecosystem. High-Profit Yield Farming. Smart NFT assets. Multichain DEX. Cross-chain bridge.,"Blockchain, Cryptocurrency",—,"New York, New York, United States, North America",gravis.finance,,"$450,000",Seed,3,—,—
