Transaction Name,Funding Type,Funding Stage,Money Raised,Announced Date,Organization Name,Organization Description,Organization Industries,Diversity Spotlight,Organization Location,Organization Website,Organization Revenue Range,Total Funding Amount,Funding Status,Number of Funding Rounds,Lead Investors,Number of Investors
Seed Round - MessageDesk,Seed,Seed,"$1,661,037","Mar 24, 2023",MessageDesk,MessageDesk is a shared team inbox for business text messaging.,"Messaging, SaaS, SMS, Software",—,"Reno, Nevada, United States, North America",messagedesk.com,,"$1,901,037",Seed,2,Reno Seed Fund,6
Seed Round - zkPass,Seed,Seed,"$2,500,000","Apr 3, 2023",zkPass,zkPass is a privacy-preserving protocol for private data verification.,Blockchain,—,"New York, New York, United States, North America",zkpass.org,,"$2,500,000",—,4,Binance Labs,8
Seed Round - SnoFox Sciences,Seed,Seed,"$4,500,000","Apr 6, 2023",SnoFox Sciences,SnoFox Sciences provides analytics focused on increasing efficiency and decreasing energy usage for the cold industrial space.,"Analytics, Energy, Information Technology",—,"New York, New York, United States, North America",snofox.com/,,"$5,700,000",Seed,2,Voyager Ventures,4
Seed Round - Soul Wallet,Seed,Seed,"$3,000,000","Mar 16, 2023",Soul Wallet,Soul Wallet is a smart contract wallet.,—,—,"Santa Monica, California, United States, North America",www.soulwallet.io/,,"$3,000,000",Seed,1,—,42
Seed Round - FedML,Seed,Seed,"$11,500,000","Mar 28, 2023",FedML,"SaaS, PaaS, MLaaS (machine learning as a service)","Artificial Intelligence, Machine Learning, Software",—,"Sunnyvale, California, United States, North America",fedml.ai,,"$13,500,000",Seed,2,Camford Capital,13
Seed Round - Elevai Labs,Seed,Seed,"$463,589","Apr 27, 2023",Elevai Labs,Elevai Labs is a biotechnology company that develops regenerative skin care applications.,"Beauty, Biotechnology, Cosmetics",—,"Davis, California, United States, North America",elevaiskincare.com/,,"$1,554,166",Seed,2,—,—
Pre Seed Round - Automat AI,Pre-Seed,Seed,"$500,000","Mar 9, 2023",Automat AI,Automat offers robotic process automation for Chrome using GPT4 and computer vision.,"Artificial Intelligence, Developer Tools",—,"San Francisco, California, United States, North America",runautomat.com,,"$4,250,000",Seed,2,Y Combinator,1
Seed Round - Chaos Labs,Seed,Seed,"$20,000,000","Feb 21, 2023",Chaos Labs,Chaos Labs is a cloud platform that allows teams to build high-fidelity agent and scenario-based simulations on mainnet forks.,"Blockchain, Cloud Infrastructure, Risk Management, Software, Web Development",—,"New York, New York, United States, North America",chaoslabs.xyz,,"$20,000,000",Seed,1,"Galaxy Venture Capital, PayPal Ventures",32
Seed Round - Affine,Seed,Seed,"$5,100,000","Feb 23, 2023",Affine,Affine is a Web3 protocol and dApp that helps users automate their savings and grow their crypto holdings by getting rid of high fees.,"Cryptocurrency, Internet, Software",—,"Miami, Florida, United States, North America",affinedefi.com/,,"$6,900,000",Seed,2,"Hack VC, Jump Crypto",6
Seed Round - Jia,Seed,Seed,"$4,300,000","Apr 26, 2023",Jia,Jia provides blockchain-based financing to businesses in emerging markets and delivers returns on real-world assets to investors.,"Banking, Blockchain, Cryptocurrency, Emerging Markets, Finance, Financial Services, FinTech, Lending",—,"Los Angeles, California, United States, North America",jia.xyz,,"$5,300,000",Seed,3,TCG Crypto,16
Pre Seed Round - Koree,Pre-Seed,Seed,"€20,000","Apr 17, 2023",Koree,Francophone Africa's first and largest Rewards scheme,"Affiliate Marketing, Consumer, Financial Services, Retail",—,"Middletown, Delaware, United States, North America",koree.africa,,"$186,849",Seed,5,Cameroon Angels Network,1
Seed Round - SquadTrip,Seed,Seed,"$1,500,000","Apr 13, 2023",SquadTrip,SquadTrip is a SaaS platform that makes booking and payments easy for group trips.,"SaaS, Travel, Travel Accommodations",—,"Tulsa, Oklahoma, United States, North America",www.squadtrip.com/,,"$1,650,000",Seed,3,Atento Capital,2
Seed Round - MOGL,Seed,Seed,"$2,600,000","Mar 23, 2023",MOGL,MOGL is a marketplace for athletes and brands that connects brands with college athletes.,"Advertising, Affiliate Marketing, Brand Marketing, Marketing, Marketplace, Software",—,"Royal Palm Beach, Florida, United States, North America",www.mogl.online,,"$2,600,000",Seed,2,Magarac Venture Partners,10
Seed Round - Fractal,Seed,Seed,"$6,000,000","Apr 17, 2023",Fractal,"Fractal expands the digital economy by providing institutional grade, capital efficient technology for assets on-chain.","Blockchain, Finance",—,"New York, New York, United States, North America",www.fractalprotocol.org/,,"$6,000,000",Seed,1,Hack VC,15
Seed Round - Videowise,Seed,Seed,"$3,000,000","Mar 27, 2023",Videowise,Videowise is a review application platform that automates product video reviews for online stores.,"Consumer Reviews, E-Commerce, Marketing Automation",—,"Dover, Delaware, United States, North America",www.videowise.com/,,"$3,000,000",Seed,1,Slack Fund,10
Seed Round - Ansa,Seed,Seed,"$5,400,000","Apr 26, 2023",Ansa,The closed loop platform built for your customers,—,—,"San Francisco, California, United States, North America",www.ansa.dev/,,"$5,400,000",Seed,1,Bain Capital Ventures,10
Seed Round - Term Labs,Seed,Seed,"$2,500,000","Feb 28, 2023",Term Labs,"Term Labs is a blockchain research and development business, is to provide scalable, transparent fixed-rate lending on blockchains.","Blockchain, Finance, Service Industry",—,"San Diego, California, United States, North America",termfinance.io/,,"$2,500,000",Seed,1,Electric Capital,5
Seed Round - Togal.AI,Seed,Seed,"$5,000,000","Mar 21, 2023",Togal.AI,Togal.AI is the fastest estimating takeoff software powered by deep machine learning.,"Artificial Intelligence, Information Technology, Machine Learning, Software",—,"Miami, Florida, United States, North America",togal.ai/,,"$5,000,000",Seed,2,—,2
Seed Round - Fynn,Seed,Seed,"$11,000,000","Mar 7, 2023",Fynn,Fynn provides education loans and financial assistance to students.,"Finance, Financial Services, Lending",—,"Wilmington, Delaware, United States, North America",fynncredit.com,,"$40,011,495",Seed,7,"Susa Ventures, Tenacity Venture Capital, Village Global, Watchfire Ventures, Y Combinator",7
Seed Round - Chroma,Seed,Seed,"$18,000,000","Apr 6, 2023",Chroma,Chroma operates as an AI-native open-source embedding database.,"Artificial Intelligence, Database, Software",—,"San Francisco, California, United States, North America",www.trychroma.com/,,"$20,300,000",Seed,2,Quiet Capital,9
Seed Round - Ampersand,Seed,Seed,"$4,700,000","Apr 13, 2023",Ampersand,Ampersand is a development platform for user-facing SaaS integrations.,"Information Technology, Internet, Software",—,"San Francisco, California, United States, North America",www.withampersand.com,,"$4,700,000",Seed,1,Matrix Partners,15
Seed Round - Tavus,Seed,Seed,"$6,100,000","Mar 20, 2023",Tavus,"Record One Video, We'll Handle The Next Thousand","Artificial Intelligence, Developer Platform, Software, Video",—,"San Francisco, California, United States, North America",www.tavus.io/,,"$24,100,000",Early Stage Venture,4,Sequoia Capital,15
Seed Round - Type One Energy,Seed,Seed,"$29,000,000","Mar 28, 2023",Type One Energy,Type One Energy is a high-temperature superconducting stellarator magnet with additive manufactured assemblies.,"Clean Energy, Electrical Distribution, Energy, Energy Management",—,"Middleton, Wisconsin, United States, North America",www.typeoneenergy.com,,"$29,000,000",Seed,2,"Breakthrough Energy Ventures, Doral Energy-Tech Ventures, TDK Ventures",10
Seed Round - Blacktop Hoops,Seed,Seed,"$5,100,000","Apr 18, 2023",Blacktop Hoops,Blacktop Hoops is a multiplayer virtual reality sports game inspired by the society of streetball.,"Computer, Online Games, PC Games, Virtual Reality",—,"Berkeley, California, United States, North America",www.blacktophoopsvr.com,,"$5,100,000",Seed,2,Makers Fund,7
Seed Round - Tally Health,Seed,Seed,"$10,000,000","Apr 6, 2023",Tally Health,Tally Health™ is a biotechnology company founded to change the way we age. Co-founded by longevity expert Dr. David Sinclair.,Biotechnology,—,"New York, New York, United States, North America",www.tallyhealth.com,,"$10,000,000",Seed,1,Forerunner Ventures,12
Pre Seed Round - CAT Labs,Pre-Seed,Seed,"$4,300,000","Apr 10, 2023",CAT Labs,CAT Labs is working on cybersecurity and digital asset recovery solutions.,"Computer, Network Security",—,"Miami, Florida, United States, North America",catlabs.io,,"$4,300,000",Seed,2,"BH Digital, Castle Island Ventures, CMT Digital Ventures, RW3 Ventures",9
Seed Round - Catalyst,Seed,Seed,"$4,200,000","Apr 26, 2023",Catalyst,"Catalyst is an open-source liquidity protocol for modular blockchains, developed by Cata Labs.","Blockchain, Cryptocurrency, Open Source",—,"Wilmington, Delaware, United States, North America",catalyst.exchange,,"$4,200,000",Seed,2,The Spartan Group,10
Seed Round - Rise,Seed,Seed,"$3,800,000","Apr 24, 2023",Rise,"We make it easy for businesses to onboard, pay and manage independent contractors globally & compliantly.","Cryptocurrency, Freelance, Human Resources, Infrastructure, Payments",—,"Pike Road, Alabama, United States, North America",www.riseworks.io,,"$3,800,000",Seed,1,"Polymorphic Capital, Sino Global Capital",15
Pre Seed Round - ROOK,Pre-Seed,Seed,"$1,700,000","Mar 18, 2023",ROOK,Transform health data from wearables into actionable insights,"Apps, Fitness, Health Care, Mobile Apps, Sports, Wearables, Wellness","Hispanic / Latine Founded, Hispanic / Latine Led","Miami, Florida, United States, North America",www.tryrook.io,,"$4,220,000",Seed,6,Tech Coast Angels San Diego,14
Seed Round - EVEN,Seed,Seed,"$2,200,000","Apr 14, 2023",EVEN,Empowering artists & fans to invest in each other.,"Blockchain, Music",—,"Milwaukee, Wisconsin, United States, North America",www.even.biz,,"$2,200,000",Seed,1,CSA Partners LLC,7
Seed Round - Cubist,Seed,Seed,"$7,000,000","Mar 9, 2023",Cubist,Cubist is a developer tools and infrastructure company that helps web3 engineers build safer dapps faster.,"Blockchain, Developer Tools, Software",—,"San Diego, California, United States, North America",cubist.dev,,"$7,000,000",Seed,1,Polychain,15
Seed Round - Avalon,Seed,Seed,"$13,000,000","Feb 28, 2023",Avalon,"Avalon is an Orlando, Florida-based platform to create games and virtual experiences.","Gaming, Virtual Reality",—,"Orlando, Florida, United States, North America",playavalon.com/,,"$13,000,000",Seed,1,"BITKRAFT Ventures, Delphi Ventures, Hashed, Mechanism Capital",14
Seed Round - Metalink,Seed,Seed,"$6,000,000","Mar 15, 2023",Metalink,Metalink is a crypto-native chat app.,—,—,"Los Angeles, California, United States, North America",www.metalink.com/,,"$6,300,000",Seed,2,—,12
Pre Seed Round - SuperDuperSecret,Pre-Seed,Seed,"$1,000,000","Apr 21, 2023",SuperDuperSecret,SuperDuperSecret is a multiplayer game that focuses on the sweet spot.,"Gaming, Media and Entertainment, PC Games",—,"San Francisco, California, United States, North America",www.superdupersecret.co,,"$1,000,000",Seed,1,—,10
Pre Seed Round - Trustible,Pre-Seed,Seed,"$1,600,000","Apr 19, 2023",Trustible,Trustible is an AI Governance management platform.,"Artificial Intelligence, Information Technology, Software",—,"Arlington, Virginia, United States, North America",www.trustible.ai,,"$1,600,000",Seed,1,Harlem Capital Partners,8
Seed Round - Aqua Cultured Foods,Seed,Seed,"$5,500,000","Apr 6, 2023",Aqua Cultured Foods,AquaCultured Foods develops a novel new tech that creates an alternative seafood option through the use of microbial fermentation.,"AgTech, Biotechnology, Food Processing, Seafood, Sustainability","Women Founded, Women Led","Chicago, Illinois, United States, North America",www.aquaculturedfoods.com,,"$7,800,000",Seed,3,Stray Dog Capital,10
Seed Round - Huddle01,Seed,Seed,"$2,800,000","Apr 6, 2023",Huddle01,Building the decentralized real-time communication network.,"Blockchain, Information Technology, Software, Video Conferencing",—,"Middletown, Delaware, United States, North America",huddle01.com/,,"$4,600,000",Seed,2,Hivemind Capital Partners,11
Seed Round - POSH,Seed,Seed,"$3,500,000","Apr 27, 2023",POSH,POSH is reinventing the online ecosystem for live experiences.,"CRM, Event Management, Event Promotion, Software, Ticketing","Black / African American Founded, Black / African American Led","New York, New York, United States, North America",www.posh.vip,,"$5,025,000",Seed,4,"Companyon Ventures, EPIC Ventures",7
Seed Round - Consensus,Seed,Seed,"$3,000,000","Apr 21, 2023",Consensus,Consensus is a search engine that uses AI to find answers in scientific research.,"Artificial Intelligence, Machine Learning, Natural Language Processing, Search Engine, Software, Subscription Service, Vertical Search",—,"Boston, Massachusetts, United States, North America",consensus.app,,"$4,200,000",Seed,2,Draper Associates,9
Seed Round - AMBOSS,Seed,Seed,"$4,000,000","Apr 25, 2023",AMBOSS,AMBOSS makes tools that help organize the market on the bitcoin lightning network.,"Information Technology, Lighting, Software",—,"Portland, Oregon, United States, North America",amboss.space,,"$4,000,000",Seed,1,StillMark,5
Seed Round - Absolute Labs,Seed,Seed,"$8,000,000","Apr 11, 2023",Absolute Labs,Absolute Labs is a SaaS wallet relationship management platform.,"Infrastructure, Management Consulting, Web Design",—,"San Francisco, California, United States, North America",www.absolutelabs.io,,"$8,000,000",Seed,1,—,10
Pre Seed Round - Flowlie,Pre-Seed,Seed,"$300,000","Mar 1, 2023",Flowlie,Flowlie is a data infrastructure platform for venture fundraising.,"Analytics, Information Technology, Productivity Tools, Sales Automation, Software",—,"Miami, Florida, United States, North America",www.flowlie.com/,,"$300,000",Seed,1,—,—
Pre Seed Round - Coinflow Labs,Pre-Seed,Seed,"$1,450,000","Apr 19, 2023",Coinflow Labs,Coinflow Labs is a web3 payment stack provider.,Payments,—,"Chicago, Illinois, United States, North America",coinflow.cash/,,"$1,450,000",Seed,1,"Jump Crypto, Reciprocal Ventures",8
Seed Round - CollX,Seed,Seed,"$5,500,000","Feb 22, 2023",CollX,"CollX is a mobile app that enables users to take a picture of a collectible, identify it, and get the current market value.","Information Technology, Mobile Apps, Software",—,"Haddonfield, New Jersey, United States, North America",collx.app,,"$6,000,000",Seed,3,Brand Foundry Ventures,13
Seed Round - EcoSapiens,Seed,Seed,"$3,500,000","Apr 4, 2023",EcoSapiens,Ecosapiens is a Web3/NFT project enabling consumers to make a positive impact on the climate.,—,—,"San Francisco, California, United States, North America",www.ecosapiens.xyz,,"$5,000,000",Seed,2,Collab+Currency,9
Seed Round - Treat,Seed,Seed,"$8,500,000","Apr 4, 2023",Treat,Treat is a customer acquisition channel that delivers leads to e-commerce brands.,"E-Commerce, Lead Generation, Marketing",—,"New York, New York, United States, North America",treat.xyz,,"$15,024,925",Seed,3,Greylock,12
Seed Round - Entitle,Seed,Seed,"$15,000,000","Feb 22, 2023",Entitle,"Entitle is a cloud permissions management platform that automates how access to cloud resources is requested, granted, and audited.","Cloud Infrastructure, Cloud Management, Cloud Security, Cyber Security, Identity Management, Information Technology, IT Infrastructure, SaaS, Software",—,"New York, New York, United States, North America",entitle.io,,"$15,000,000",Seed,1,Glilot Capital Partners,9
Seed Round - Irrigreen,Seed,Seed,"$15,000,000","Mar 29, 2023",Irrigreen,Internet connected digital sprinklers that save 50% of water used in landscape irrigation.,Internet,—,"San Francisco, California, United States, North America",irrigreen.com,,"$16,894,000",Seed,3,Ulu Ventures,9
Seed Round - Stack Identity,Seed,Seed,"$4,000,000","Apr 24, 2023",Stack Identity,"Stack Identity transforms cloud IAM operations to secure cloud data, applications and software","Cloud Management, Cloud Security, Cyber Security, Identity Management",—,"Menlo Park, California, United States, North America",stackidentity.com,,"$4,000,000",Seed,2,"Benhamou Global Ventures, WestWave Capital",3
Seed Round - Mansa,Seed,Seed,"$8,000,000","Apr 18, 2023",Mansa,Mansa develops a streaming platform featuring the black culture.,"Information Technology, Social, Video Streaming",—,"Woodland Hills, California, United States, North America",www.mansa.com/,,"$8,000,000",Seed,1,MaC Venture Capital,7
Seed Round - Trustle,Seed,Seed,"$6,000,000","Apr 4, 2023",Trustle,Trustle is an enterprise security company that automates access management while ensuring users have enough access.,"Information Services, Information Technology, Security",—,"Walnut Creek, California, United States, North America",trustle.com,,"$6,000,000",Seed,1,Glasswing Ventures,4
Seed Round - Wheel the World,Seed,Seed,"$6,000,000","Mar 9, 2023",Wheel the World,Wheel the World is an online travel agency focused on accessible travel for people with disabilities.,"E-Commerce, Tourism, Travel",—,"Berkeley, California, United States, North America",gowheeltheworld.com/,,"$10,560,000",Seed,12,Kayak Ventures,8
Seed Round - TipLink,Seed,Seed,"$6,000,000","Feb 21, 2023",TipLink,TipLink is a lightweight wallet that helps send digital assets by sending an URL.,"Blockchain, Cryptocurrency, Payments",—,"New York, New York, United States, North America",tiplink.io,,"$6,000,000",Seed,1,"Multicoin Capital, Sequoia Capital",12
Seed Round - IDPartner,Seed,Seed,"$3,100,000","Apr 25, 2023",IDPartner,IDPartner is a startup providing online identity verification through a network of financial institutions,"Information Services, Information Technology, Internet",—,"San Francisco, California, United States, North America",www.idpartner.com,,"$3,100,000",Seed,1,Abstract Ventures,7
Seed Round - NuMind,Seed,Seed,"$3,000,000","Mar 30, 2023",NuMind,Next-generation NLP tool. YC S22.,Artificial Intelligence,—,"Cambridge, Massachusetts, United States, North America",www.numind.ai,,"$3,500,000",Seed,3,Flybridge,7
Pre Seed Round - Speedscale,Pre-Seed,Seed,"$9,000,000","Mar 7, 2023",Speedscale,Speedscale allows users to stress test cloud services with real-world scenarios.,"Developer APIs, Information Technology, Productivity Tools, Test and Measurement, Usability Testing",—,"Atlanta, Georgia, United States, North America",speedscale.com/,,"$11,975,000",Seed,4,Grotech Ventures,9
Seed Round - Superfiliate,Seed,Seed,"$3,000,000","Mar 29, 2023",Superfiliate,Superfiliate is for re-writing the story on word-of-mouth marketing.,—,—,"Los Angeles, California, United States, North America",www.superfiliate.com/,,"$3,000,000",Seed,1,"Hawke Ventures, Vanterra Capital",11
Seed Round - HUG,Seed,Seed,"$5,000,000","Apr 12, 2023",HUG,HUG is a social marketplace that links artists with current and prospective collectors by allowing them to sell digital and tangible goods.,"Blockchain, Service Industry",—,"New City, New York, United States, North America",thehug.xyz,,"$5,000,000",Seed,1,DIGITAL,7
Seed Round - GoodShip,Seed,Seed,"$5,000,000","Apr 14, 2023",GoodShip,GoodShip offers a cloud-based platform for collaboration that automates labor-intensive procurement processes.,—,—,"Nashville, Tennessee, United States, North America",goodship.io,,"$7,400,000",Seed,2,"Chicago Ventures, Ironspring",4
Seed Round - AirOps,Seed,Seed,"$7,000,000","Apr 26, 2023",AirOps,AirOps allows users to create AI-enabled applications on top of Large Language Models (LLMs).,"Business Development, Developer APIs, Developer Tools, Productivity Tools",—,"Miami, Florida, United States, North America",www.airops.com,,"$7,000,000",Seed,1,Wing Venture Capital,6
Seed Round - Bundle x Joy,Seed,Seed,"$1,000,000","Mar 14, 2023",Bundle x Joy,"Bundle x Joy is a consumer goods company on a mission to deliver convenience, curation, and community to every pet person.","Consumer Goods, Pet, Subscription Service","Hispanic / Latine Founded, Hispanic / Latine Led, Women Founded, Women Led","Glendale, Arizona, United States, North America",bundlexjoy.com/,,"$1,557,500",Seed,5,Leap Venture Studio,4
Seed Round - Lonestar,Seed,Seed,"$5,000,000","Mar 6, 2023",Lonestar,Lonestar is a provider of space data services.,"Cloud Computing, Cloud Data Services, Data Center",—,"St. Petersburg, Florida, United States, North America",www.lonestarlunar.com/,,"$5,000,000",Seed,3,Scout Ventures,7
Seed Round - Barvecue,Seed,Seed,"$1,049,989","Mar 8, 2023",Barvecue,Barvecue is a food company that offers barbecues for vegetarians.,"Food and Beverage, Restaurants, Snack Food",—,"Cornelius, North Carolina, United States, North America",www.barvecue.com/,,"$3,049,989",Seed,3,—,9
Seed Round - Tiamat Sciences,Seed,Seed,"$2,000,000","Mar 9, 2023",Tiamat Sciences,Tiamat Sciences makes plant-based growth factors & proteins for cell-culture,"AgTech, Biotechnology, Food and Beverage, Medical","Women Founded, Women Led","Durham, North Carolina, United States, North America",www.tiamat-sciences.com/,,"$5,535,786",Seed,6,8090 Industries,11
Seed Round - Yess,Seed,Seed,"$2,000,000","Apr 4, 2023",Yess,Yess is an all-in-one operating system for freelancers and agencies to automate business and financial operations.,"B2B, CRM, Freelance, Information Technology, Project Management, SaaS, Software",—,"New York, New York, United States, North America",yess.io,,"$2,000,000",Seed,1,—,8
Seed Round - Matchday,Seed,Seed,"$21,000,000","Mar 8, 2023",Matchday,"Matchday combines video games, sports, and Web3 in order to create an ecosystem of casual football (soccer) games.","Information Technology, Internet, Sports, Video Games",—,"San Francisco, California, United States, North America",matchday.com,,"$21,000,000",Seed,2,—,8
Seed Round - Groundlight AI,Seed,Seed,"$10,000,000","Apr 19, 2023",Groundlight AI,Groundlight provides facile English language instructions and few lines of code that allow developer to interpret photos programmatically.,"Artificial Intelligence, Internet, Publishing, Software",—,"New York, New York, United States, North America",www.groundlight.ai,,"$10,000,000",Seed,1,Madrona,6
Seed Round - Renew,Seed,Seed,"$8,000,000","Apr 11, 2023",Renew,Renew helps renters seamlessly renew their lease or find another home within their property's network.,"Real Estate, Rental, Software",—,"Brooklyn, New York, United States, North America",heyrenew.com/,,"$16,325,000",Seed,3,—,6
Seed Round - Windfall Bio,Seed,Seed,"$9,000,000","Mar 22, 2023",Windfall Bio,Windfall Bio operates as an agricultural technology company.,"Agriculture, AgTech",—,"Menlo Park, California, United States, North America",www.windfall.bio/,,"$9,000,000",Seed,2,"Mayfield Fund, SOSV, UNTITLED",8
Seed Round - Axle,Seed,Seed,"$4,000,000","Apr 10, 2023",Axle,Axle is an open platform for consumer-permissioned insurance data.,"B2B, Developer APIs, FinTech, InsurTech",—,"Atlanta, Georgia, United States, North America",axle.insure,,"$4,500,000",Seed,2,Gradient Ventures,6
Seed Round - Entre,Seed,Seed,"$1,600,000","Mar 14, 2023",Entre,Entre is a networking firm that provides a community-oriented alternative to traditional professional networking apps.,"Association, Communities, Education, Information Technology, Social Media, Software",Hispanic / Latine Led,"Pittsburgh, Pennsylvania, United States, North America",joinentre.com,,"$1,951,000",Seed,5,DeSo Foundation,6
Seed Round - Brassica Finance,Seed,Seed,"$8,000,000","Apr 11, 2023",Brassica Finance,Brassica Finance develops an investment infrastructure for private securities and digital assets.,"Developer APIs, Finance, Financial Services, IT Infrastructure",—,"Houston, Texas, United States, North America",www.brassicafin.com/,,"$16,000,000",Seed,2,Mercury,9
Seed Round - Shennon Biotechnologies,Seed,Seed,"$13,000,000","Mar 13, 2023",Shennon Biotechnologies,ShennonBio analyzes and manipulates a massive number of cells on the single cell level to develop better treatments for human diseases.,"Biotechnology, Life Science, Medical",—,"San Francisco, California, United States, North America",www.shennonbio.com/,,"$13,000,000",Seed,1,DCVC,3
Seed Round - Thymmune Therapeutics,Seed,Seed,"$7,000,000","Mar 1, 2023",Thymmune Therapeutics,Thymmune Therapeutics is a biotechnology company developing a machine learning-driven thymic cell engineering platform.,"Biotechnology, Therapeutics",—,"Cambridge, Massachusetts, United States, North America",www.thymmune.com/,,"$7,000,000",Seed,1,Pillar VC,9
Seed Round - 8 Myles,Seed,Seed,"$1,050,000","Apr 8, 2023",8 Myles,8 Myles is a comfort food brand that sells frozen macaroni and cheese.,"Food and Beverage, Organic Food, Wholesale",Black / African American Founded,"Mclean, Virginia, United States, North America",8myles.com,,"$1,070,000",Seed,2,—,7
Seed Round - Playbux,Seed,Seed,"$2,000,000","Apr 21, 2023",Playbux,Playbux is an e-commerce metaverse platform that sets up the shop and earns system.,"E-Commerce, Gaming, Operating Systems",—,"California City, California, United States, North America",www.playbux.co/,,"$2,000,000",Seed,1,Binance Labs,9
Seed Round - Yoz Labs,Seed,Seed,"$3,500,000","Apr 19, 2023",Yoz Labs,Yoz Labs is a simplifying web3 notifications.,"Blockchain, Embedded Software",—,"San Francisco, California, United States, North America",www.yoz.cloud/,,"$3,500,000",Seed,1,Electric Capital,8
Seed Round - Gyroscope,Seed,Seed,"$4,500,000","Mar 9, 2023",Gyroscope,Gyroscope develops an asset-backed stablecoin built on resilient DeFi infrastructure.,"Finance, Financial Services, FinTech",—,"Williamsville, Virginia, United States, North America",gyro.finance/,,"$4,500,000",Seed,1,Placeholder,9
