Seed Round - Riscosity,Seed,Seed,"$7,000,000","Apr 25, 2023",Riscosity,Riscosity is a supply chain data management platform.,"Analytics, Information Technology, Supply Chain Management",—,"Austin, Texas, United States, North America",www.riscosity.com,,"$7,000,000",Seed,1,S3 Ventures,3
Seed Round - Fivvy,Seed,Seed,"$4,000,000","Apr 12, 2023",Fivvy,Saas Platform that Boosts Banks' Competitiveness and Revenues through Revenue Generating Insights & Models,"Financial Services, FinTech","Black / African American Founded, Black / African American Led, Hispanic / Latine Founded, Women Founded","Miami, Florida, United States, North America",fivvyforbusiness.com,,"$5,500,000",Seed,3,Globant Ventures,1
Seed Round - Crux,Seed,Seed,"$4,600,000","Apr 13, 2023",Crux,"Crux is the ecosystem used by financial institutions, developers, and purchasers of tax credits to manage transferable tax credits.","Finance, Internet, Personal Finance",—,"Dover, Delaware, United States, North America",www.cruxclimate.com,,"$8,850,000",Seed,2,Lowercarbon Capital,4
Pre Seed Round - HR Signal,Pre-Seed,Seed,"$1,600,000","Mar 2, 2023",HR Signal,"SaaS, HR Tech, Machine Learning, Workforce Insights","Analytics, Human Resources, Machine Learning, SaaS, Software",—,"Cleveland, Ohio, United States, North America",www.hrsignal.com,,"$1,600,000",Seed,1,"Gammite ventures, Tzur Daboosh",3
Pre Seed Round - Third Way Health,Pre-Seed,Seed,"$1,550,000","Apr 19, 2023",Third Way Health,Third Way Health is an executed solution that lessens the administrative burden for medical practices.,"Health Care, Hospital",—,"Los Angeles, California, United States, North America",thirdway.health,,"$1,550,000",Seed,1,ApolloMed,1
Pre Seed Round - insrt finance,Pre-Seed,Seed,"$2,200,000","Mar 3, 2023",insrt finance,Insrt Finance offers direct access to bluechip NFTs.,"Blockchain, Cryptocurrency, Virtual Currency",—,"Washington, District of Columbia, United States, North America",www.insrt.finance/,,"$2,200,000",Seed,1,"HashKey Capital, Infinite Capital",6
Seed Round - Myxt,Seed,Seed,"$2,000,000","Apr 13, 2023",Myxt,Myxt is a computer software company.,—,—,"San Francisco, California, United States, North America",myxt.com/,,"$4,000,000",Seed,2,—,2
Seed Round - Gosleep,Seed,Seed,"$2,000,000","Mar 1, 2023",Gosleep,Gosleep is a Web3 sleep application platform .,"Blockchain, Cryptocurrency, Virtual Currency",—,"Washington, District of Columbia, United States, North America",gogogosleep.com/index,,"$2,000,000",Seed,1,Foresight Ventures,6
"Seed Round - Oka, The Carbon Insurance Company",Seed,Seed,"$7,000,000","Feb 23, 2023","Oka, The Carbon Insurance Company","Oka, The Carbon Insurance Company's objective is to establish a more secure and open market for carbon credits.","Business Development, Credit, Insurance",—,"Park City, Utah, United States, North America",carboninsurance.co,,"$7,000,000",Seed,1,Aquiline Technology Growth,2
Seed Round - Charm Solutions,Seed,Seed,"$3,500,000","Apr 18, 2023",Charm Solutions,Charm Solutions revolutionise the loan process by harnessing data's potential.,"Database, Financial Services",—,"Menlo Park, California, United States, North America",www.charmsolutions.ai,,"$3,500,000",Seed,1,BootstrapLabs,1
Seed Round - Filmustage,Seed,Seed,"$550,000","Mar 20, 2023",Filmustage,Automatic movie script breakdown and scheduling service,"Artificial Intelligence, Content Creators, Film, Film Distribution, Film Production, Media and Entertainment, SaaS, Software, Video",—,"Santa Monica, California, United States, North America",filmustage.com/,,"$550,000",Seed,2,Flyer One Ventures,4
Seed Round - Earthly Technologies,Seed,Seed,"$6,500,000","Feb 23, 2023",Earthly Technologies,Earthly Technologies is a developer tools company that provides automation system for the post-container era.,"Cloud Infrastructure, Developer Tools, Software",—,"San Francisco, California, United States, North America",earthly.dev,,"$8,550,000",Seed,3,Innovation Endeavors,4
Seed Round - Wilderness Labs,Seed,Seed,"$3,300,000","Mar 16, 2023",Wilderness Labs,Professional connected things (IoT) development platform,"Developer Platform, Hardware, Internet of Things, Operating Systems, SaaS",—,"San Francisco, California, United States, North America",www.wildernesslabs.co,,"$3,650,000",Seed,4,Apertu Capital,3
Pre Seed Round - El Camino Travel,Pre-Seed,Seed,"$1,100,000","Feb 24, 2023",El Camino Travel,El Camino Travel is a travel platform.,—,—,"Washington, District of Columbia, United States, North America",www.elcamino.travel,,"$1,100,000",Seed,1,Slauson & Co.,5
Pre Seed Round - Tara Mind,Pre-Seed,Seed,"$3,000,000","Apr 13, 2023",Tara Mind,Tara Mind provides safe and equitable access to psychedelic-assisted therapy in order to prevent mental health crises.,"Personal Health, Wellness",—,"San Diego, California, United States, North America",taramind.com,,"$3,000,000",Seed,1,Red Cell Partners,1
Seed Round - DEN,Seed,Seed,"$3,000,000","Feb 21, 2023",DEN,DEN produces architectural building plans and products designed to build homes set in nature.,"Architecture, Building Material, Outdoors",—,"Rhinecliff, New York, United States, North America",denoutdoors.com/,,"$3,000,000",Seed,1,"Crossbeam Venture Partners, Gutter Capital",2
Seed Round - LifeWeb 360,Seed,Seed,"$120,000","Mar 13, 2023",LifeWeb 360,LifeWeb 360 is a chicago-based company dedicated on preserving memories.,"Consumer Software, Funerals, Social Media, Wellness",Black / African American Founded,"Chicago, Illinois, United States, North America",www.lifeweb360.com,,"$140,000",Seed,3,—,1
Pre Seed Round - Portrait Analytics,Pre-Seed,Seed,"$3,000,000","Apr 6, 2023",Portrait Analytics,Portrait Analytics creates a generative AI research assistant that helps analysts accelerate and deepen investment research.,"Analytics, Artificial Intelligence, Financial Services, Market Research",—,"Boston, Massachusetts, United States, North America",portrait-analytics.com,,"$10,000,000",Seed,2,.406 Ventures,1
Seed Round - Deeptune,Seed,Seed,"$3,141,593","Mar 1, 2023",Deeptune,Helping creators go global,Software,—,"New York, New York, United States, North America",deeptune.ai,,"$3,141,593",Seed,1,Seven Seven Six,6
Seed Round - Nanite,Seed,Seed,"$2,000,000","Mar 15, 2023",Nanite,Nanite is a non-viral gene delivery company of the next generation.,—,—,"Boston, Massachusetts, United States, North America",www.nanitebio.com,,"$8,000,000",Seed,2,Cystic Fibrosis Foundation,1
Seed Round - Linum,Seed,Seed,"$500,000","Apr 5, 2023",Linum,Linum is a creative platform which allows everyone to make animated videos.,"Animation, Software, Video",—,"San Francisco, California, United States, North America",www.linum.ai/,,"$500,000",Seed,1,Y Combinator,3
Seed Round - Franklin,Seed,Seed,"$2,900,000","Apr 5, 2023",Franklin,"Franklin provides a tool for firms to make payments to employees and contractors in cash and crypto, across the world, including the U.S.",Payments,—,"New York, New York, United States, North America",www.hellofranklin.co/,,"$2,900,000",Seed,1,gumi Cryptos Capital (gCC),5
Seed Round - SureImpact,Seed,Seed,"$2,000,000","Apr 6, 2023",SureImpact,SureImpact connects the social ecosystem with a user-friendly case management platform.,"Cloud Computing, Internet, Social",—,"Powell, Ohio, United States, North America",www.sureimpact.com/,,"$3,739,024",Seed,4,Rev1 Ventures,2
Seed Round - Kai XR,Seed,Seed,"$1,600,000","Mar 1, 2023",Kai XR,"Kai XR develops inclusive mixed reality spaces allowing children to explore, dream, and create.","Augmented Reality, E-Learning, Education, Virtual Reality","Black / African American Founded, Black / African American Led, Women Founded, Women Led","Oakland, California, United States, North America",kaixr.com/,,"$2,400,000",Seed,4,Kapor Capital,3
Seed Round - Codesphere,Seed,Seed,"$2,500,000","Mar 29, 2023",Codesphere,Codesphere is your Zeroconfig Cloud. No config - just code and run web apps from your browser.,"Developer Tools, Productivity Tools, SaaS, Software, Software Engineering, Web Apps, Web Development",—,"Redwood City, California, United States, North America",codesphere.com,,"$8,100,000",Seed,3,Begin Capital,4
Pre Seed Round - OmniVis,Pre-Seed,Seed,"$100,000","Apr 24, 2023",OmniVis,Put the power of the lab in the palm of your hand,"AgTech, Biotechnology, Food and Beverage, Food Processing, Health Care, Humanitarian, Information Technology","Women Founded, Women Led","South San Francisco, California, United States, North America",www.omnivistech.com/,,"$3,472,351",Seed,20,HudsonAlpha AgTech,1
Seed Round - DexMat,Seed,Seed,"$3,000,000","Mar 8, 2023",DexMat,DexMat is a manufacturer of carbon nanotube fibers and films.,Manufacturing,—,"Houston, Texas, United States, North America",dexmat.com/,,"$7,672,051",Seed,14,Shell Ventures,3
Seed Round - Redemption Games,Seed,Seed,"$7,000,000","Mar 7, 2023",Redemption Games,Redemption Games is a mobile gaming company that develops casual games.,"PC Games, Video Games",—,"Carlsbad, California, United States, North America",www.redemptiongames.com/,,"$12,000,000",Seed,4,Play Ventures,4
Seed Round - Skilltype,Seed,Seed,"$1,750,000","Mar 7, 2023",Skilltype,B2B SaaS for skills management,"Higher Education, Human Resources, SaaS, Skill Assessment, Software, Training, Universities",—,"New Orleans, Louisiana, United States, North America",www.skilltype.com,,"$2,850,000",Seed,3,The Pearl Fund,5
Seed Round - pgEdge,Seed,Seed,"$9,000,000","Mar 7, 2023",pgEdge,pgEdge offers distributed PostgreSQL that is optimised for the network edge in order to reduce data latency.,"Information Technology, Software",—,"Alexandria, Virginia, United States, North America",www.pgedge.com,,"$9,000,000",Seed,1,"Grotech Ventures, Sands Capital Ventures",2
Pre Seed Round - Yoodlize,Pre-Seed,Seed,"$800,000","Mar 15, 2023",Yoodlize,Yoodlize is the rental platform for stuff.,Internet,—,"Provo, Utah, United States, North America",www.yoodlize.com/,,"$800,000",Seed,1,Alpine 100,1
"Seed Round - Field Materials, Inc.",Seed,Seed,"$4,650,000","Apr 6, 2023","Field Materials, Inc.",Field Materials digitizes material procurement for construction contractors and vendors through its AI-powered mobile and web apps.,—,—,"San Jose, California, United States, North America",fieldmaterials.com,,"$4,650,000",—,2,—,4
Pre Seed Round - Ceretype Neuromedicine,Pre-Seed,Seed,"$100,000","Feb 28, 2023",Ceretype Neuromedicine,Ceretype Neuromedicine is an AI-based fMRI brain biomarker technology to improve drug discovery and patient care.,"Biotechnology, Health Care, Life Science, Machine Learning, Medical","Women Founded, Women Led","Cambridge, Massachusetts, United States, North America",ceretype.com/,,"$100,000",Seed,2,One Mind Accelerator,2
Seed Round - LUDEX,Seed,Seed,"$8,000,000","Mar 29, 2023",LUDEX,LUDEX is a sports and trading card scanning application that digitizes trading-card collections.,"Financial Services, FinTech, Information Technology, Sports, Trading Platform",—,"Chicago, Illinois, United States, North America",www.ludex.com/,,"$9,100,000",Seed,2,"Brian Urlacher, Cassius Marsh Sr.",2
Seed Round - Inbanx,Seed,Seed,"$3,554,999","Apr 21, 2023",Inbanx,inbanx is a unified solution for budget + spending control.,"Banking, Financial Services, FinTech, Payments",—,"Austin, Texas, United States, North America",inbanx.com,,"$3,554,999",Seed,2,"Launchpad Capital, Social Leverage",2
Seed Round - StructShare,Seed,Seed,"$8,000,000","Mar 21, 2023",StructShare,"StructShare develops an app for managing daily material orders, quotes, and invoices.","Construction, E-Commerce, Information Technology, Procurement, Productivity Tools, SaaS",—,"New York, New York, United States, North America",StructShare.com,,"$8,000,000",Seed,2,Kompas,4
Seed Round - Hathora,Seed,Seed,"$7,600,000","Mar 27, 2023",Hathora,Serverless cloud hosting for multiplayer games,"Cloud Infrastructure, Gaming, Online Games, Software, Video Games",—,"New York, New York, United States, North America",hathora.dev/,,"$7,600,000",Seed,1,"Founders Fund, Upfront Ventures",5
Seed Round - JackBe,Seed,Seed,"$11,500,000","Mar 29, 2023",JackBe,"An on-demand, pick-up-only grocery service reimagining how individuals experience grocery shopping.","Grocery, Mobile Apps",—,"Edmond, Oklahoma, United States, North America",jackbegrocery.com/,,"$11,500,000",Seed,1,—,3
Pre Seed Round - BabylonAI,Pre-Seed,Seed,"$800,000","Apr 5, 2023",BabylonAI,BabylonAI develops analytics solutions for medium-sized computer vision teams.,"Analytics, Artificial Intelligence, Computer Vision",—,"Dover, Delaware, United States, North America",www.babylonai.dev/,,"$800,000",Seed,1,Y Combinator,4
Seed Round - turntable.fm,Seed,Seed,"$7,000,000","Mar 28, 2023",turntable.fm,Turntable.fm brings the social value of music to the digital music experience by letting people experience and discover music together.,"Music, Social Media",—,"New York, New York, United States, North America",turntable.fm,,"$21,500,000",Seed,3,—,5
Seed Round - Narwhal Finance,Seed,Seed,"$1,000,000","Mar 24, 2023",Narwhal Finance,Narwhal Finance operates as a decentralized cross-market perpetual trading platform.,"Financial Services, Trading Platform",—,"Pasadena, Texas, United States, North America",narwhal.finance/,,"$1,000,000",Seed,1,Animoca Ventures,2
Pre Seed Round - Argo Space,Pre-Seed,Seed,"$2,000,000","Apr 13, 2023",Argo Space,Making in-space transportation abundant,"Aerospace, Space Travel",—,"Hermosa Beach, California, United States, North America",argospace.com,,"$2,000,000",Seed,1,Type One Ventures,4
Seed Round - Dori,Seed,Seed,"$2,000,000","Apr 26, 2023",Dori,"Stealth mode, venture backed startup.","Legal Tech, Software, Venture Capital",—,"Atlanta, Georgia, United States, North America",dori.vc/,,"$2,000,000",Seed,1,—,3
Seed Round - Spade,Seed,Seed,"$5,000,000","Feb 27, 2023",Spade,Enriched transaction data you can build on.,"Artificial Intelligence, Developer APIs, FinTech, Machine Learning",—,"New York, New York, United States, North America",www.spade.com,,"$6,125,000",Seed,2,Andreessen Horowitz,4
"Pre Seed Round - Speechlab, Inc.",Pre-Seed,Seed,"$1,550,000","Mar 1, 2023","Speechlab, Inc.",Speechlab is making the world accessible to people who speak different languages using generative AI for speech-to-speech translation.,"Artificial Intelligence, Digital Media, Information Technology, Natural Language Processing, Software, Speech Recognition, Translation Service",—,"San Francisco, California, United States, North America",www.speechlab.ai/,,"$1,550,000",Seed,1,AI Fund,5
Seed Round - CurbWaste,Seed,Seed,"$4,000,000","Apr 24, 2023",CurbWaste,CurbWaste revolutionizes the waste management ecosystem through its cloud-based and data-driven cleantech platform.,"CleanTech, Enterprise Software, SaaS, Software, Waste Management",—,"New York, New York, United States, North America",curbwaste.com,,"$11,150,000",Seed,4,TTV Capital,3
Pre Seed Round - EzDubs,Pre-Seed,Seed,"$500,000","Apr 5, 2023",EzDubs,EzDubs is a platform that provides real-time AI dubbing for content creators.,"Artificial Intelligence, Audio, Machine Learning, Real Time",—,"San Francisco, California, United States, North America",www.ezdubs.ai,,"$500,000",Seed,1,Y Combinator,2
Seed Round - Octet Scientific,Seed,Seed,"$1,000,000","Apr 25, 2023",Octet Scientific,Octet Scientific addresses an unmet need for support chemistry in the Zinc Battery industry.,—,—,"Ohio, Illinois, United States, North America",www.octetsci.com/,,"$2,650,000",Seed,5,Advanced Manufacturing Fund,3
Pre Seed Round - Felix&Fido,Pre-Seed,Seed,"$4,000,000","Mar 23, 2023",Felix&Fido,Felix&Fido combines technology with operational excellence in a human-centered workplace.,"Health Care, Pet, Veterinary",—,"Seattle, Washington, United States, North America",www.felixandfido.com,,"$4,000,000",Seed,1,PSL Ventures,2
Pre Seed Round - Entrée,Pre-Seed,Seed,"$2,500,000","Mar 15, 2023",Entrée,Entrée is meal delivery service offering restaurant-quality meals.,"Apps, Food and Beverage, Restaurants",—,"Chicago, Illinois, United States, North America",www.joinentree.com/,,"$2,500,000",Seed,1,M25,4
Seed Round - Finni Health,Seed,Seed,"$3,340,000","Apr 5, 2023",Finni Health,Finni Health offers behavioral health care services for children.,"Child Care, Children, Health Care",—,"San Francisco, California, United States, North America",www.finnihealth.com/,,"$4,140,000",Seed,2,General Catalyst,2
Seed Round - Standby Deposits,Seed,Seed,"$5,300,000","Apr 19, 2023",Standby Deposits,Standby Deposits is a developer of a renting deposit alternative platform for renters.,"B2C, Information Technology, Payments, Rental",—,"New York, New York, United States, North America",www.standby.io/,,"$5,300,000",Seed,1,"Brunnur Ventures, Stodir hf.",2
Seed Round - PEEL Therapeutics,Seed,Seed,"$9,000,000","Feb 23, 2023",PEEL Therapeutics,Peel Therapeutics is a biotech company that develops medicines for cancer and inflammatory diseases.,Biotechnology,—,"Salt Lake City, Utah, United States, North America",www.peeltx.com/,,"$25,052,465",Seed,5,—,2
Seed Round - N1 Life,Seed,Seed,"$10,000,000","Apr 17, 2023",N1 Life,A biotech comany advancing tissue-selective drug delivery platform technologies to revolutionize drug development.,"Biotechnology, Life Science, Medical",—,"Milpitas, California, United States, North America",www.n1life.co/,,"$10,000,000",Seed,1,Legend Capital,3
Seed Round - Allermi,Seed,Seed,"$3,500,000","Mar 16, 2023",Allermi,"Allermi offers direct delivery of customized prescription allergy medications, designed and formulated by world-class allergists.","Health Care, Wellness","Women Founded, Women Led","San Francisco, California, United States, North America",www.allermi.com,,"$4,750,000",Seed,2,Nelstone Ventures,1
Seed Round - Den,Seed,Seed,"$2,800,000","Feb 22, 2023",Den,Den develops an online platform to get multi-signature transactions signed fast.,"Cryptocurrency, FinTech, Transaction Processing",—,"New York, New York, United States, North America",www.onchainden.com/,,"$2,800,000",Seed,1,IDEO CoLab Ventures,4
Seed Round - 119,Seed,Seed,"$50,000","Apr 27, 2023",119,119 a communication tool designed to guide bystanders through the appropriate response in emergency situations.,Communication Hardware,—,"Ohio, Illinois, United States, North America",119-website.netlify.app,,"$50,000",Seed,1,—,1
Pre Seed Round - Empallo,Pre-Seed,Seed,"$50,000","Apr 27, 2023",Empallo,Empallo is developing machine learning algorithms that will eventually result in more personalized treatment strategies.,"Information Services, Information Technology",—,"Boston, Massachusetts, United States, North America",empallo.com,,"$50,000",Seed,1,—,1
Seed Round - Radiolife,Seed,Seed,"$50,000","Apr 27, 2023",Radiolife,Disruptive diagnostic technology based on RF signature & AI modeling,"Artificial Intelligence, Biotechnology, Health Care, Life Science, Medical Device",—,"Wilmington, Delaware, United States, North America",www.radiolifelabs.com,,"$50,000",Seed,2,Roux Institute at Northeastern University - Entrepreneurship,1
Seed Round - Althea Health,Seed,Seed,"$50,000","Apr 27, 2023",Althea Health,Althea Health's mission is to change the way healthcare providers communicate with patients and guide them through their treatment journey.,"Health Care, Hospital",—,"San Jose, California, United States, North America",www.altheahealth.io,,"$50,000",Seed,1,Roux Institute at Northeastern University - Entrepreneurship,1
Seed Round - Payabli,Seed,Seed,"$8,000,000","Mar 15, 2023",Payabli,Payment Infrastructure and Monetization Platform,"FinTech, Payments, Software",—,"Miami, Florida, United States, North America",www.payabli.com/,,"$12,050,000",Seed,2,TTV Capital,3
Seed Round - Mother of Fact (DBA NurtureTalk Inc.),Seed,Seed,"$50,000","Apr 27, 2023",Mother of Fact (DBA NurtureTalk Inc.),For women’s health clinics we offer a digital health platform that connects patients with critical access to registered dietitians.,"Health Care, Home Health Care, Outpatient Care","Women Founded, Women Led","Sunapee, New Hampshire, United States, North America",motheroffact.com/,,"$50,000",Seed,3,Roux Institute at Northeastern University - Entrepreneurship,1
Seed Round - Iron Health,Seed,Seed,"$4,500,000","Mar 10, 2023",Iron Health,"Iron Health is a virtual platform that provides services including virtual visits, direct messaging, and others.","Health Care, Hospital, Medical, Women's",—,"New York, New York, United States, North America",www.ironhealth.io/,,"$4,500,000",Seed,1,March of Dimes,1
Pre Seed Round - THEYA,Pre-Seed,Seed,"$500,000","Apr 5, 2023",THEYA,THEYA is a Bitcoin self-custody app for users who find crypto exchanges risky and hardware wallets overwhelming.,"Cryptocurrency, FinTech, Mobile Apps",—,"San Francisco, California, United States, North America",www.theya.us,,"$500,000",Seed,2,Y Combinator,2
Pre Seed Round - Rubbrband,Pre-Seed,Seed,"$500,000","Apr 5, 2023",Rubbrband,Rubbrband provides automated evaluation for AI generated images.,"Artificial Intelligence, Developer Tools, Machine Learning, Software",—,"San Francisco, California, United States, North America",rubbrband.com,,"$500,000",Seed,1,Y Combinator,3
Pre Seed Round - Texel.ai,Pre-Seed,Seed,"$500,000","Apr 5, 2023",Texel.ai,Texel.ai provides tools and APIs that allow you to encode or decode video and optimize AI models.,"Artificial Intelligence, Information Technology, Software",—,"Austin, Texas, United States, North America",www.texel.ai/,,"$500,000",Seed,2,Y Combinator,3
Seed Round - Parker,Seed,Seed,"$5,900,000","Mar 16, 2023",Parker,Parker offers corporate credit cards to help e-commerce businesses pay expenses and manage their finances.,"Banking, E-Commerce, Finance, Financial Services, FinTech",—,"New York, New York, United States, North America",getparker.com,,"$157,000,000",Early Stage Venture,4,—,1
Pre Seed Round - ASTERIZM,Pre-Seed,Seed,"$425,000","Mar 30, 2023",ASTERIZM,Asterizm is a blockchain interoperability solution for enterprises and web3 protocols to power cross-chain future,"B2B, Blockchain, FinTech",—,"New York, New York, United States, North America",asterizm.io/,,"$425,000",Seed,1,Techstars,2
Seed Round - Alteon.io,Seed,Seed,"$4,500,000","Apr 6, 2023",Alteon.io,"We're making creative collaboration seamless, simple and simultaneous.","Blockchain, Cloud Storage, Film Production, Media and Entertainment, SaaS, Software, TV Production",—,"New York, New York, United States, North America",alteon.io/,,"$4,500,000",Seed,1,Florida Innovation Capital,1
Pre Seed Round - EmTech Care Labs,Pre-Seed,Seed,"$50,000","Apr 27, 2023",EmTech Care Labs,Care-Wallet: Digital care management platform for family caregivers of older adults with dementia,"Consumer Software, Elder Care, Health Care, Personal Finance, Software","South Asian Founded, Women Founded","Portland, Maine, United States, North America",emtechcarelabs.com,,"$50,000",Seed,1,Roux Institute at Northeastern University - Entrepreneurship,1
Seed Round - Operant,Seed,Seed,"$3,000,000","Apr 26, 2023",Operant,Operant provides security at cloud native scale.,"Cloud Data Services, Cloud Security, Cyber Security, Network Security, Software",—,"San Francisco, California, United States, North America",operant.ai,,"$3,000,000",Seed,2,Felicis,3
Pre Seed Round - Asoba,Pre-Seed,Seed,"$100,000","Apr 19, 2023",Asoba,Asoba provide control of power generation and management back to the companies and individuals that are constructing Africa's future.,"Energy, Solar",—,"San Rafael, California, United States, North America",www.asoba.co,,"$100,000",Seed,1,gener8tor,1
Pre Seed Round - Baleena,Pre-Seed,Seed,"$100,000","Apr 19, 2023",Baleena,Baleena is a clean tech venture tackling microplastic fiber pollution in laundry,"CleanTech, Green Consumer Goods, Hardware, Sustainability",—,"Philadelphia, Pennsylvania, United States, North America",www.baleena.net/,,"$450,000",Seed,3,gener8tor,1
Pre Seed Round - SilisiumTech,Pre-Seed,Seed,"$100,000","Apr 19, 2023",SilisiumTech,SilisiumTech rebuilding the US solar supply chain by manufacturing silicon wafers.,"Manufacturing, Solar, Supply Chain Management",—,"Pittsburgh, Pennsylvania, United States, North America",www.silisiumtech.com,,"$100,000",Seed,1,gener8tor,1
Pre Seed Round - Skillprint,Pre-Seed,Seed,"$3,500,000","Mar 31, 2023",Skillprint,"Skillprint wants you to be the best version of yourself, and have fun doing it.","Apps, Education, Gaming, Mobile Apps",—,"Oakland, California, United States, North America",www.skillprint.co,,"$3,500,000",Seed,1,—,3
Seed Round - Adpipe,Seed,Seed,"$3,000,000","Mar 1, 2023",Adpipe,"Adpipe is a motion-first marketing platform that personalizes, humanizes, and localizes existing customers' brands.","Marketing, Online Forums, Software, Video Advertising, Video Editing",—,"Athens, Georgia, United States, North America",adpipe.com/,,"$3,000,000",Seed,1,"Atlanta Ventures, Tom Noonan",2
Pre Seed Round - Type,Pre-Seed,Seed,"$500,000","Apr 5, 2023",Type,Type is an AI-powered document editor that helps people to write remarkably fast.,"Artificial Intelligence, Document Management, Information Technology",—,"New York, New York, United States, North America",type.ai,,"$500,000",Seed,1,Y Combinator,2
Seed Round - Benefitbay,Seed,Seed,"$2,500,000","Mar 9, 2023",Benefitbay,"Benefitbay is the first-of its-kind, end-to-end solution that enables employers to offer personalized benefits for the modern workforce.","Compliance, Employee Benefits, Health Insurance, Insurance, Small and Medium Businesses, Software",—,"Omaha, Nebraska, United States, North America",www.benefitbay.com,,"$6,300,000",Seed,3,—,2
