Pre Seed Round - Constant,Pre-Seed,Seed,"$500,000","Apr 5, 2023",Constant,Constant is a private credit investment platform.,"Credit, Financial Services, FinTech",—,"New York, New York, United States, North America",www.useconstant.com/,,"$500,000",Seed,1,Y Combinator,1
Pre Seed Round - Truewind,Pre-Seed,Seed,"$500,000","Apr 5, 2023",Truewind,Truewind is an IT company that provides AI-powered bookkeeping and finance software.,"Artificial Intelligence, FinTech, Information Technology, Machine Learning, Software",—,"San Francisco, California, United States, North America",www.truewind.ai,,"$500,000",Seed,1,Y Combinator,1
Pre Seed Round - Thread,Pre-Seed,Seed,"$500,000","Apr 5, 2023",Thread,Thread develops incident management tools for enterprises.,"B2B, Information Technology, Software",—,"San Francisco, California, United States, North America",www.usethread.io,,"$500,000",Seed,1,Y Combinator,1
Pre Seed Round - Fabius,Pre-Seed,Seed,"$500,000","Apr 5, 2023",Fabius,Fabius analyzes customer calls with AI to help sales leaders improve their reps' performance.,"B2B, Sales, Software",—,"San Francisco, California, United States, North America",www.fabius.io/,,"$500,000",Seed,1,Y Combinator,1
Pre Seed Round - Fluid Markets,Pre-Seed,Seed,"$500,000","Apr 5, 2023",Fluid Markets,Fluid Markets is a financial services company that enables investment in company earnings.,"Financial Services, FinTech",—,"New York, New York, United States, North America",www.fluidinvesting.com,,"$500,000",Seed,1,Y Combinator,1
Pre Seed Round - Extend,Pre-Seed,Seed,"$500,000","Apr 5, 2023",Extend,"Extend builds tool that reduces context switching, eliminates copy/pasting, and customizes any website team relies on.",Software,—,"San Francisco, California, United States, North America",www.extend.app,,"$500,000",Seed,1,Y Combinator,1
Pre Seed Round - Coldreach,Pre-Seed,Seed,"$500,000","Apr 5, 2023",Coldreach,Coldreach is a digital platform that generates hyper-personalized sales emails.,Email,—,"San Francisco, California, United States, North America",coldreach.ai,,"$500,000",Seed,1,Y Combinator,1
Pre Seed Round - Wild Moose,Pre-Seed,Seed,"$500,000","Apr 5, 2023",Wild Moose,Wild Moose provides conversational AI to help on-call developers tame production.,"Information Technology, Software, Web Development",—,"San Francisco, California, United States, North America",www.wildmoose.ai,,"$500,000",Seed,1,Y Combinator,1
Pre Seed Round - Vocode,Pre-Seed,Seed,"$500,000","Apr 5, 2023",Vocode,Vocode is an open-source library for building voice-based LLM applications.,"Developer Tools, Information Technology, Open Source, Speech Recognition",—,"San Francisco, California, United States, North America",docs.vocode.dev/,,"$500,000",Seed,1,Y Combinator,1
Pre Seed Round - Radical,Pre-Seed,Seed,"$500,000","Apr 5, 2023",Radical,Radical builds high-altitude solar aircraft to provide direct-to-handset LTE or 5G internet.,"Aerospace, Internet, Telecommunications",—,"Seattle, Washington, United States, North America",www.radicalaero.com,,"$500,000",Seed,1,Y Combinator,1
Pre Seed Round - Intrinsic,Pre-Seed,Seed,"$500,000","Apr 5, 2023",Intrinsic,Intrinsic is a software company that provides safety tools and API.,"Developer APIs, Information Technology, Software",—,"San Francisco, California, United States, North America",www.withintrinsic.com,,"$500,000",Seed,1,Y Combinator,1
Pre Seed Round - PoplarML,Pre-Seed,Seed,"$500,000","Apr 5, 2023",PoplarML,"PoplarML enables the deployment of production-ready, scalable ML systems.","Artificial Intelligence, Developer APIs, Machine Learning",—,"San Francisco, California, United States, North America",poplarml.com,,"$500,000",Seed,1,Y Combinator,1
Pre Seed Round - Index,Pre-Seed,Seed,"$500,000","Apr 5, 2023",Index,Index is a collaborative planning tool for software companies,"Productivity Tools, Software",—,"San Francisco, California, United States, North America",www.index.inc,,"$500,000",Seed,1,Y Combinator,1
Pre Seed Round - Defog,Pre-Seed,Seed,"$500,000","Apr 5, 2023",Defog,Defog is a natural language data query platform that allows users to ask free-form data questions through large language models.,"Artificial Intelligence, Developer Tools, Information Technology, Machine Learning",—,"San Francisco, California, United States, North America",defog.ai,,"$500,000",Seed,1,Y Combinator,1
Pre Seed Round - Layup,Pre-Seed,Seed,"$500,000","Apr 5, 2023",Layup,"LayUp securely integrates with your company's applications, providing seamless configuration with your knowledge base.",Software,—,"Mountain View, California, United States, North America",www.layupai.com,,"$500,000",Seed,1,Y Combinator,1
Pre Seed Round - Unstatiq,Pre-Seed,Seed,"$500,000","Apr 5, 2023",Unstatiq,Unstatiq provides a data integration and transformation platform using artificial intelligence.,"Artificial Intelligence, Data Integration, Information Technology",—,"San Francisco, California, United States, North America",www.unstatiq.com/,,"$500,000",Seed,1,Y Combinator,1
Pre Seed Round - Gloo,Pre-Seed,Seed,"$500,000","Apr 5, 2023",Gloo,Gloo is a data search engine that automatically computes multiple embeddings for a single document.,Information Technology,—,"Seattle, Washington, United States, North America",www.trygloo.com,,"$500,000",Seed,1,Y Combinator,1
Pre Seed Round - Gluetrail,Pre-Seed,Seed,"$500,000","Apr 5, 2023",Gluetrail,Gluetrail is a revenue intelligence platform that provides revenue planning for B2B companies.,"Analytics, B2B, Information Technology, Predictive Analytics",—,"San Francisco, California, United States, North America",www.gluetrail.com,,"$500,000",Seed,1,Y Combinator,1
Pre Seed Round - Outerbase,Pre-Seed,Seed,"$500,000","Apr 5, 2023",Outerbase,"Outerbase is an interface to view, edit, and modify data and generate visual dashboards without having to write a single line of SQL.","Data Visualization, Database, Software",—,"San Francisco, California, United States, North America",www.outerbase.com,,"$500,000",Seed,2,Y Combinator,1
Pre Seed Round - Frigade,Pre-Seed,Seed,"$500,000","Apr 5, 2023",Frigade,Frigade is a developer tool that makes it easy for developers to build better product onboarding and education.,"Developer Tools, Software",—,"San Francisco, California, United States, North America",frigade.com,,"$3,500,000",Seed,2,Y Combinator,1
Pre Seed Round - Drift Bio,Pre-Seed,Seed,"$500,000","Apr 5, 2023",Drift Bio,Drift Bio develops software to help life sciences companies analyze their data.,"Bioinformatics, Information Technology, Life Science, Software",—,"San Francisco, California, United States, North America",driftbio.com/,,"$500,000",Seed,2,Y Combinator,1
Pre Seed Round - Mirrorful,Pre-Seed,Seed,"$500,000","Apr 5, 2023",Mirrorful,Mirrorful is a web-based software development platform that allows you to create and share any website in any setting.,"Developer Tools, Software",—,"San Francisco, California, United States, North America",mirrorful.io,,"$500,000",Seed,1,Y Combinator,1
Pre Seed Round - Avoca,Pre-Seed,Seed,"$500,000","Apr 5, 2023",Avoca,Avoca creates a client communication platform that enables business owners to concentrate on their core skills.,Software,—,"San Francisco, California, United States, North America",www.avoca.ai,,"$500,000",Seed,2,Y Combinator,1
Pre Seed Round - Zenfetch,Pre-Seed,Seed,"$500,000","Apr 5, 2023",Zenfetch,Zenfetch is a call assistant tool that enables real-time call intelligence for sales teams.,"Artificial Intelligence, Productivity Tools, Sales, Telecommunications",—,"San Francisco, California, United States, North America",www.zenfetch.com,,"$500,000",Seed,1,Y Combinator,1
Pre Seed Round - Fastgen,Pre-Seed,Seed,"$500,000","Apr 5, 2023",Fastgen,Fastgen is a low-code API and workflow builder with a drag-and-drop interface to create backends and automations.,"Developer APIs, Developer Tools, Information Technology",—,"New York, New York, United States, North America",fastgen.com/,,"$500,000",Seed,2,Y Combinator,1
Pre Seed Round - AlphaWatch AI,Pre-Seed,Seed,"$500,000","Apr 5, 2023",AlphaWatch AI,AlphaWatch AI is a company that creates an artificial intelligence-based research platform to streamline research.,"Artificial Intelligence, Information Services, Software",—,"San Francisco, California, United States, North America",www.alphawatch.ai,,"$500,000",Seed,1,Y Combinator,1
Pre Seed Round - DAGWorks,Pre-Seed,Seed,"$500,000","Apr 5, 2023",DAGWorks,"DAGWorks develops an open-core platform for data science teams to develop, produce, and maintain machine learning.","Analytics, Developer Tools, Infrastructure, Machine Learning, Open Source",—,"San Francisco, California, United States, North America",www.dagworks.io/,,"$500,000",Seed,1,Y Combinator,1
Pre Seed Round - Swishjam,Pre-Seed,Seed,"$500,000","Apr 5, 2023",Swishjam,"Swishjam measures, mitigates, and enhances the performance of websites and applications.","Developer Tools, Information Technology, Software",—,"Los Angeles, California, United States, North America",swishjam.com/,,"$500,000",Seed,1,Y Combinator,1
Pre Seed Round - Second,Pre-Seed,Seed,"$500,000","Apr 5, 2023",Second,Automated migrations and upgrades for every codebase,"Developer Tools, Software, Web Apps",—,"San Francisco, California, United States, North America",www.second.dev,,"$500,000",Seed,1,Y Combinator,1
Pre Seed Round - Cloudchipr,Pre-Seed,Seed,"$500,000","Apr 5, 2023",Cloudchipr,Cloudchipr is a cloud cost management and analytics platform.,"Analytics, SaaS",—,"Wilmington, Delaware, United States, North America",cloudchipr.com,,"$1,250,000",Seed,4,Y Combinator,1
Pre Seed Round - Concourse,Pre-Seed,Seed,"$500,000","Apr 5, 2023",Concourse,Concourse provides worldwide corporations with next-generation treasury management.,"B2B, Software",—,"San Francisco, California, United States, North America",concourse.co,,"$500,000",Seed,1,Y Combinator,1
Pre Seed Round - Narrative,Pre-Seed,Seed,"$500,000","Apr 5, 2023",Narrative,"Narrative is an AI-powered invoice audit, analytics, and payment tool for logistics.","Analytics, Artificial Intelligence, Payments",—,"San Francisco, California, United States, North America",www.trynarrative.com,,"$500,000",Seed,2,Y Combinator,1
Pre Seed Round - Coperniq,Pre-Seed,Seed,"$500,000","Apr 5, 2023",Coperniq,"Coperniq helps solar and energy contractors grow by connecting people, data, and systems.","Project Management, Solar",—,"San Ramon, California, United States, North America",www.coperniq.io,,"$500,000",Seed,1,Y Combinator,1
Pre Seed Round - Vaero,Pre-Seed,Seed,"$500,000","Apr 5, 2023",Vaero,Vaero is corporate software that allows developers to create log data pipelines.,"B2B, Network Security, Software",—,"San Francisco, California, United States, North America",www.vaero.co,,"$500,000",Seed,2,Y Combinator,1
Pre Seed Round - Tennr,Pre-Seed,Seed,"$500,000","Apr 5, 2023",Tennr,Tennr allows businesses to quickly setup custom-llm based automations and workflows.,"Artificial Intelligence, Internet, Virtual Assistant",—,"New York, New York, United States, North America",www.tennr.com,,"$5,000,000",Seed,2,Y Combinator,1
Pre Seed Round - Fintool.com,Pre-Seed,Seed,"$500,000","Apr 5, 2023",Fintool.com,Search all SEC Filings & Transcripts for free,"Analytics, Artificial Intelligence, Finance, SaaS, Search Engine",—,"San Francisco, California, United States, North America",www.fintool.com,,"$500,000",Seed,1,Y Combinator,1
Pre Seed Round - Trigo,Pre-Seed,Seed,"$500,000","Apr 5, 2023",Trigo,Trigo is a rental and housing data platform that improves credit outcomes and democratizes financial products for the under-banked.,"Credit, Database, FinTech, Real Estate",—,"New York, New York, United States, North America",trigodata.com,,"$500,000",Seed,1,Y Combinator,1
Pre Seed Round - moonrepo,Pre-Seed,Seed,"$500,000","Apr 5, 2023",moonrepo,moonrepo is an open-source build tool for monorepos and large codebases.,"Developer Tools, Open Source",—,"Portland, Oregon, United States, North America",moonrepo.dev,,"$500,000",Seed,1,Y Combinator,1
Pre Seed Round - Byterat,Pre-Seed,Seed,"$500,000","Apr 5, 2023",Byterat,Byterat is a data platform for battery engineers that provides battery testing data.,"Battery, Software, Test and Measurement",—,"Palo Alto, California, United States, North America",www.byterat.io,,"$500,000",Seed,1,Y Combinator,1
Pre Seed Round - OneText,Pre-Seed,Seed,"$500,000","Apr 5, 2023",OneText,OneText provides text-based services to individuals and commercial entities in order to assist them in purchasing goods and services .,"E-Commerce, Marketing, Payments",—,"San Francisco, California, United States, North America",home.onetext.com,,"$500,000",Seed,1,Y Combinator,1
Pre Seed Round - Vooma,Pre-Seed,Seed,"$500,000","Apr 5, 2023",Vooma,Vooma is a back-office automation platform that enables automated order entry for brokers and carriers.,"B2B, FinTech, Productivity Tools, Transportation",—,"San Francisco, California, United States, North America",www.vooma.ai,,"$500,000",Seed,1,Y Combinator,1
Pre Seed Round - Dream3D,Pre-Seed,Seed,"$500,000","Apr 5, 2023",Dream3D,Dream3D is a software company that builds 3D design tools.,"3D Technology, Computer Vision, Software",—,"New York, New York, United States, North America",www.dream3d.com,,"$500,000",Seed,1,Y Combinator,1
Pre Seed Round - Psychic,Pre-Seed,Seed,"$500,000","Apr 5, 2023",Psychic,Psychic is a data integration platform for large language models,"Artificial Intelligence, Information Technology, Software",—,"San Francisco, California, United States, North America",www.psychic.dev,,"$500,000",Seed,1,Y Combinator,1
Pre Seed Round - Pair AI,Pre-Seed,Seed,"$500,000","Apr 5, 2023",Pair AI,Pair AI is an AI-based mobile-first education platform.,"Artificial Intelligence, E-Learning, Mobile Apps",—,"San Francisco, California, United States, North America",www.pairai.com,,"$500,000",Seed,2,Y Combinator,1
Pre Seed Round - Propify,Pre-Seed,Seed,"$500,000","Apr 5, 2023",Propify,Propify is an API to integrate with property management systems.,"SaaS, Software",—,"Boston, Massachusetts, United States, North America",getpropify.com,,"$500,000",Seed,1,Y Combinator,1
Seed Round - CND Life Sciences,Seed,Seed,"$4,500,000","Mar 24, 2023",CND Life Sciences,CND Life Sciences develops an evidence-based tool to help confirm a diagnosis of synucleinopathy.,"Biotechnology, Health Diagnostics, Life Science",—,"Scottsdale, Arizona, United States, North America",cndlifesciences.com/,,"$19,700,000",Seed,6,—,—
Seed Round - Approximate Labs,Seed,Seed,"$5,350,000","Mar 23, 2023",Approximate Labs,Approximate Labs is a research lab that works at the intersection of artificial intelligence and tabular data.,"Artificial Intelligence, Information Technology, Internet",—,"Boulder, Colorado, United States, North America",www.approximatelabs.com/,,"$5,350,000",Seed,1,—,1
Pre Seed Round - Debut,Pre-Seed,Seed,"$100,000","Apr 15, 2023",Debut,All your work combined in one place.,"Collaboration, Productivity Tools, Software, Unified Communications",Women Founded,"San Francisco, California, United States, North America",www.debutwith.com,,"$200,000",Seed,2,Nexus Growth Ventures,1
Pre Seed Round - Rescript,Pre-Seed,Seed,"$100,000","Apr 25, 2023",Rescript,AI for Government Affairs,"CivicTech, Software",—,"Menlo Park, California, United States, North America",rescript.ai/,,"$100,000",Seed,1,Floodgate,1
Seed Round - Giadzy,Seed,Seed,"$5,000,000","Mar 23, 2023",Giadzy,"D2C online Food Retail, Media & Content platform","E-Commerce, Food and Beverage, Internet, Retail",—,"Los Angeles, California, United States, North America",giadzy.com,,"$5,000,000",Seed,2,Defy.vc,1
Pre Seed Round - Backdrop (formerly Twig),Pre-Seed,Seed,"$500,000","Apr 5, 2023",Backdrop (formerly Twig),"Backdrop offers Expense Management for the Film, TV, and Music production industry.","Film Production, Media and Entertainment, Music, TV Production",—,"San Francisco, California, United States, North America",www.joinbackdrop.com,,"$500,000",Seed,1,Y Combinator,1
Seed Round - OP[4],Seed,Seed,"$2,000,000","Mar 21, 2023",OP[4],OP[4] offers security revolution for IoT devices and Embedded systems.,"Cyber Security, Network Security, Security",—,"Chantilly, Virginia, United States, North America",www.op4.io,,"$2,000,000",Seed,1,—,—
Seed Round - Sutro Software,Seed,Seed,"$2,200,000","Mar 23, 2023",Sutro Software,"Sutro enables entrepreneurs to focus on product ideas, and not on the tech",—,—,"San Francisco, California, United States, North America",sutro.xyz/,,"$2,200,000",Seed,1,Eniac Ventures,1
Seed Round - Gaffney-Thompson Enterprises,Seed,Seed,"$1,600,000","Apr 28, 2023",Gaffney-Thompson Enterprises,Gaffney-Thompson Enterprises is a private-equity investment firm,"Digital Entertainment, Media and Entertainment, Music, Outdoors, Racing, Real Estate, Travel",—,"Cincinnati, Ohio, United States, North America",,,"$2,762,500",Seed,4,Jacob Gaffney,1
Seed Round - Drone Express,Seed,Seed,"$250,000","Mar 20, 2023",Drone Express,Drone Express is a full-service logistics company that uses airborne autonomous drones for local package delivery.,"Aerospace, Delivery Service, Drones",—,"Dayton, Ohio, United States, North America",droneexpress.com,,"$250,000",Seed,2,Venture 53,1
Seed Round - Pull Systems,Seed,Seed,"$5,000,000","Mar 18, 2023",Pull Systems,Pull Systems develops a machine-learning-as-a-service solution for capturing and analyzing vehicle data.,"Information Technology, Machine Learning",—,"Los Angeles, California, United States, North America",pull.systems/,,"$5,000,000",Seed,1,UP Partners,1
Seed Round - Couture Technologies,Seed,Seed,"$1,500,000","Mar 9, 2023",Couture Technologies,"Couture Technologies is a software development firm that specializes in the application of AI, ML, and 3D simulation technologies.","3D Technology, Artificial Intelligence, Software",Women Led,"Gallatin, Tennessee, United States, North America",couturetech.fashion,,"$1,756,000",Seed,3,—,—
Seed Round - Aspichi,Seed,Seed,"$500,000","Mar 16, 2023",Aspichi,Aspichi is developing platform to provide audio/visual teleportation services based on 360 video and VR technologies.,Information Technology,—,"Middletown, Delaware, United States, North America",www.aspichi.com,,"$500,000",Seed,1,SMRK VC Fund,1
Pre Seed Round - Landng,Pre-Seed,Seed,"$200,000","Apr 1, 2023",Landng,Landng is a trip planning company that aims to help travelers discover authentic travel experiences.,"Advertising Platforms, Consumer Software, Social Media Marketing, Travel","East Asian Founded, East Asian Led, Middle Eastern / North African Founded, Middle Eastern / North African Led, Native Hawaiian / Pacific Islander Founded, Native Hawaiian / Pacific Islander Led, Women Founded, Women Led","Los Angeles, California, United States, North America",www.landng.travel,,"$420,000",Seed,3,Accredited Investor,1
Seed Round - AppliedXL,Seed,Seed,"$999,999","Mar 10, 2023",AppliedXL,AppliedXL detects early signals in data before they become news.,"Information Technology, Life Science, Machine Learning, News",—,"New York, New York, United States, North America",www.appliedxl.com/,,"$5,999,999",Seed,3,—,—
Seed Round - ToMarket,Seed,Seed,"$30,000","Mar 1, 2023",ToMarket,"ToMarket is an online platform for chefs and purveyors that connects ordering, marketing, and invoicing all in one place.","Agriculture, AgTech, Farming, Food and Beverage, Local, Marketplace, Organic, Organic Food, Restaurants",—,"Arvada, Colorado, United States, North America",tomarket.farm,,"$170,000",Seed,6,—,1
Seed Round - Sourse,Seed,Seed,"$2,400,000","Apr 28, 2023",Sourse,Sourse is a food tech company that aims to set high standards for efficacy and sustainability in the category.,"Beauty, Food and Beverage, Health Care, Sustainability, Wellness","Women Founded, Women Led","San Francisco, California, United States, North America",trysourse.com,,"$4,020,000",Seed,3,—,—
Pre Seed Round - Backflip,Pre-Seed,Seed,"$265,000","Mar 31, 2023",Backflip,Backflip is a proptech fintech firm that enables real estate entrepreneurs to enhance local communities by revitalizing housing.,"FinTech, iOS, Real Estate Investment",—,"Denver, Colorado, United States, North America",dobackflip.com/,,"$35,265,000",Seed,3,—,1
Pre Seed Round - Blerp,Pre-Seed,Seed,"$100,000","Mar 9, 2023",Blerp,Blerp is an audio expression platform that helps create digital voices through sound bites.,"Apps, Digital Entertainment, Gaming, Software, Video Streaming","East Asian Founded, East Asian Led","Salt Lake City, Utah, United States, North America",www.blerp.com,,"$2,848,000",Seed,9,Stadia Ventures,1
Pre Seed Round - Offer,Pre-Seed,Seed,"$175,000","Apr 25, 2023",Offer,"Offer specializes in automated transaction management for realtors, offering a streamlined solution to handle the transaction process.","Business Development, Productivity Tools, Transaction Processing",—,"San Francisco, California, United States, North America",,,"$175,000",Seed,1,Antler,1
Pre Seed Round - Impact Biosystems,Pre-Seed,Seed,"$100,000","Mar 9, 2023",Impact Biosystems,Impact Biosystems develops hardware and software solutions for people in the health and fitness space.,"Fitness, Health Care, Software, Wellness","Women Founded, Women Led","Boston, Massachusetts, United States, North America",www.impactbiosystems.com,,"$6,600,000",Seed,3,Stadia Ventures,1
Pre Seed Round - Sparket,Pre-Seed,Seed,"$100,000","Mar 9, 2023",Sparket,"Sparket's goal is to democratize event wagering by providing more content in live events, esports, and traditional sports.","Events, Sports",—,"Los Angeles, California, United States, North America",www.betsparket.com,,"$1,154,397",Seed,4,Stadia Ventures,1
Seed Round - PakMule,Seed,Seed,"$539,460","Apr 24, 2023",PakMule,PakMule is a manufacturer of hitch baskets intended to facilitate adventure trips.,Consumer Goods,—,"Houston, Texas, United States, North America",pakmule.com/,,"$539,460",Seed,1,—,—
Pre Seed Round - Coresky,Pre-Seed,Seed,"$6,000,000","Mar 7, 2023",Coresky,Coresky is a fully decentralized protocol and NFT marketplace for launching new ideas.,"Blockchain, Cryptocurrency, Virtual Currency",—,"Mountain View, California, United States, North America",home.coresky.com,,"$6,000,000",Seed,1,—,—
Pre Seed Round - Grapefruit Health,Pre-Seed,Seed,"$125,000","Apr 25, 2023",Grapefruit Health,Grapefruit Health utilizes a clinical student workforce to perform interactions with patients remotely.,"Health Care, Medical, Training","Hispanic / Latine Founded, Hispanic / Latine Led","Chicago, Illinois, United States, North America",www.grapefruit.health/,,"$795,038",Seed,5,Antler,1
Seed Round - Novobeing,Seed,Seed,"$500,000","Feb 27, 2023",Novobeing,Novobeing ( formerly Rocket VR Health ) is a digital health company that provides virtual reality stress reduction and well-being solutions.,"Health Care, Software, Therapeutics, Virtual Reality",—,"Wakefield, Massachusetts, United States, North America",www.novobeing.com/,,"$1,000,000",Seed,5,—,1
Pre Seed Round - Twyla Couture,Pre-Seed,Seed,"$1,000","Mar 1, 2023",Twyla Couture,E-commerce based fashion brand empowering women and our planet one dress at a time!,"E-Commerce, Fashion",Hispanic / Latine Founded,"Miami, Florida, United States, North America",twylacouture.com/,,"$11,000",—,3,—,1
Pre Seed Round - Xerataus IQX,Pre-Seed,Seed,"$25,000,000","Mar 7, 2023",Xerataus IQX,Xerataus IQX provides healthcare intelligence solutions.,"Artificial Intelligence, Assistive Technology, Health Care, Intelligent Systems, Medical","Hispanic / Latine Founded, Hispanic / Latine Led","Charlotte, North Carolina, United States, North America",linktr.ee/xerataus,,"$50,000,000",Seed,2,IO Group,1
Seed Round - Symbiosis,Seed,Seed,"$450,000","Mar 1, 2023",Symbiosis,"Symbiosis is an online marketplace where private practices can find business services, including flexible clinic space, for their practices.","Coworking, Health Care, Hospital","South Asian Founded, South Asian Led, Women Founded","Washington, District of Columbia, United States, North America",joinsymbiosis.com,,"$505,000",Seed,2,GoAhead Ventures,1
Seed Round - Starfish Space,Seed,Seed,"$7,500,000","Mar 1, 2023",Starfish Space,"Starfish Space develops and manufactures autonomous space vehicles that perform in-orbit, satellite servicing missions.","Aerospace, Manufacturing, Space Travel, Transportation",—,"Seattle, Washington, United States, North America",www.starfishspace.com,,"$29,150,000",Early Stage Venture,7,Spacecadet Ventures,1
Pre Seed Round - KeepWeek,Pre-Seed,Seed,"$25,000","Apr 1, 2023",KeepWeek,"KeepWeek simplifies project management for SMEs, streamlining planning, collaboration, and tracking to keep teams organised.",—,—,"Cheyenne, Wyoming, United States, North America",keepweek.com/,,"$80,000",Seed,2,Kärtel Labs,1
Pre Seed Round - Infisical,Pre-Seed,Seed,"$125,000","Apr 5, 2023",Infisical,"Infisical is an open-source, end-to-end encrypted solution that allows development teams to sync their environment variables.","Cloud Security, Network Security, Software",—,"San Francisco, California, United States, North America",infisical.com,,"$2,925,000",Seed,2,Y Combinator,1
Seed Round - NeuroX1,Seed,Seed,"$500,000","Mar 3, 2023",NeuroX1,Computational drug discovery leveraging generative AI to create therapeutics for neurodegenerative disorders.,"Artificial Intelligence, Biopharma, Biotechnology, Life Science, Machine Learning, Neuroscience",LGBTQ+ Founded,"Austin, Texas, United States, North America",www.neurox1.com,,"$1,750,000",Seed,2,Drive Capital,1
