Pre Seed Round - Stardust,Pre-Seed,Seed,"$350,000","Feb 1, 2020",Stardust,Stardust is a software platform for game building in the metaverse.,"Blockchain, Developer APIs, FinTech, Gaming, Software",—,"Palo Alto, California, United States, North America",stardust.gg,,"$36,700,000",Early Stage Venture,5,—,—
Seed Round - Cartwheel Advisors,Seed,Seed,"$600,000","Feb 4, 2020",Cartwheel Advisors,Cartwheel Advisors owns and manages real estate investments and programs.,"Financial Services, Real Estate, Real Estate Investment",—,"New York, New York, United States, North America",www.cartwheeladvisors.com/,,"$600,000",Seed,1,JIT Funds,1
Pre Seed Round - Empower,Pre-Seed,Seed,"$170,000","Feb 10, 2020",Empower,Empower is a software company that operates and provides a ridesharing platform.,"Apps, Information Technology, Ride Sharing, Software",—,"Mclean, Virginia, United States, North America",driveempower.com/,,"$10,119,875",—,7,—,—
Seed Round - Agragene,Seed,Seed,"$1,200,000","Mar 2, 2020",Agragene,Agragene is an agtech company that develops crop pests and eradicate mosquito-borne disease using biological insect control technology.,"Agriculture, AgTech, Biotechnology",—,"San Diego, California, United States, North America",agragene.com/,,"$5,200,000",Early Stage Venture,2,Ospraie Ag Sciences,1
Seed Round - Aturian,Seed,Seed,"$125,000","Mar 2, 2020",Aturian,Aturian offers business management solution supporting promotional distributors of every size and employees in every role.,"Business Intelligence, Data Visualization, Enterprise Resource Planning (ERP)",—,"Lake Forest, Illinois, United States, North America",www.aturian.com/,,"$125,000",Seed,1,—,—
Seed Round - theklicker,Seed,Seed,"$250,000","Jan 20, 2020",theklicker,Theklicker is an e-commerce tool that provides a directory of products for consumers to efficiently buy online.,"E-Commerce, Information Services, Internet, Online Portals",Women Founded,"Palo Alto, California, United States, North America",theklicker.com/,,"$26,750,000",Early Stage Venture,10,—,—
Pre Seed Round - Keys,Pre-Seed,Seed,"$300,000","Jan 27, 2020",Keys,The world's first intent-based communication system,"Artificial Intelligence, Dating, Mobile Apps, Software",—,"Denver, Colorado, United States, North America",www.thekeys.ai,,"$700,000",Seed,4,Techstars,2
Seed Round - Inference Analytics,Seed,Seed,"$135,000","Feb 1, 2020",Inference Analytics,Inference Analytics is a deep tech company that has been working in using Large Language Models in medicine to improve care delivery.,"Apps, Artificial Intelligence, Health Care, Information Technology, Machine Learning, Small and Medium Businesses, Software",—,"Chicago, Illinois, United States, North America",www.inferenceanalytics.com,,"$1,090,000",Seed,5,—,—
Seed Round - DealersGear,Seed,Seed,"$500,000","Mar 10, 2020",DealersGear,Automotive Software And Marketing Company,"Information Technology, Marketing, Software",—,"Irvine, California, United States, North America",www.dealersgear.com,,"$600,000",Seed,2,—,—
Seed Round - Trellis Research,Seed,Seed,"$4,400,000","Feb 6, 2020",Trellis Research,Trellis Research is a state trial court legal research and analytics platform with AI-based insights on judges.,"Analytics, Information Technology, Legal, Legal Tech","Women Founded, Women Led","Los Angeles, California, United States, North America",trellis.law,,"$35,620,000",Early Stage Venture,5,Craft Ventures,1
Pre Seed Round - XILO,Pre-Seed,Seed,"$40,000","Feb 1, 2020",XILO,XILO is a workflow automation platform designed for traditional insurance agencies and companies.,"Auto Insurance, Commercial Insurance, FinTech, Insurance, InsurTech, Property Insurance, SaaS, Sales Automation, Software",—,"San Diego, California, United States, North America",www.xilo.io/,,"$6,000,000",Seed,4,Forum Ventures,1
Pre Seed Round - FloatMe,Pre-Seed,Seed,"$250,000","Jan 28, 2020",FloatMe,FloatMe is a mobile application that offers financial services.,"Financial Services, FinTech, Mobile Apps",—,"San Antonio, Texas, United States, North America",www.floatme.com,,"$48,875,000",Early Stage Venture,8,Comeback Capital,2
Pre Seed Round - Cleanomatics,Pre-Seed,Seed,"$35,000","Mar 3, 2020",Cleanomatics,Cleanomatics offers door-step on-demand laundry services.,"Customer Service, E-Commerce, Laundry and Dry-cleaning, Logistics",—,"Fremont, California, United States, North America",cleanoamatics.com,,"$35,000",Seed,2,MARL 5G Accelerator,1
Seed Round - Gina Cucina,Seed,Seed,"$194,132","Feb 7, 2020",Gina Cucina,Gina Cucina brings authentic and unadulterated food in every table.,Wellness,Women Founded,"Carbondale, Colorado, United States, North America",ginacucina.com/,,"$194,132",Seed,1,—,—
Pre Seed Round - Chatterworks,Pre-Seed,Seed,"$600,000","Mar 1, 2020",Chatterworks,"ChatterWorks is a recruiting platform that helps recruiters find, engage, and close hard-to-hire talent.","Internet, Recruiting, Software",—,"Irvine, California, United States, North America",www.chatterworks.com/,,"$600,000",Seed,3,Operate,1
Seed Round - BlueStripe,Seed,Seed,"$4,000,000","Feb 3, 2020",BlueStripe,BlueStripe provides property renting services intended to make students feel comfortable and at home.,"Hospitality, Real Estate, Rental, Rental Property",—,"New York, New York, United States, North America",bluestripeliving.com/,,"$4,000,000",Seed,1,RiverPark Ventures,1
Seed Round - iRecoveryUSA,Seed,Seed,"$1,500,000","Mar 1, 2020",iRecoveryUSA,Telehealth Substance Abuse Treatment Provider,"Electronic Health Record (EHR), Health Care, Medical, mHealth, Psychology",—,"Boca Raton, Florida, United States, North America",www.iRecoveryUSA.com,,"$2,000,000",Seed,2,—,—
Seed Round - Novelty Media,Seed,Seed,"$550,000","Mar 5, 2020",Novelty Media,World's first mobile operators' media channel,"Media and Entertainment, Mobile Advertising, Mobile Apps, Software",—,"Wilmington, Delaware, United States, North America",novelty-media.com,,"$2,750,000",Seed,3,—,—
Pre Seed Round - Expedock,Pre-Seed,Seed,"$1,150,000","Mar 7, 2020",Expedock,Expedock is an AI-based outsourcing services provider for logistics and freight providers.,"Artificial Intelligence, Freight Service, Logistics, Software",—,"Palo Alto, California, United States, North America",www.expedock.com/,,"$21,651,000",Early Stage Venture,4,"Liqing Zeng, Pear VC",3
Pre Seed Round - Top Ten Reviews AI,Pre-Seed,Seed,"$50,000","Jan 28, 2020",Top Ten Reviews AI,Smart AI Help People Choose the Perfect Product,"Artificial Intelligence, Business Intelligence, Consumer Research, Information Technology, Machine Learning, Product Research, Software",—,"Santa Clara, California, United States, North America",www.toptenreviews.ai,,"$350,000",Seed,3,Thai Pham,1
Seed Round - Gravity Medical Technology,Seed,Seed,"$1,000,000","Mar 1, 2020",Gravity Medical Technology,Democratizing access to brain stroke treatment,"Biotechnology, Health Care",—,"Palo Alto, California, United States, North America",www.gravitymedtech.com,,"$3,000,000",Early Stage Venture,2,—,—
Pre Seed Round - Brightly,Pre-Seed,Seed,"$150,000","Feb 19, 2020",Brightly,Brightly is a community-driven lifestyle brand empowering conscious consumers.,"Communities, Digital Media, Sustainability","Women Founded, Women Led","Oakland, California, United States, North America",brightly.eco,,"$1,150,000",—,3,Yellow,1
Pre Seed Round - GroGuru,Pre-Seed,Seed,"$100,000","Feb 24, 2020",GroGuru,Groguru is a technology company that specializes in smart irrigation solutions for agriculture.,"Agriculture, AgTech, Farming, GreenTech",—,"La Jolla, California, United States, North America",www.groguru.com,,"$6,296,007",Early Stage Venture,11,SVG Ventures,1
Pre Seed Round - MessageDesk,Pre-Seed,Seed,"$240,000","Feb 28, 2020",MessageDesk,MessageDesk is a shared team inbox for business text messaging.,"Messaging, SaaS, SMS, Software",—,"Reno, Nevada, United States, North America",messagedesk.com,,"$1,901,037",Seed,2,Reno Seed Fund,2
Pre Seed Round - Tangram,Pre-Seed,Seed,"$287,500","Jan 27, 2020",Tangram,Flexible no-code marketplace software. Launch a custom online marketplace 100x faster and cheaper than hiring a developer.,"Analytics, E-Commerce, Marketplace, SaaS, Service Industry, Software","Southeast Asian Led, Women Founded, Women Led","Pittsburgh, Pennsylvania, United States, North America",tangram.co,,"$287,500",Seed,1,Techstars,4
Seed Round - Mica Energies: Wireless Power,Seed,Seed,"$2,000","Jan 28, 2020",Mica Energies: Wireless Power,Mica Energies is developing a “Far-Field Communications (FFC)” approach to extracting RF energy from the surrounding environment.,Telecommunications,—,"Irvine, California, United States, North America",www.micaenergies.com,,"$125,700",Early Stage Venture,11,—,—
Seed Round - Elements Drinks,Seed,Seed,"$25,000","Jan 15, 2020",Elements Drinks,Elements Drinks offers functional wellness drinks made with adaptogens.,"Food and Beverage, Health Care, Wellness",—,"New York, New York, United States, North America",elementsdrinks.com/,,"$25,000",Seed,2,—,—
Seed Round - Advanced Claims Technologies,Seed,Seed,"$400,000","Feb 4, 2020",Advanced Claims Technologies,Advanced Claims Technologies provides accurate and economical roof sketches.,"Insurance, Software, Test and Measurement",—,"Alpharetta, Georgia, United States, North America",act.claims/index.html,,"$400,000",Seed,1,—,—
Pre Seed Round - AvantGuard,Pre-Seed,Seed,"$68,000","Feb 1, 2020",AvantGuard,AvantGuard is developing the next generation of antimicrobial products to provide long lasting protection against pathogens,"Advanced Materials, Health Care, Industrial Engineering, Manufacturing, Medical",—,"Ithaca, New York, United States, North America",www.avantguardinc.com/,,"$10,213,755",Seed,21,—,—
Seed Round - EdCraft,Seed,Seed,"$1,000,000","Mar 1, 2020",EdCraft,Educational SaaS for kids,EdTech,—,"Garden City, New York, United States, North America",edcraft.io,,"$1,000,000",Seed,1,—,—
Pre Seed Round - GrayLane Beauty,Pre-Seed,Seed,"$250,000","Mar 1, 2020",GrayLane Beauty,Dollar Shave Club for mascara,E-Commerce,—,"San Francisco, California, United States, North America",graylanebeauty.com,,"$250,000",Seed,1,—,—
Seed Round - Securisyn Medical,Seed,Seed,"$2,500,000","Feb 12, 2020",Securisyn Medical,Securisyn Medical manufactures oxygen delivery systems for mechanically-ventilated patients.,"Health Care, Manufacturing, Medical Device",Women Founded,"Littleton, Colorado, United States, North America",securisyn.com,,"$15,527,000",—,6,—,1
Seed Round - Kloud.io,Seed,Seed,"$4,000,000","Jan 30, 2020",Kloud.io,Data integration tool to help a data scientist or business user to analyze multiple data sources,"Analytics, Business Intelligence, Data Integration",—,"San Jose, California, United States, North America",kloud.io,,"$4,650,000",M&A,5,Unusual Ventures,4
Seed Round - K8 Ventures,Seed,Seed,"$1,200,000","Feb 1, 2020",K8 Ventures,K8 Ventures specializes in building companies from the ground up that solve specific business problems in market segments.,"Artificial Intelligence, Consumer, Health Care, Machine Learning, SaaS, Software",—,"Chicago, Illinois, United States, North America",www.k8ventures.com/,,"$1,200,000",M&A,1,—,—
Seed Round - Airspace Link,Seed,Seed,"$4,000,000","Jan 24, 2020",Airspace Link,Airspace Link is an FAA approved UAS/Drone Low Altitude Authorization and Notification Capability (LAANC) Platform,"Aerospace, Drone Management, Geospatial, Government, Mapping Services",Women Founded,"Detroit, Michigan, United States, North America",airspacelink.com/,,"$41,000,070",Early Stage Venture,7,Indicator Ventures,6
Seed Round - Ai4,Seed,Seed,"$250,454","Jan 24, 2020",Ai4,Ai4 is a conference organizer helping large companies progress their AI and machine learning capabilities.,"Artificial Intelligence, Events, Machine Learning, Software",Women Founded,"Brooklyn, New York, United States, North America",ai4.io,,"$250,454",Seed,1,—,—
Seed Round - Sozie,Seed,Seed,"£55,000","Feb 1, 2020",Sozie,"Sozie is the leading on-demand product content platform covering fashion, food and home products for brands and retailers globally.","Consumer Reviews, Content Marketing, E-Commerce Platforms, Retail Technology",—,"New York, New York, United States, North America",www.sozie.com/,,"$956,240",Seed,6,—,—
Seed Round - Volastra Therapeutics,Seed,Seed,"$12,000,000","Feb 11, 2020",Volastra Therapeutics,Volastra Therapeutics is a biotechnology company developing novel therapies for the treatment of metastatic cancers.,"Biotechnology, Life Science, Medical",—,"New York, New York, United States, North America",volastratx.com/,,"$104,000,000",Early Stage Venture,3,Polaris Partners,6
Seed Round - RePurpose Energy,Seed,Seed,"$650,000","Feb 12, 2020",RePurpose Energy,"RePurpose Energy reuses electric vehicle batteries to create lower-cost, more sustainable ""second life"" solar energy storage systems.","Battery, Electronics, Energy, Energy Storage, Renewable Energy, Solar, Sustainability, Waste Management",—,"Fairfield, California, United States, North America",www.repurpose.energy/,,"$10,636,000",Seed,9,"Jeil Technos Co., LTD",1
Seed Round - RiskQ Inc. (formerly: Cyber Innovative Technologies),Seed,Seed,"$1,200,000","Jan 31, 2020",RiskQ Inc. (formerly: Cyber Innovative Technologies),Cyber Risk Quantification and Management Software based on Digital Asset Methodology,"Cyber Security, FinTech, InsurTech, Management Consulting, Market Research, Medical, Privacy, SaaS, Small and Medium Businesses, Telecommunications","Women Founded, Women Led","Miami, Florida, United States, North America",www.risk-q.com,,"$3,200,000",Early Stage Venture,4,—,6
Pre Seed Round - rBIO,Pre-Seed,Seed,"$60,000","Feb 10, 2020",rBIO,Biotechnology,"Biotechnology, Health Care, Manufacturing",—,"San Francisco, California, United States, North America",www.rbio.online,,"$60,000",Seed,1,—,—
Seed Round - UVL Robotics,Seed,Seed,"$1,400,000","Jan 15, 2020",UVL Robotics,Drone-based & AI logistics solutions,"Artificial Intelligence, Drone Management, Drones, Last Mile Transportation, Logistics, Machine Learning, Retail, Warehousing",—,"San Jose, California, United States, North America",www.uvl.io/,,"$2,000,000",Seed,6,Phystech Ventures,2
Pre Seed Round - Retrocausal,Pre-Seed,Seed,"$120,000","Feb 3, 2020",Retrocausal,Retrocausal provides a no-code AI platform that helps manufacturers minimize re-work and scrap costs while maximizing worker productivity.,"Artificial Intelligence, Augmented Reality, Industrial Automation, Software",—,"Seattle, Washington, United States, North America",www.retrocausal.ai,,"$4,560,000",—,6,Techstars,1
Seed Round - Reality AI,Seed,Seed,"$2,000,000","Feb 15, 2020",Reality AI,Reality AI offers a complete engineering environment for Edge AI / Tiny ML product development using sensors.,"Artificial Intelligence, Automotive, Consumer Electronics, Industrial Automation, Internet of Things, Machine Learning, Predictive Analytics, Sensor, Software",—,"Columbia, Maryland, United States, North America",reality.ai/,,"$3,700,000",M&A,4,Lytical Ventures,5
Pre Seed Round - splashmob,Pre-Seed,Seed,"$60,000","Feb 3, 2020",splashmob,Splashmob is a computer software company that specializes in live events.,"Apps, Mobile Apps, Software, Video Streaming",—,"Los Angeles, California, United States, North America",splashmob.app,,"$60,000",Seed,1,Techstars,1
Pre Seed Round - ByDesign,Pre-Seed,Seed,"$1,000,025","Mar 11, 2020",ByDesign,ByDesign is a tool that harnesses the power of accountability and brings life to effective planning.,"Information Technology, Project Management, Software, Task Management",—,"Boston, Massachusetts, United States, North America",bydesign.io,,"$1,120,025",Seed,2,—,—
Seed Round - The Meta,Seed,Seed,"$2,500,000","Feb 4, 2020",The Meta,The Meta is a digital training platform.,"eSports, Machine Learning, Video Games",—,"San Francisco, California, United States, North America",themeta.com/,,"$7,303,000",Early Stage Venture,3,—,5
"Pre Seed Round - Svvarga, Inc.",Pre-Seed,Seed,"$250,000","Mar 4, 2020","Svvarga, Inc.",We design and build innovative tools to aid in streamlining internal processes and eliminating bottlenecks.,"Artificial Intelligence, B2B, Financial Services, FinTech, Machine Learning, Software",—,"New York, New York, United States, North America",svvarga.com,,"$250,000",Seed,1,—,—
Seed Round - WikiRealty,Seed,Seed,"$1,250,000","Jan 15, 2020",WikiRealty,WikiRealty is an industry-leading search-to-close real estate marketplace helping people buy and sell real estate online,"Internet, Marketplace, Real Estate",—,"Los Angeles, California, United States, North America",wikirealty.com,,"$3,150,000",Seed,3,—,—
Pre Seed Round - cobu,Pre-Seed,Seed,"$120,000","Jan 17, 2020",cobu,cobu is a  Community organisation Company.,Real Estate,—,"Boston, Massachusetts, United States, North America",www.livecobu.com/,,"$120,000",Seed,4,Techstars,1
Seed Round - WorkRails,Seed,Seed,"$1,514,000","Mar 10, 2020",WorkRails,WorkRails Services CPQ simplifies the selling of professional services with the power of automation.,"Enterprise Software, Information Technology, Professional Services, SaaS, Software",—,"Huntington, New York, United States, North America",www.workrails.com,,"$6,351,429",Seed,4,Reciprocal Ventures,4
Pre Seed Round - Kibo,Pre-Seed,Seed,"€50,000","Mar 1, 2020",Kibo,"Kibo provides unified commerce solutions you can count on for B2C and B2B Ecommerce, Order Management, Personalization, and Point of Sale.","Apps, Information Technology, Software",—,"Newark, Delaware, United States, North America",kibo-e929c6.webflow.io,,"€50,000",Seed,2,—,—
Seed Round - Gameto,Seed,Seed,"$3,000,000","Mar 1, 2020",Gameto,Gameto is a biotechnology using cell engineering to develop therapeutics of the female reproductive system.,"Biopharma, Biotechnology, Genetics",—,"New York, New York, United States, North America",gametogen.com,,"$40,000,000",—,4,—,5
Seed Round - AMNESIA Media,Seed,Seed,"$120,000","Jan 13, 2020",AMNESIA Media,AMNESIA Media is an influencer marketing platform dedicated to cannabis.,"Advertising, Cannabis, Marketing","Women Founded, Women Led","San Francisco, California, United States, North America",www.amnesiamedia.io/,,"$1,120,000",Seed,2,—,1
Seed Round - Faith Beyond Doubt,Seed,Seed,"$100,000","Feb 5, 2020",Faith Beyond Doubt,"Faith Beyond Doubt combines the epic, action packed, visually stunning quality of a Hollywood production.","Film, Film Distribution, Film Production",—,"Bonsall, California, United States, North America",faithbeyonddoubt.com,,"$100,000",Seed,1,—,—
Pre Seed Round - Docugami,Pre-Seed,Seed,"$1,700,000","Feb 11, 2020",Docugami,Docugami is a Seattle-area document engineering startup that transforms how businesses create and manage documents,Artificial Intelligence,—,"Kirkland, Washington, United States, North America",docugami.com,,"$11,916,917",Seed,3,—,—
Pre Seed Round - LMNS,Pre-Seed,Seed,"$150,000","Jan 19, 2020",LMNS,Hiring platform for digital marketers,—,—,"New York, New York, United States, North America",www.hirelmns.com/,,"$150,000",Seed,1,—,1
Seed Round - Maze,Seed,Seed,"$2,000,000","Jan 20, 2020",Maze,Maze is the continuous product discovery platform for user-centric teams.,"Analytics, Computer, Product Design, Product Research, SaaS, Software, Usability Testing",—,"Menlo Park, California, United States, North America",maze.co/,,"$57,472,923",Early Stage Venture,4,Amplify Partners,6
Pre Seed Round - Hardworkers,Pre-Seed,Seed,"$150,000","Feb 19, 2020",Hardworkers,"Hardworkers is an online platform that enables working-class to post work-related photos, videos, and texts.","Apps, Digital Entertainment, Social",—,"Cambridge, Massachusetts, United States, North America",hard-workers.com,,"$150,000",Seed,2,Yellow,1
Seed Round - Federa Inc.,Seed,Seed,"$500,000","Jan 15, 2020",Federa Inc.,Freedom to live where you want to live.,"Big Data, Real Estate",—,"Great Falls, Virginia, United States, North America",www.federa.com/,,"$500,000",Seed,1,—,—
Pre Seed Round - Fantasy Invest,Pre-Seed,Seed,"$250,000","Jan 15, 2020",Fantasy Invest,We gamify the stock market. You can conquer the stock market! Play and win with Fantasy Stocks game.,"Digital Entertainment, Fantasy Sports, Gaming",—,"Los Angeles, California, United States, North America",fantasyinvest.club,,"$776,678",Seed,3,—,—
Seed Round - Wren,Seed,Seed,"$1,500,000","Jan 16, 2020",Wren,Wren is a web app that helps live carbon neutral by accounting for and offsetting CO2 emissions.,"GreenTech, Software, Web Apps",Women Founded,"San Jose, California, United States, North America",www.wren.co/,,"$8,246,001",Seed,4,Union Square Ventures,2
Pre Seed Round - Triangle,Pre-Seed,Seed,"$200,000","Jan 29, 2020",Triangle,Big Data finance platform for sustainability and infrastructure,"Agriculture, AgTech, Blockchain, CleanTech, Financial Services, FinTech, Infrastructure, Solar, Sustainability",—,"New York, New York, United States, North America",www.triangle.digital,,"$2,000,000",Seed,3,University of Michgian,1
Seed Round - Betsperts,Seed,Seed,"$1,641,671","Jan 13, 2020",Betsperts,"Betsperts provides crowdsourced sports content, social media, advice, and user analytics on a centralized platform.","Analytics, Content, Crowdfunding, Information Services, Media and Entertainment, Sports",—,"Chicago, Illinois, United States, North America",www.betsperts.com/,,"$7,641,671",Early Stage Venture,3,—,—
Pre Seed Round - Acoustic Wells,Pre-Seed,Seed,"$2,000,000","Feb 16, 2020",Acoustic Wells,Acoustic Wells offers industrial IoT solutions to maximize oil field efficiency and reduce environmental impact.,"Internet, Internet of Things, Oil and Gas",—,"Boston, Massachusetts, United States, North America",www.acoustic-wells.com,,"$12,000,000",Seed,6,—,2
Pre Seed Round - Linq,Pre-Seed,Seed,"$960,000","Mar 8, 2020",Linq,Linq is a networking ecosystem for the modern professional.,"Information Technology, Professional Networking, Software",—,"Birmingham, Alabama, United States, North America",linqapp.com,,"$5,500,000",—,3,Alabama Futures Fund,2
Pre Seed Round - Givelist,Pre-Seed,Seed,"$300,000","Mar 10, 2020",Givelist,"One app for all your giving. Discover the charities (1.9m) doing the best job for any cause you care about, give easily, and see your impact","Financial Services, FinTech, Social Media",—,"Santa Monica, California, United States, North America",www.givelistapp.com/,,"$300,000",Seed,3,—,—
Seed Round - Pura,Seed,Seed,"$4,400,000","Feb 20, 2020",Pura,"Keurig built a marketplace for coffee brands, Pura is doing that, but in home fragrance with the biggest brands people know and love.","Consumer Electronics, Internet of Things, Marketplace, Smart Home, Subscription Service",—,"Orem, Utah, United States, North America",www.trypura.com,,"$4,400,000",Seed,1,Kickstart,8
Seed Round - TradeMonday,Seed,Seed,"$38,000","Feb 1, 2020",TradeMonday,TradeMonday is an AI-Powered Retail Experimental Platform.,"Artificial Intelligence, Big Data, E-Commerce, E-Commerce Platforms, Machine Learning, Mobile, SaaS",—,"New York, New York, United States, North America",trademonday.com/,,"$227,000",—,6,Cyberport Hong Kong,1
Pre Seed Round - Aesop Technology,Pre-Seed,Seed,"$615,000","Mar 1, 2020",Aesop Technology,"AESOP makes physician clinical documentation easier, faster and less error prone using Machine Learning on 3.2 billion patient visits.","Artificial Intelligence, Health Care",—,"San Francisco, California, United States, North America",aesoptek.com/,,"$3,935,000",Seed,5,—,1
Seed Round - StepFunction.ai,Seed,Seed,"$2,300,000","Jan 23, 2020",StepFunction.ai,StepFunction.ai provides a growth solution for SaaS AI platforms that provide rich customer intent signals to SaaS providers.,"Artificial Intelligence, Big Data, SaaS",—,"Palo Alto, California, United States, North America",www.stepfunction.ai/,,"$7,300,000",—,3,Hummer Winblad Venture Partners,3
Seed Round - Docugami,Seed,Seed,"$10,000,000","Feb 11, 2020",Docugami,Docugami is a Seattle-area document engineering startup that transforms how businesses create and manage documents,Artificial Intelligence,—,"Kirkland, Washington, United States, North America",docugami.com,,"$11,916,917",Seed,3,SignalFire,17
Seed Round - Rhombus Systems,Seed,Seed,"$7,000,000","Mar 1, 2020",Rhombus Systems,Rhombus is an open physical security platform that provides cloud managed video security and IoT sensors to companies around the world.,"Information Technology, Security, Video",—,"Sacramento, California, United States, North America",www.rhombussystems.com,,"$24,500,000",Early Stage Venture,4,—,—
Seed Round - Connie Health,Seed,Seed,"$3,000,000","Feb 1, 2020",Connie Health,"Connie Health empowers older Americans to make confident, worry-free healthcare decisions.",Health Care,—,"Boston, Massachusetts, United States, North America",www.conniehealth.com/,,"$16,000,000",Early Stage Venture,2,Khosla Ventures,8
Seed Round - Disruption Labs,Seed,Seed,"$3,800,000","Feb 26, 2020",Disruption Labs,Disruption Labs is a R&D and manufacturing firm that utilizes pharmaceutical grade nano-bioengineering and applies it to consumer products.,"Biotechnology, Dietary Supplements, Manufacturing, Nanotechnology, Nutraceutical, Personal Health, Product Research, Usability Testing, Wellness",—,"Tampa, Florida, United States, North America",www.disruption-labs.com,,"$3,800,000",Seed,1,Andrew Garnock,2
