Pre Seed Round - Welby Health,Pre-Seed,Seed,"$900,000","Nov 1, 2021",Welby Health,"Virtual care management solution for physicians. Improved outcomes, increased revenue, and greater success from value based contracts.","Health Care, Nursing and Residential Care, Software, Wellness",—,"Carlsbad, California, United States, North America",www.welby.care,,"$2,400,000",Seed,2,New Stack Ventures,1
Seed Round - SMBX,Seed,Seed,"$11,500,000","Oct 20, 2021",SMBX,SMBX is a funding portal and public marketplace for issuing and buying U.S. small business bonds.,"Banking, Financial Services, FinTech, Marketplace, Retail, Small and Medium Businesses","Hispanic / Latine Founded, Hispanic / Latine Led, Women Founded","San Francisco, California, United States, North America",www.thesmbx.com,,"$15,225,000",Seed,7,Group 11,8
Seed Round - Mycelial,Seed,Seed,"$3,800,000","Nov 4, 2021",Mycelial,Mycelial unifies Edge and Cloud SQLite instances peer-to-peer and without any data middleware.,"Cloud Data Services, Information Technology, Software",—,"New York, New York, United States, North America",www.mycelial.co,,"$3,800,000",Seed,1,Crane Venture Partners,1
Seed Round - VCR Group,Seed,Seed,"$725,000","Oct 26, 2021",VCR Group,"VCR Group creates thoughtful restaurant and hospitality concepts, culinary experiences, and food products in physical and digital spaces.","Hospitality, Project Management, Restaurants",—,"New York, New York, United States, North America",vcrgroup.com,,"$14,725,000",—,2,—,—
Pre Seed Round - Solvetech,Pre-Seed,Seed,"£173,424","Nov 10, 2021",Solvetech,Solvetech provides gauging solution.,"Industrial, Manufacturing, Plastics and Rubber Manufacturing, Service Industry",—,"Wilmington, Delaware, United States, North America",www.gauging.com,,"£173,424",Seed,1,—,1
Seed Round - Gamma,Seed,Seed,"$7,000,000","Oct 28, 2021",Gamma,Inventing a new medium to replace the slide deck.,Software,—,"San Francisco, California, United States, North America",gamma.app/,,"$7,000,000",—,2,Accel,7
Seed Round - Breezi.io,Seed,Seed,"$1,000,000","Oct 28, 2021",Breezi.io,Breezi.io builds wireless devices that enable homeowners to detect problems with their HVAC systems before they become severe.,Consumer Electronics,—,"Durham, North Carolina, United States, North America",breezi.io,,"$1,000,000",Seed,3,—,1
Seed Round - Zeit Medical,Seed,Seed,"$2,000,000","Oct 29, 2021",Zeit Medical,Zeit Medical provides peace of mind to neurology injury patients through powered AI and cutting edge Bioelectronics.,"Biotechnology, Health Care, Health Diagnostics, Medical Device",—,"Redwood City, California, United States, North America",www.zeitmedical.com,,"$2,125,000",Seed,2,"DigiLife, SeedToB Capital",10
Pre Seed Round - Camdog Inc,Pre-Seed,Seed,"$200,000","Oct 31, 2021",Camdog Inc,Camdog - cloud-based on-demand video surveillance and analysis service,"Artificial Intelligence, Information Technology, Internet, Machine Learning, Software",—,"New York, New York, United States, North America",camdog.cloud,,"$470,000",Seed,4,Starta VC,2
Seed Round - Kovina Therapeutics,Seed,Seed,"$2,000,000","Oct 20, 2021",Kovina Therapeutics,Kovina Therapeutics operates as a pre-clinical biotechnology company.,"Biotechnology, Therapeutics",—,"Indianapolis, Indiana, United States, North America",www.kovina.com/,,"$2,575,000",Seed,4,Elevate Ventures,3
Seed Round - Zebec,Seed,Seed,"$6,000,000","Nov 10, 2021",Zebec,Zebec is a continuous settlement protocol on Solana. Zebec is enabling the composable transfer of value starting with Stream Payroll.,"Financial Services, Information Technology, Payments",—,"San Francisco, California, United States, North America",zebec.io/,,"$42,500,000",—,3,"Breyer Capital, Republic capital, Shima Capital",12
Pre Seed Round - Adaptively Education,Pre-Seed,Seed,"$20,000","Nov 7, 2021",Adaptively Education,Adaptively Education is an e-learning company.,E-Learning,—,"Seattle, Washington, United States, North America",adaptivelyeducation.com/,,"$20,000",Seed,1,Techstars,1
Pre Seed Round - Spice AI,Pre-Seed,Seed,"$1,055,000","Oct 14, 2021",Spice AI,Spice AI removes the complexity of building massive data infrastructure to help developers create the next generation of AI-driven apps.,"Artificial Intelligence, Blockchain, Cloud Data Services, Developer Platform, Machine Learning, Software",—,"Seattle, Washington, United States, North America",spice.xyz,,"$14,555,000",Seed,2,—,13
Seed Round - Givsum,Seed,Seed,"$2,000,000","Nov 5, 2021",Givsum,Givsum is a comprehensive management and engagement platform that manages their organization’s operations and fundraising efforts.,"CRM, Crowdfunding, Database, Events, Information Technology, Non Profit, Software",—,"Costa Mesa, California, United States, North America",www.givsum.com,,"$3,831,640",Seed,5,SteelBridge Laboratories,1
Seed Round - Able,Seed,Seed,"$3,290,000","Oct 28, 2021",Able,Able is a mobile app that allows the users to manage their income.,FinTech,—,"San Jose, California, United States, North America",www.able.com/,,"$3,290,000",Seed,1,Elefund,14
Seed Round - Martie,Seed,Seed,"$3,000,000","Nov 2, 2021",Martie,Martie diverts perfectly good surplus pantry staples from going to landfills and delivers them directly to customers.,"Delivery, Food and Beverage, Grocery, Retail",—,"Burlingame, California, United States, North America",martie.com/,,"$3,000,000",Seed,1,Upfront Ventures,1
Pre Seed Round - Kidas,Pre-Seed,Seed,"$2,000,000","Nov 11, 2021",Kidas,Kidas analyzes all communications on children's gaming console and alerts parents about potentially dangerous activities in video games.,"Child Care, Children, Console Games, Cyber Security, Information Technology",—,"Philadelphia, Pennsylvania, United States, North America",www.kidas.net/,,"$2,120,000",—,3,—,5
Pre Seed Round - Muncho,Pre-Seed,Seed,"$500,000","Nov 1, 2021",Muncho,Pizza cooked en-route to your door & delivered in as little as 5 minutes. Currently piloting in Philadelphia.,"Food and Beverage, Food Delivery, Hardware, Robotics, Transportation",—,"Philadelphia, Pennsylvania, United States, North America",www.muncho.com,,"$500,000",Seed,1,Robert G. Yablunsky,1
Seed Round - Corscans,Seed,Seed,"$40,000","Nov 3, 2021",Corscans,CorScans is a healthcare organization that operates a healthcare platform that bridges the gap between doctors and their patients.,"Health Care, Health Diagnostics, Medical, Wellness",—,"Boulder, Colorado, United States, North America",corscans.com/,,"$40,000",Seed,1,—,—
Pre Seed Round - PatientGenie,Pre-Seed,Seed,"$750,000","Oct 15, 2021",PatientGenie,PatientGenie is a private search engine for healthcare.,Health Care,—,"Austin, Texas, United States, North America",www.patientgenie.com/,,"$750,000",Seed,1,—,—
Seed Round - qBotica,Seed,Seed,"$1,000,000","Oct 27, 2021",qBotica,"Robotics Process Automation, Machine Learning, Artificial Intelligence (AI)","Artificial Intelligence, Information Technology, Machine Learning, Product Research, Robotics, SaaS, Software","South Asian Founded, South Asian Led","Phoenix, Arizona, United States, North America",www.qbotica.com,,"$1,000,000",Seed,1,Peacock Ventures,1
Seed Round - LSX Capital Management,Seed,Seed,"$590,000","Oct 18, 2021",LSX Capital Management,LSX Capital Management offers custom life settlement portfolios for clients seeking diversification through this non-correlated asset class.,"Advice, Finance, Financial Services",—,"Pompano Beach, Florida, United States, North America",lsxcapital.wpengine.com/,,"$955,000",Seed,3,—,—
Pre Seed Round - Flat,Pre-Seed,Seed,"$1,000,000","Nov 9, 2021",Flat,Flat is a teamwork application that helps to collaborate and stay organized.,Software,—,"New York, New York, United States, North America",flat.app,,"$1,000,000",Seed,1,NextView Ventures,4
Seed Round - Let's Enhance,Seed,Seed,"$3,000,000","Oct 27, 2021",Let's Enhance,Let's Enhance is a deep-tech company that builds next-gen AI photo management solution for marketplaces.,"Artificial Intelligence, Machine Learning, Photo Editing, Photography","Women Founded, Women Led","San Francisco, California, United States, North America",letsenhance.io/,,"$3,120,000",Seed,4,Chamaeleon,5
Seed Round - Pro Forma,Seed,Seed,"$1,875,000","Nov 9, 2021",Pro Forma,Pro Forma is a business planning financial Excel model that helps entrepreneurs and investors gain full visibility of the business.,"Finance, Financial Services, Information Technology, Software",—,"Southlake, Texas, United States, North America",www.pro-forma.com/,,"$1,875,000",Seed,1,—,—
Seed Round - EscrowTab,Seed,Seed,"$5,000,000","Oct 28, 2021",EscrowTab,EscrowTab is a simple and secure paperless mortgage closing platform.,"Banking, Financial Services, Information Technology, Lending, Software",—,"Tempe, Arizona, United States, North America",escrowtab.com/,,"$5,000,000",Seed,1,—,—
Seed Round - LoudCrowd,Seed,Seed,"$1,500,000","Oct 28, 2021",LoudCrowd,LoudCrowd is a SaaS company redefining the way brands invest and interact with their customers as a tool for growth.,"Analytics, Computer, SaaS",—,"Austin, Texas, United States, North America",www.loudcrowd.com,,"$9,215,000",Early Stage Venture,4,—,—
Seed Round - Aquiline Drones,Seed,Seed,"$1,060,000","Oct 26, 2021",Aquiline Drones,"Aquiline Drones is a drone company that offers UAV solutions with equipment, personnel, and cloud infrastructure for commercial operations.","Aerospace, Commercial, Drones, Internet of Things",—,"Hartford, Connecticut, United States, North America",www.aquilinedrones.com,,"$1,060,000",Seed,1,—,—
Pre Seed Round - Andiamo,Pre-Seed,Seed,"$200,000","Oct 14, 2021",Andiamo,Digital Health For Neuromuscular Conditions,"3D Printing, Assistive Technology, Health Care, Medical Device",—,"Boston, Massachusetts, United States, North America",andiamo.io/,,"$520,000",Seed,3,—,—
Seed Round - Datorios (FMA Metrolink.ai),Seed,Seed,"$22,000,000","Oct 18, 2021",Datorios (FMA Metrolink.ai),Datorios is a tool that provides data teams solutions to address the shortage of data engineers through the use of no-code interfaces.,"Analytics, Big Data, Database, PaaS, Predictive Analytics, SaaS, Software",—,"Palo Alto, California, United States, North America",www.datorios.com,,"$22,000,000",Seed,2,Grove Ventures,2
Seed Round - Autism F.I.R.S.T.,Seed,Seed,"$350,000","Nov 10, 2021",Autism F.I.R.S.T.,"Autism F.I.R.S.T. is an autism therapy practice that provides collaborative treatment, advocacy, and support.","Health Care, Therapeutics, Wellness",—,"Chantilly, Virginia, United States, North America",autismfirstus.com,,"$350,000",Seed,1,—,—
Seed Round - Electives,Seed,Seed,"$2,250,000","Oct 13, 2021",Electives,Electives is an enterprise live learning platform that offers interactive classes for employees.,"EdTech, Information Technology, Training",—,"Boston, Massachusetts, United States, North America",www.electives.io,,"$10,250,000",Early Stage Venture,2,Boston Seed Capital,4
Pre Seed Round - RADICL Defense,Pre-Seed,Seed,"$3,000,000","Nov 9, 2021",RADICL Defense,We secure small and medium sized businesses from nation state level cyberthreats.,Cyber Security,—,"Boulder, Colorado, United States, North America",radicl.io,,"$3,000,000",Seed,1,Access Venture Partners,2
Seed Round - SwiftConnect,Seed,Seed,"$7,000,000","Oct 15, 2021",SwiftConnect,SwiftConnect digitizes the workplace experience by connecting the right people to the right space at the right time.,"Real Estate, Real Time, Software, Virtual Workforce, Web Apps",—,"Stamford, Connecticut, United States, North America",swiftconnect.io,,"$27,000,000",Early Stage Venture,3,"JLL Spark, Navitas Capital",7
Seed Round - Marker Learning,Seed,Seed,"$4,000,000","Nov 2, 2021",Marker Learning,Marker Learning provides a telepsychology platform that makes learning disability assessments and personalized action plans.,"Consulting, EdTech, Education, Health Care",—,"New York, New York, United States, North America",www.getmarkerlearning.com/,,"$19,000,000",Early Stage Venture,2,Primary Venture Partners,5
Pre Seed Round - Included,Pre-Seed,Seed,"$1,900,000","Nov 11, 2021",Included,Included is a platform that drives DEI results at every stage of a company's employee lifecycle.,"Artificial Intelligence, Data Visualization, Human Resources, Machine Learning, SaaS, Software",—,"Bothell, Washington, United States, North America",included.ai/,,"$5,400,000",Seed,3,"Flying Fish Partners, SignalFire",3
Seed Round - Coverlease,Seed,Seed,"$873,860","Oct 28, 2021",Coverlease,Coverlease helps derive trends and insights into commercial real estate markets.,"Analytics, Business Intelligence, Commercial Real Estate",—,"Bayport, Minnesota, United States, North America",coverlease.com/,,"$2,373,860",Seed,3,—,—
Seed Round - FlowPath,Seed,Seed,"$1,200,000","Oct 19, 2021",FlowPath,Facilities Management Simplified,—,—,"Atlanta, Georgia, United States, North America",getflowpath.com/,,"$1,200,000",Seed,1,"Bonfire Ventures, Parade Ventures",3
Seed Round - GoShare,Seed,Seed,"$3,800,000","Oct 27, 2021",GoShare,"GoShare connects truck and van owners with businesses & people who need to move, deliver or haul large items on demand.","Courier Service, Delivery Service, Developer APIs, E-Commerce, Internet, Logistics, Marketplace, Retail, Shipping Broker, Supply Chain Management",—,"San Diego, California, United States, North America",goshare.co,,"$8,000,000",Seed,4,"Cove Fund, Mark IV Capital",9
Seed Round - Laguna Games,Seed,Seed,"$5,000,000","Oct 15, 2021",Laguna Games,Laguna Games is a research and game development studio that specializes in making blockchain tech.,"Gaming, Video Games",—,"San Francisco, California, United States, North America",laguna.games/,,"$5,000,000",Seed,1,"BITKRAFT Ventures, Delphi Ventures",5
Seed Round - Socialays,Seed,Seed,"$500,000","Nov 12, 2021",Socialays,Social Media Management Software,"Apps, Artificial Intelligence, Internet, Marketing, Social Media, Software",—,"San Francisco, California, United States, North America",socialays.com/,,"$500,000",Seed,1,—,—
Seed Round - Better Coliving,Seed,Seed,"$20,000","Nov 8, 2021",Better Coliving,Better Coliving is a type of shared housing that offers affordable housing choices.,"Communities, Real Estate, Residential, Wellness",—,"Oakland, California, United States, North America",www.bettercoliving.com/,,"$20,000",Seed,1,Techstars,1
Seed Round - Culineer,Seed,Seed,"$30,000","Oct 29, 2021",Culineer,A Growth and Retention for the Farm-to-Home table market,"AgTech, Marketing Automation, Mobile Apps, SaaS","Women Founded, Women Led","Harrisburg, Pennsylvania, United States, North America",culineerapp.com,,"$109,650",—,3,—,1
Pre Seed Round - Rivet,Pre-Seed,Seed,"$120,000","Nov 7, 2021",Rivet,"Discover and reward your top fans and build real, lasting communities that you can monetize again and again.","Content Creators, Music",—,"Boston, Massachusetts, United States, North America",www.rivet.app,,"$620,000",Seed,2,Techstars,1
Pre Seed Round - LuvHut,Pre-Seed,Seed,"$75,000","Nov 8, 2021",LuvHut,LuvHut is a Social Meetup platform that connects local people to local HotSpots based on shared availability and interests.,"Dating, Mobile Apps, Reservations, Social Media, Social Network",—,"Boston, Massachusetts, United States, North America",www.theluvhut.com,,"$405,000",Seed,2,—,—
Seed Round - Activeloop,Seed,Seed,"$5,000,000","Nov 2, 2021",Activeloop,Activeloop structures the unstructured data to seamlessly connect your computer vision data to machine learning models.,"Artificial Intelligence, GPU, Machine Learning, Software, Training","Middle Eastern / North African Founded, Middle Eastern / North African Led","San Francisco, California, United States, North America",activeloop.ai,,"$6,100,000",Seed,3,"468 Capital, CM Ventures",7
Pre Seed Round - Corso,Pre-Seed,Seed,"$1,000,000","Nov 9, 2021",Corso,Carbon Offsets & Shipping Protection for E-commerce Merchants,E-Commerce,—,"San Clemente, California, United States, North America",www.corso.com,,"$1,000,000",Seed,1,—,—
Pre Seed Round - MindsDB,Pre-Seed,Seed,"$6,795,000","Nov 1, 2021",MindsDB,MindsDB is an open-source platform that enables developers to integrate machine learning into applications.,"Database, Machine Learning, Open Source, Predictive Analytics, Software","Hispanic / Latine Founded, Hispanic / Latine Led","Berkeley, California, United States, North America",mindsdb.com,,"$54,355,000",Seed,6,OpenOcean,11
Seed Round - Atlys,Seed,Seed,"$4,250,000","Oct 28, 2021",Atlys,Atlys offers an app where users can apply for visas hassle-free.,"Software, Travel",—,"San Francisco, California, United States, North America",www.atlys.com/,,"$16,250,000",—,2,Andreessen Horowitz,8
Seed Round - Ombre,Seed,Seed,"$3,000,000","Nov 1, 2021",Ombre,Ombre is a provider of a microbiome testing kit designed to incorporate personalized probiotics and microbiome testing.,"Dietary Supplements, Health Care, Wellness",Women Led,"San Francisco, California, United States, North America",www.ombrelab.com/,,"$8,400,000",Seed,6,PivotNorth Capital,6
Pre Seed Round - Wreckingball,Pre-Seed,Seed,"$10,000","Oct 25, 2021",Wreckingball,Wreckingball's Safety Now provides safety orientation for commercial construction industry.,"Construction, Software",—,"Wilmington, North Carolina, United States, North America",wreckingball.systems,,"$10,000",Seed,1,—,1
Seed Round - InEvent,Seed,Seed,"$1,000,000","Nov 10, 2021",InEvent,"Virtual and in-person corporate events, meetings and conferences","Apps, Enterprise Software, Event Management, Information Technology, Internet, SaaS, Software","Black / African American Founded, Hispanic / Latine Founded, Hispanic / Latine Led","Atlanta, Georgia, United States, North America",inevent.com/,,"$4,000,000",Seed,3,TRAC,1
Pre Seed Round - MyFitPod,Pre-Seed,Seed,"$730,000","Nov 8, 2021",MyFitPod,MyFitPod is a software company that provides automated systems and turnkey tools for fitness professionals.,"Fitness, Health Care, Software, Sports, Wellness","Women Founded, Women Led","Lawrenceville, New Jersey, United States, North America",www.myfitpod.com,,"$730,000",Seed,1,Techstars,1
Seed Round - Reactive Medical Labs,Seed,Seed,"$732,477","Oct 14, 2021",Reactive Medical Labs,Reactive Medical Labs is a biotechnology company developing regenerative skincare applications.,"Beauty, Biopharma, Biotechnology, Pharmaceutical",—,"San Jose, California, United States, North America",www.reactivemedical.com,,"$732,477",Seed,1,—,—
Seed Round - HeyTutor,Seed,Seed,"$1,500,000","Oct 22, 2021",HeyTutor,"HeyTutor is an online platform that allows students, tutors, and agencies to connect in real-time.","E-Learning, EdTech, Education, Online Portals, Tutoring",—,"Beverly Hills, California, United States, North America",www.heytutor.com,,"$3,150,000",Seed,3,—,1
Pre Seed Round - Parcel Health,Pre-Seed,Seed,"$150,000","Nov 11, 2021",Parcel Health,Parcel Health provides sustainable medication packaging for the pharmaceutical industry.,Health Care,"Southeast Asian Founded, Southeast Asian Led, Women Founded, Women Led","Pittsburgh, Pennsylvania, United States, North America",www.parcelhealth.co,,"$677,000",Seed,4,—,2
Pre Seed Round - Soulber,Pre-Seed,Seed,"$150,000","Oct 20, 2021",Soulber,Soulber is an application designed to help recovering addicts and reintegrate them back into society.,"Health Care, Information Technology, Software",—,"Champlain, New York, United States, North America",,,"$150,000",Seed,1,—,—
Pre Seed Round - Mustard,Pre-Seed,Seed,"$1,000,000","Nov 9, 2021",Mustard,Mustard is a video commerce app for foodies and restaurants.,E-Commerce,"Women Founded, Women Led","Los Angeles, California, United States, North America",www.mustard.love/,,"$1,000,000",Seed,2,—,4
Seed Round - Serverli,Seed,Seed,"$750,000","Nov 4, 2021",Serverli,"Monitor and configure all security and IOT devices on your network to optimize your awareness, insight, and performance.","Information Technology, SaaS, Security, Software",—,"Winter Garden, Florida, United States, North America",www.serverli.com/,,"$750,000",Seed,1,—,—
Seed Round - Guardians Collective,Seed,Seed,"$3,500,000","Nov 4, 2021",Guardians Collective,Guardians Collective provides a community platform for parenting.,"Communities, Parenting, Social","South Asian Founded, South Asian Led","San Francisco, California, United States, North America",www.aboutgc.com/,,"$3,500,000",Seed,2,Reach Capital,3
Seed Round - Pause Well-Aging,Seed,Seed,"$3,000,000","Oct 27, 2021",Pause Well-Aging,Pause Well-Aging is a skincare product based company.,"Consumer Goods, Cosmetics",—,"New York, New York, United States, North America",pausewellaging.com/,,"$7,657,428",—,2,Swiftarc Ventures,2
Seed Round - Virtanza,Seed,Seed,"$209,000","Nov 8, 2021",Virtanza,Virtanza partners with universities and employers to provide learners sales and technology upskilling to job placement.,"E-Learning, Internet","Women Founded, Women Led","Laguna Niguel, California, United States, North America",virtanza.com/,,"$1,653,902",Seed,4,—,—
Seed Round - Brewsy,Seed,Seed,"$1,020,007","Nov 4, 2021",Brewsy,Brewsy develops physical and digital products to spread the joys of home-fermentation.,"Brewing, Wine And Spirits, Winery",—,"New Orleans, Louisiana, United States, North America",getbrewsy.com,,"$1,270,007",Seed,2,Callais Capital,1
Seed Round - Omni Creator Products,Seed,Seed,"$4,300,000","Nov 2, 2021",Omni Creator Products,Omni Creator Products empower every player to become a creator.,Gaming,—,"Raleigh, North Carolina, United States, North America",ocp.gg,,"$20,550,000",Early Stage Venture,2,Upfront Ventures,4
Pre Seed Round - HiLink,Pre-Seed,Seed,"$1,000,000","Oct 25, 2021",HiLink,"A connected, interactive, and engaging digital world","EdTech, Software",—,"Chicago, Illinois, United States, North America",www.hilink.co/,,"$4,000,000",Seed,2,—,—
Seed Round - Assiduus Global,Seed,Seed,"$1,000,000","Nov 5, 2021",Assiduus Global,Assiduus Global is a full service E-Commerce management company.,E-Commerce,"Women Founded, Women Led","Wilmington, Delaware, United States, North America",www.assiduusglobal.com/,,"$17,000,000",Early Stage Venture,4,9Unicorns Accelerator Fund,1
Seed Round - Sagetap,Seed,Seed,"$4,500,000","Oct 15, 2021",Sagetap,Help enterprise software vendors build better products,"Information Technology, Market Research, Software",—,"San Francisco, California, United States, North America",www.sagetap.io,,"$5,700,000",Seed,2,NFX,3
Seed Round - Entry,Seed,Seed,"$500,000","Oct 18, 2021",Entry,Biometric sign in and identity verification platform,Software,—,"San Francisco, California, United States, North America",getentry.com/,,"$2,620,000",Seed,5,—,2
Seed Round - Spaced Ventures,Seed,Seed,"$1,200,000","Oct 14, 2021",Spaced Ventures,Spaced Ventures is a public investment platform for the space industry.,"Finance, FinTech, Impact Investing, Venture Capital",—,"Cape Canaveral, Florida, United States, North America",www.spacedventures.com,,"$1,350,000",—,4,WorldQuant Ventures LLC,2
Seed Round - Ando Money,Seed,Seed,"$6,000,000","Oct 21, 2021",Ando Money,Ando Money enables customers to join and drive a transformative movement to combat the climate crisis through carbon-reducing banking.,"Banking, Financial Services, FinTech, Impact Investing",—,"San Diego, California, United States, North America",www.andomoney.com,,"$6,000,000",Seed,1,TTV Capital,3
Seed Round - RevOps,Seed,Seed,"$5,000,000","Oct 19, 2021",RevOps,"RevOps, a CPQ company made for Software Businesses, helps Sales close deals faster with automation in the buying process.","B2B, Consulting, Information Technology, Marketing, Software",Hispanic / Latine Founded,"San Francisco, California, United States, North America",www.revops.io,,"$6,600,000",Seed,2,"Caffeinated Capital, Coatue, Gradient Ventures",4
Seed Round - Healthee,Seed,Seed,"$22,000,000","Oct 19, 2021",Healthee,Healthee is an AI-powered digital platform that allows employees to utilize their health and wellness benefits.,"Artificial Intelligence, Consulting, Fitness, Health Care, InsurTech, Medical, Wellness",—,"New York, New York, United States, North America",healthee.co,,"$23,500,000",Seed,4,Group 11,4
Seed Round - ForecastEra,Seed,Seed,"$4,500,000","Oct 20, 2021",ForecastEra,Solutions to consistently meet growth objectives by transforming Core Sales and Finance processes with Cloud based SaaS and AI applications,"Artificial Intelligence, Business Intelligence, CRM, Enterprise Applications, Enterprise Software, Finance, FinTech, Sales Automation, Software",—,"Reston, Virginia, United States, North America",forecastera.com/,,"$4,500,000",Seed,1,Ringbolt Capital,1
Pre Seed Round - AIPEX Technologies,Pre-Seed,Seed,"$500,000","Oct 18, 2021",AIPEX Technologies,AIPEX brings voice technology to living spaces. Customers use it to connect with their guests and residents in ways not previously possible.,"Artificial Intelligence, Assistive Technology, Hospitality, Knowledge Management, Natural Language Processing, SaaS",—,"Seattle, Washington, United States, North America",www.aipextech.com,,"$810,000",Seed,3,—,—
Seed Round - NOCAP Sports,Seed,Seed,"$2,500,000","Nov 10, 2021",NOCAP Sports,"Premier name, image and likeness (NIL) platform helping brands execute athlete marketing campaigns at scale","Creative Agency, Marketing, SaaS, Sponsorship, Sports",—,"Philadelphia, Pennsylvania, United States, North America",nocapsports.io,,"$2,500,000",Seed,1,Florida Funders,11
Seed Round - Struxtion,Seed,Seed,"$5,500,000","Nov 1, 2021",Struxtion,Struxtion provides undeserved commercial construction contractors.,Construction,—,"Cincinnati, Ohio, United States, North America",struxtion.com/,,"$5,500,000",Seed,1,North American Properties,4
