Seed Round - Volt Protocol,Seed,Seed,"$2,000,000","Apr 11, 2022",Volt Protocol,VOLT is a natively yield bearing digital currency built on Ethereum.,"Blockchain, Cryptocurrency",—,"San Francisco, California, United States, North America",www.voltprotocol.io,,"$2,000,000",Seed,1,"Framework Ventures, Nascent",2
Pre Seed Round - Breeze,Pre-Seed,Seed,"$50,000","Apr 4, 2022",Breeze,"SaaS, Circular Sustainability","Information Technology, Software, Sustainability",—,"Los Angeles, California, United States, North America",mybreezebox.com,,"$50,000",Seed,1,—,—
Seed Round - HacWare,Seed,Seed,"$2,300,000","Apr 12, 2022",HacWare,Hacware is an A.I. driven Email Security Awareness product that help lean IT teams combat phishing attacks through experiential learning.,"Cyber Security, Email, Enterprise Software, SaaS, Software, Software Engineering","Women Founded, Women Led","Dover, Delaware, United States, North America",hacware.com/,,"$2,420,000",Seed,2,Elevate Capital,4
Seed Round - Digital Prime Technologies,Seed,Seed,"$325,000","Apr 5, 2022",Digital Prime Technologies,Digital Prime Technologies is a provider of customizable prime brokerage technology solutions for financial institutions.,"Cryptocurrency, Financial Services, Lending, Risk Management",—,"New York, New York, United States, North America",digitalprimetechnologies.com/,,"$1,942,500",—,9,—,—
Pre Seed Round - Tatem,Pre-Seed,Seed,"$2,500,000","Apr 1, 2022",Tatem,"Meet Tatem, the productivity company. We make intelligent software designed to get you through your work, faster.","Internet, Software",—,"Los Angeles, California, United States, North America",www.tatem.com/,,"$2,500,000",Seed,1,Caffeinated Capital,3
Seed Round - Nomad,Seed,Seed,"$22,400,000","Apr 12, 2022",Nomad,Nomad is a optimistic cross-chain communication.,"Blockchain, Cryptocurrency",—,"San Francisco, California, United States, North America",www.nomad.xyz,,"$22,400,000",—,2,Polychain,28
Seed Round - Paper,Seed,Seed,"$7,300,000","May 10, 2022",Paper,Paper is a NFT payment startup that offers crypto-focused payments.,"Finance, Payments, Software",—,"San Francisco, California, United States, North America",withpaper.com,,"$9,300,000",M&A,3,"Electric Capital, Initialized Capital",8
Pre Seed Round - Taelor,Pre-Seed,Seed,"$2,300,000","Apr 28, 2022",Taelor,Taelor helps busy men look good without the commitment of buying clothes. AI-powered menswear rental subscription service in the U.S.,"E-Commerce, Fashion, Rental, Retail, Sharing Economy","East Asian Founded, Women Founded, Women Led","San Francisco, California, United States, North America",taelor.style/,,"$2,300,000",Seed,2,Bling Capital,5
Pre Seed Round - Stack,Pre-Seed,Seed,"$100,000","Mar 21, 2022",Stack,Stack is the gamified crypto investment platform specifically built for Gen-Z.,Cryptocurrency,—,"Kirkland, Washington, United States, North America",www.trystack.io,,"$5,800,000",Seed,5,Madrona Venture Labs,1
Seed Round - The Sonar Company,Seed,Seed,"$1,372,344","Apr 11, 2022",The Sonar Company,"The Sonar Company uses proprietary technology, consisting of high-frequency tones triggering actions and delivering content to cell phones.","B2B, Information Technology, Software",—,"San Antonio, Texas, United States, North America",thesonarcompany.com/,,"$1,772,344",Seed,2,—,—
Seed Round - MergersCorp M&A International,Seed,Seed,"$200,000","Mar 21, 2022",MergersCorp M&A International,At MergersCorp™ M&A International we help our global clients confidentially buy and sell privately held businesses.,"Banking, Consulting, E-Commerce, Finance, Financial Services, Management Consulting, Venture Capital",—,"New York, New York, United States, North America",www.mergerscorp.com,,"$300,000",Seed,2,—,—
Seed Round - Cartwheel,Seed,Seed,"$3,000,000","Apr 28, 2022",Cartwheel,"Cartwheel specializes in delivery management software for in-house, outsourced, and hybrid deliveries.","Delivery, Enterprise Software, Software",—,"Los Angeles, California, United States, North America",trycartwheel.com,,"$4,000,000",Seed,2,Moonshots Capital,5
Seed Round - Elastics.cloud,Seed,Seed,"$17,000,000","Apr 14, 2022",Elastics.cloud,Elastics.cloud is a Smart Interconnect technology company focused on enabling efficient and performant architectures.,Semiconductor,—,"San Jose, California, United States, North America",elastics.cloud/,,"$23,000,000",Seed,3,—,—
Seed Round - Backflip,Seed,Seed,"$8,000,000","May 6, 2022",Backflip,Backflip is a proptech fintech firm that enables real estate entrepreneurs to enhance local communities by revitalizing housing.,"FinTech, iOS, Real Estate Investment",—,"Denver, Colorado, United States, North America",dobackflip.com/,,"$35,265,000",Seed,3,"LiveOak Venture Partners, Vertical Venture Partners",5
Seed Round - Waitroom,Seed,Seed,"$3,000,000","Mar 23, 2022",Waitroom,Waitroom is an AI video conferencing tool,"Enterprise Software, Video Conferencing, Video Streaming",—,"La Jolla, California, United States, North America",waitroom.com,,"$3,000,000",Seed,1,David O. Sacks,10
Seed Round - Smart Apply,Seed,Seed,"$1,300,000","May 10, 2022",Smart Apply,Smart Apply develops a density-based sprayer technology that cuts pesticides with less waste and higher yields.,"Agriculture, AgTech, CleanTech",—,"Indianapolis, Indiana, United States, North America",www.smartapply.com,,"$5,908,913",M&A,3,VisionTech Partners,4
Pre Seed Round - BinIt,Pre-Seed,Seed,"$2,000,000","Apr 28, 2022",BinIt,BinIt is working to bring the power of data-driven decision making to waste management.,"Software, Waste Management",—,"New York, New York, United States, North America",binit.ai/,,"$2,025,000",Seed,2,—,—
Seed Round - ESCRYPTO,Seed,Seed,"$2,250,000","May 5, 2022",ESCRYPTO,ESCRYPTO is a crypto payment system company that offers solutions for blockchain transactions.,"Blockchain, Cryptocurrency, Financial Services, Virtual Currency",—,"Miami, Florida, United States, North America",escrypto.com,,"$2,250,000",Seed,1,—,—
Seed Round - Hometown Workforce,Seed,Seed,"$39,000","Apr 28, 2022",Hometown Workforce,Our technology provide consumers with true on-demand access to services while simultaneously running the contractor's entire business.,"Construction, Software, Training",—,"Biloxi, Mississippi, United States, North America",www.wfskills.com,,"$46,500",Seed,2,—,—
Pre Seed Round - Rememery,Pre-Seed,Seed,"$220,000","May 6, 2022",Rememery,Rememery is a digital scrapbooking app for users.,"Apps, Funerals, Photo Sharing, Social Network, Software",—,"Newbury, Massachusetts, United States, North America",www.rememery.com,,"$220,000",Seed,2,—,—
Seed Round - JetSweep,Seed,Seed,"$490,000","Apr 1, 2022",JetSweep,JetSweep is a consulting agency that renders cloud enablement solutions and modernized data architectures to organizations.,"Cloud Computing, Consulting, IT Management",—,"Chelmsford, Massachusetts, United States, North America",jetsweep.co/,,"$490,000",Seed,1,—,—
Seed Round - EcoSapiens,Seed,Seed,"$1,500,000","May 11, 2022",EcoSapiens,Ecosapiens is a Web3/NFT project enabling consumers to make a positive impact on the climate.,—,—,"San Francisco, California, United States, North America",www.ecosapiens.xyz,,"$5,000,000",Seed,2,Boost VC,10
Seed Round - Pivotal Battery,Seed,Seed,"$480,000","Apr 28, 2022",Pivotal Battery,Pivotal Battery focuses on improving the current lead-acid technologies.,"Battery, Industrial, Manufacturing",—,"Scottsdale, Arizona, United States, North America",www.pivotalbattery.com,,"$480,000",Seed,1,—,—
Seed Round - Delta Thermal,Seed,Seed,"$150,000","Apr 8, 2022",Delta Thermal,Delta Thermal develops thermal imaging systems that automatically detect changes in human and hardware temperature.,"Analytics, Cloud Data Services, Information Technology",—,"Tucson, Arizona, United States, North America",deltathermalinc.com/,,"$150,000",Seed,1,—,—
Pre Seed Round - Hourspent,Pre-Seed,Seed,"$300,000","May 3, 2022",Hourspent,"We build great software pioneering simple ways of working, access to the right talents, opportunities, and tools needed to thrive.","E-Signature, Enterprise Applications, Enterprise Software, Freelance, Payments, Productivity Tools, Project Management, Virtual Workforce",Women Founded,"Newark, Delaware, United States, North America",hourspent.com,,"$303,000",Seed,2,—,—
Seed Round - 6dgrs,Seed,Seed,"$50,000","Apr 13, 2022",6dgrs,6DGRS is a relationship platform that leverages your network to match you with vetted singles.,"Apps, Dating, Software",—,"Houston, Texas, United States, North America",www.6dgrs.co/,,"$50,000",Seed,1,AccelerateBaltimore,1
Pre Seed Round - HIFI Bridge,Pre-Seed,Seed,"$200,000","May 15, 2022",HIFI Bridge,HiFi Bridge is an embedded payments software that powers commerce by enabling merchants and users to transact with digital assets.,"Cryptocurrency, FinTech, Payments",—,"New York, New York, United States, North America",Hifibridge.com,,"$375,000",Seed,2,—,—
Pre Seed Round - BioFluff,Pre-Seed,Seed,"$115,000","Apr 15, 2022",BioFluff,BioFluff develops plant-based fur to support the fashion industry and replace animal and plastic fur.,"Fashion, Manufacturing, Textiles",Women Led,"Oakland, California, United States, North America",bio-fluff.com,,"$665,000",Seed,3,—,—
Seed Round - Logseq,Seed,Seed,"$4,100,000","May 5, 2022",Logseq,Logseq is an open-source knowledge management tool used to write and connect any type of text-based note.,"Education, Knowledge Management, Software",—,"New York, New York, United States, North America",logseq.com/,,"$4,100,000",Seed,1,"Nat Friedman, Tobias Lütke",12
Seed Round - BreachLock Inc.,Seed,Seed,"$3,000,000","Mar 27, 2022",BreachLock Inc.,Pen Testing as A Service (PTaaS) | World's first full stack PTaaS powered by Certified Hackers and AI,"Artificial Intelligence, Cyber Security, SaaS",—,"New York, New York, United States, North America",www.breachlock.com,,"$3,100,000",Seed,2,TIIN Capital,1
Seed Round - Mushroom Design,Seed,Seed,"$515,000","Apr 21, 2022",Mushroom Design,Mushroom Design is consumer-friendly biotech company utilizing science and biotech to bring functional mushrooms to the masses.,Biotechnology,—,"North Miami Beach, Florida, United States, North America",mushroomdesign.com/,,"$515,000",Seed,1,—,—
Pre Seed Round - Imot.io,Pre-Seed,Seed,"$700,000","Apr 16, 2022",Imot.io,"Imot.io analyses calls, identifies inefficient employees, and increases sales.","Artificial Intelligence, CRM, Sales, Sales Automation, Software, Speech Recognition",—,"Delaware City, Delaware, United States, North America",imot.io,,"$700,000",Seed,1,NuVX Capital,1
Seed Round - ATHLYT,Seed,Seed,"$775,000","Mar 29, 2022",ATHLYT,"ATHLYT is a college athlete name, image, likeness (NIL) marketing tech platform","Information Technology, Marketing, Software",—,"Boise, Idaho, United States, North America",www.athlyt.co/,,"$775,000",Seed,1,—,—
Pre Seed Round - Realthy,Pre-Seed,Seed,"€500,000","Apr 12, 2022",Realthy,Realthy is a vetted online resource that provides value for real estate professionals.,"Communities, Real Estate",—,"Oakland, California, United States, North America",realthy.io/,,"€500,000",M&A,1,—,—
Pre Seed Round - Loloft,Pre-Seed,Seed,"$1,000,000","Mar 24, 2022",Loloft,Loloft combines office space and micro-warehousing for companies that need space to handle physical goods.,—,—,"Rogers, Arkansas, United States, North America",www.loloft.com/,,"$1,000,000",—,2,Revolution’s Rise of the Rest Seed Fund,2
Seed Round - Dollarize,Seed,Seed,"$1,000","Apr 15, 2022",Dollarize,Dollarize allows foreign nationals to have access to a US dollars account to protect themselves from devaluation of their currency.,"Banking, Financial Services, FinTech",—,"New York, New York, United States, North America",dollarize.me/,,"$2,585,997",—,2,—,—
Pre Seed Round - Plazmod,Pre-Seed,Seed,"$220,000","May 5, 2022",Plazmod,Manufacturing,Manufacturing,South Asian Founded,"New Haven, Connecticut, United States, North America",plazmod.net,,"$220,000",Seed,2,—,1
Seed Round - Line,Seed,Seed,"$7,000,000","May 2, 2022",Line,"Line is a subscription-based revolving line of credit available without credit-history, pay-slips, or credit-scores.","Credit, Finance, Financial Services, FinTech, Lending",—,"San Francisco, California, United States, North America",useline.com,,"$27,150,000",Seed,6,Massive,15
Pre Seed Round - blindnet,Pre-Seed,Seed,"$1,300,000","Apr 15, 2022",blindnet,Blindnet is a startup building next-generation data privacy and security solutions.,Software,—,"New York, New York, United States, North America",www.blindnet.io,,"$1,300,000",Seed,4,Elaia,1
Seed Round - Configo Health,Seed,Seed,"$2,000,000","Apr 26, 2022",Configo Health,Configo Health provides analytical tools and services for pediatric hospitals.,"Analytics, Health Care, Hospital, Predictive Analytics, Real Time",—,"Arlington, Virginia, United States, North America",www.configohealth.com,,"$2,800,000",Seed,2,Pisgah Fund,1
Seed Round - Spark Green Homes,Seed,Seed,"$500,002","Mar 21, 2022",Spark Green Homes,Spark Green Homes provides a PropTech platform to simplify and maximize solar home transactions.,"Home Services, Information Technology, Property Management",—,"Tempe, Arizona, United States, North America",sparkgreenhomes.com/,,"$500,002",Seed,1,—,—
Pre Seed Round - Omnia,Pre-Seed,Seed,"$25,000","Apr 1, 2022",Omnia,"Share, Create, Discover Augmented Reality (AR) Work","Augmented Reality, Information Services, Software",—,"Chicago, Illinois, United States, North America",www.theomnia.io,,"$85,000",Seed,3,—,—
Seed Round - Tactic,Seed,Seed,"$2,600,000","May 4, 2022",Tactic,Tactic is the crypto accounting platform that's built to save businesses time.,"Cryptocurrency, FinTech, Software",—,"New York, New York, United States, North America",www.tactic.com/,,"$13,600,000",M&A,2,"Founders Fund, Ramp",4
Seed Round - Transpose,Seed,Seed,"$3,000,000","Mar 28, 2022",Transpose,Transpose is a Web3 data and infrastructure startup.,"Blockchain, Developer APIs, Ethereum, Information Technology, Software",—,"New York, New York, United States, North America",transpose.io,,"$3,000,000",M&A,1,"MaC Venture Capital, Soma Capital",7
Seed Round - Playhouse,Seed,Seed,"$2,800,000","Apr 5, 2022",Playhouse,Playhouse is a proprietary mobile applications that enables users to view and browse real-estate listing.,"Internet, Real Estate, Rental Property",—,"San Francisco, California, United States, North America",www.playhouse.so,,"$2,925,000",Seed,3,—,6
Pre Seed Round - Boona,Pre-Seed,Seed,"$525,000","Apr 23, 2022",Boona,Boona is a retail shopping technology company for health products.,Home Improvement,—,"Seattle, Washington, United States, North America",boona.com/,,"$525,000",Seed,1,—,1
"Seed Round - SucceedSmart, Inc.",Seed,Seed,"$6,000,000","Mar 24, 2022","SucceedSmart, Inc.","Disrupting the traditional Executive Search. We offer a faster, better, affordable and inclusive platform for Director and above hiring.",Employment,—,"Los Altos, California, United States, North America",succeedsmart.com/,,"$6,000,000",Seed,1,Storm Ventures,1
Seed Round - Docsnap,Seed,Seed,"$225,000","Apr 12, 2022",Docsnap,"Docsnap is an application software that helps to collect, store and access the health record information of individuals and families.","Apps, Health Care, Software",—,"Atlanta, Georgia, United States, North America",docsnap.com/,,"$225,000",Seed,1,—,—
Seed Round - Ugami,Seed,Seed,"$4,800,000","Apr 12, 2022",Ugami,"Ugami provides financial solutions and rewards for gamers that can be used in gaming merchandise, digital goods, hardware, and software.","Credit Cards, Financial Services, Gaming, Software",Hispanic / Latine Founded,"Miami, Florida, United States, North America",www.ugami.com,,"$4,800,000",—,3,"Harlem Capital Partners, Ulu Ventures",5
Pre Seed Round - CallScaler,Pre-Seed,Seed,"$120,000","May 9, 2022",CallScaler,CallScaler provides call tracking tool to help businesses track and route inbound calls for their business.,"Analytics, Call Center, Enterprise Software, Software",—,"Denver, Colorado, United States, North America",callscaler.com/,,"$120,000",Seed,1,TinySeed,1
Pre Seed Round - Effectiv,Pre-Seed,Seed,"$4,060,000","Mar 29, 2022",Effectiv,Fraud detection platform for financial institutions,"Analytics, FinTech",—,"San Francisco, California, United States, North America",effectiv.ai,,"$9,560,000",Seed,3,Accel,2
Pre Seed Round - Wink,Pre-Seed,Seed,"$2,850,000","May 10, 2022",Wink,Wink’s biometric identity and payments platform is a SaaS solution that enables passwordless authentication and handsfree™ payments.,"Artificial Intelligence, Biometrics, FinTech, Machine Learning, Payments, Retail Technology, SaaS",—,"Plano, Texas, United States, North America",www.wink.cloud/,,"$5,850,000",Seed,2,"Carneros Bay Capital, CerraCap Ventures",3
Pre Seed Round - Range,Pre-Seed,Seed,"$1,095,000","May 15, 2022",Range,Range is a collaboration platform that visually organizes the world’s work - by location.,"Architecture, B2B, CAD, Collaboration, Construction, Geospatial, Property Management, Real Estate, SaaS, Software",—,"Redwood City, California, United States, North America",www.range.io,,"$1,095,000",Seed,1,—,—
Pre Seed Round - Charta,Pre-Seed,Seed,"$500,000","May 1, 2022",Charta,Charta is a consumer legal SaaS that translates the whole contract process into plain English.,"Consumer Software, Data Mining, Legal, Legal Tech, SaaS, Software",Middle Eastern / North African Led,"El Segundo, California, United States, North America",getcharta.com,,"$500,000",Seed,1,—,—
Seed Round - Sampling Human,Seed,Seed,"$2,000,000","Apr 12, 2022",Sampling Human,On a mission to elevate societal health with living diagnostics.,"Big Data, Bioinformatics, Biotechnology, Health Care, Health Diagnostics",—,"Berkeley, California, United States, North America",samplinghuman.com,,"$3,700,000",Seed,3,i&i Biotech Fund,3
Seed Round - Yearly,Seed,Seed,"$180,000","Mar 25, 2022",Yearly,"Yearly provides nonprofits with an online tool to make stunning, digital reports.","Marketing, Presentation Software, Software",—,"Bethesda, Maryland, United States, North America",yearly.report,,"$180,000",Seed,1,—,—
Seed Round - Angelic,Seed,Seed,"$10,000,000","Mar 25, 2022",Angelic,Angelic is a narrative multiplayer strategy RPG backed by the blockchain.,"Blockchain, Gaming, Video Games",—,"Saint Petersburg, Florida, United States, North America",angelicthegame.com/,,"$10,000,000",—,3,—,5
Seed Round - Zephyr AI,Seed,Seed,"$18,500,000","Mar 30, 2022",Zephyr AI,Zephyr AI is the world’s most cutting-edge algorithms for advancing human health.,"Artificial Intelligence, Biotechnology",—,"Fairfax Station, Virginia, United States, North America",www.zephyrai.bio/,,"$18,500,000",Seed,1,"Lerner Enterprises, M-Cor Holdings",6
Pre Seed Round - Revioly,Pre-Seed,Seed,"$175,000","Apr 1, 2022",Revioly,Revioly is an AI shopping assistant that helps consumers make informed purchasing decisions.,"Artificial Intelligence, Big Data, Consumer Reviews, Consumer Software, E-Commerce, Machine Learning, Marketing, Natural Language Processing",—,"San Mateo, California, United States, North America",revioly.com,,"$785,000",Seed,4,—,—
Seed Round - GGWP,Seed,Seed,"$12,000,000","Mar 21, 2022",GGWP,GGWP provides a gaming tool to help reduce toxic and disruptive in the game.,"Gaming, Information Technology, Productivity Tools",—,"San Francisco, California, United States, North America",www.ggwp.com,,"$22,000,000",—,3,BITKRAFT Ventures,10
Pre Seed Round - Auxxit,Pre-Seed,Seed,"$105,000","Mar 31, 2022",Auxxit,Auxxit is a next-generation digital marketplace platform that leverages the engaging experiences of real-time group chat and live streaming.,"E-Commerce, E-Commerce Platforms, Marketplace, Mobile Apps, Social Media","Hispanic / Latine Founded, Women Founded","Denver, Colorado, United States, North America",www.auxxit.com/,,"$1,240,000",—,5,—,—
Seed Round - Ryse Health,Seed,Seed,"$3,400,000","Apr 8, 2022",Ryse Health,Ryse Health is a hybrid brick-and-mortar and virtual care model serving patients with chronic disease.,"Health Care, Medical, Personal Health",—,"Arlington, Virginia, United States, North America",www.rysehealth.com/,,"$9,900,000",Early Stage Venture,2,W Health Ventures,10
Seed Round - Gated,Seed,Seed,"$3,300,000","Mar 22, 2022",Gated,Gated reduces unwanted email and benefits charity - by challenging unknown senders to donate to reach your inbox.,"Email, Information Technology, Productivity Tools, Software",—,"San Mateo, California, United States, North America",www.gated.com,,"$3,300,000",Seed,1,Corazon Capital,4
Pre Seed Round - Allermi,Pre-Seed,Seed,"$1,250,000","May 10, 2022",Allermi,"Allermi offers direct delivery of customized prescription allergy medications, designed and formulated by world-class allergists.","Health Care, Wellness","Women Founded, Women Led","San Francisco, California, United States, North America",www.allermi.com,,"$4,750,000",Seed,2,Lucas Venture Group,1
Seed Round - Major League Pickleball,Seed,Seed,"$500,000","Mar 22, 2022",Major League Pickleball,Major League Pickleball operates as a provider of professional pickleball content.,"News, Recreation, Sports",—,"Austin, Texas, United States, North America",www.majorleaguepickleball.net/,,"$500,000",Seed,1,—,—
Seed Round - Biller Genie,Seed,Seed,"$1,000,000","Apr 13, 2022",Biller Genie,Biller Genie provides an automated cloud-based A/R platform that integrates existing business processes for small and mid-sized businesses.,"Accounting, Financial Services, FinTech, Payments",—,"Miami, Florida, United States, North America",www.billergenie.com/,,"$9,500,000",Early Stage Venture,3,Henry Helgeson,5
Seed Round - Steady Install,Seed,Seed,"$100,000","Apr 15, 2022",Steady Install,Steady Install is a B2B labor marketplace that assists office furniture installation companies in project staffing.,"Employment, Facilities Support Services, Furniture",—,"Phoenix, Arizona, United States, North America",www.steadyinstall.com,,"$500,000",Seed,3,—,—
Pre Seed Round - Blink Date,Pre-Seed,Seed,"$225,000","Apr 7, 2022",Blink Date,Blink is an application technology company that provides a platform for online dating to start making real connections.,"Apps, Dating, Mobile Apps",—,"California City, California, United States, North America",www.theblinkdate.com,,"$225,000",Seed,1,Yellow,2
Seed Round - LeviSense Medical,Seed,Seed,"$270,000","Mar 22, 2022",LeviSense Medical,LeviSense Medical is a medical technology company advancing technology for the treatment and prevention of pressure ulcers.,"Elder Care, Health Care, Medical",—,"Beverly, Massachusetts, United States, North America",levisensemedical.com/,,"$270,000",Seed,1,—,—
Seed Round - Valyant AI,Seed,Seed,"$4,000,000","Apr 15, 2022",Valyant AI,"Valyant AI develops a proprietary conversational AI platform for the restaurant, retail, and service-based industries.","Artificial Intelligence, Information Technology, Machine Learning, Natural Language Processing, Restaurants",—,"Denver, Colorado, United States, North America",www.valyant.ai/,,"$16,999,986",Seed,8,—,—
Seed Round - Carbon Collective,Seed,Seed,"$2,200,000","Apr 28, 2022",Carbon Collective,Carbon Collective is a financials services company.,Financial Services,—,"Albany, California, United States, North America",carboncollective.co/,,"$2,200,000",Seed,2,Powerhouse Ventures,5
Seed Round - Beam,Seed,Seed,"$3,500,000","May 10, 2022",Beam,Rapidly Develop AI Projects,"Artificial Intelligence, Developer Tools, Machine Learning",—,"New York, New York, United States, North America",beam.cloud,,"$3,500,000",Seed,1,Tiger Global Management,9
Seed Round - Yates Electrospace,Seed,Seed,"$131,165","Apr 5, 2022",Yates Electrospace,"Yates Electrospace is known for designing, building, and flying manned electric aircraft.","Air Transportation, Electronics, Manufacturing",—,"Aliso Viejo, California, United States, North America",silent-arrow.com,,"$756,165",Seed,7,—,—
Pre Seed Round - Resmo,Pre-Seed,Seed,"$1,300,000","Mar 22, 2022",Resmo,Resmo provides cloud and SaaS asset visibility and security for modern software.,"Cloud Computing, SaaS, Software",—,"Wilmington, Delaware, United States, North America",www.resmo.com/,,"$1,300,000",Seed,1,—,1
Seed Round - Tern,Seed,Seed,"$900,000","Mar 31, 2022",Tern,"Tern is a fintech as a service company that launches programs with low code, no code white labels, and traditional APIs.","FinTech, Information Technology, SaaS",—,"New York, New York, United States, North America",www.ternitup.com,,"$1,900,000",Seed,2,—,—
Seed Round - Resale.com,Seed,Seed,"$9,724,995","Apr 29, 2022",Resale.com,Resale.com is an Investor backed technology company.,"E-Commerce, Retail, Shopping, Software",Women Founded,"Salt Lake City, Utah, United States, North America",resale.com/,,"$9,724,995",Seed,1,—,—
Pre Seed Round - CreateKap,Pre-Seed,Seed,"$250,000","May 1, 2022",CreateKap,Generative AI App for Businesses,"Artificial Intelligence, Marketing",—,"Austin, Texas, United States, North America",cashaam.com,,"$250,000",Seed,1,Sputnik ATX,1
Pre Seed Round - Handl Health,Pre-Seed,Seed,"$650,000","May 1, 2022",Handl Health,"A healthcare price transparency platform helping health plans comply with legislation and digitizing how patients shop, book & pay for care.",Health Care,—,"Pittsburgh, Pennsylvania, United States, North America",www.gohandlhealth.com,,"$770,000",Seed,3,—,—
