Seed Round - Songfinch,Seed,Seed,"$2,500,000","Apr 6, 2022",Songfinch,"Songfinch is the leading music creator platform enabling anyone to create one-of-a-kind, custom songs.","Communities, Content Creators, Gift, Music, Music Streaming",—,"Chicago, Illinois, United States, North America",www.songfinch.com,,"$31,299,588",Early Stage Venture,4,Corazon Capital,10
Pre Seed Round - Skry,Pre-Seed,Seed,"$1,000,000","Apr 7, 2022",Skry,Skry helps its users find their next prized collection with a unique at-a-glance NFT Grade.,"Blockchain, Cryptocurrency, Software",—,"Boulder, Colorado, United States, North America",www.skry.xyz,,"$1,000,000",Seed,1,—,8
Pre Seed Round - Floqsta,Pre-Seed,Seed,"$600,000","May 1, 2022",Floqsta,Social platform designed to connect like-minded travel companions with new adventures using AI-based social-matching algorithms.,"Apps, Social Network, Travel","East Asian Founded, Women Founded, Women Led","Boston, Massachusetts, United States, North America",www.floqsta.com/,,"$600,000",Seed,1,—,—
Pre Seed Round - Lectrium Inc.,Pre-Seed,Seed,"$1,000,000","May 15, 2022",Lectrium Inc.,Lectrium makes every home in the US EV-ready,—,—,"Palo Alto, California, United States, North America",www.lectrium.io,,"$1,110,000",Seed,2,—,1
Seed Round - Decimal,Seed,Seed,"$9,169,988","Apr 1, 2022",Decimal,Decimal is a technology platform for the accounting operations of small-and-medium-sized businesses.,"Accounting, Information Technology, Small and Medium Businesses",—,"Indianapolis, Indiana, United States, North America",www.decimal.com/,,"$9,169,988",Seed,1,Arthur Ventures,2
Pre Seed Round - Mentium.io,Pre-Seed,Seed,"$200,000","Apr 28, 2022",Mentium.io,"Mentium is all-in-one solution for AI startups, providing metering, pricing, and billing. Track costs per customer & save up to 75% on AWS.","Finance, Financial Services, FinTech",—,"Austin, Texas, United States, North America",www.mentium.io/,,"$200,000",Seed,1,Antler,1
Seed Round - CaliberX (formerly Poolit),Seed,Seed,"$5,255,000","May 6, 2022",CaliberX (formerly Poolit),Transforming investment operations for alternative investments,"Financial Services, FinTech, SaaS, Software","Black / African American Founded, Black / African American Led, Hispanic / Latine Founded, Hispanic / Latine Led, South Asian Led","Miami, Florida, United States, North America",www.caliber.exchange/,,"$5,255,000",Seed,1,"Harlem Capital Partners, Picus Capital",12
Seed Round - Burn Ghost,Seed,Seed,"$3,125,000","Apr 28, 2022",Burn Ghost,Stealth-Mode W3 Skill Game Platform,"Blockchain, Cryptocurrency, Gaming",—,"Boston, Massachusetts, United States, North America",www.burnghost.com,,"$3,125,000",Seed,1,"BITKRAFT Ventures, Drive by DraftKings",3
Seed Round - Shrimpy,Seed,Seed,"$312,000","Apr 29, 2022",Shrimpy,"Shrimpy is the most trusted way to trade on crypto exchanges. APIs for exchange management, trade execution, and real-time data collection.","Blockchain, Cryptocurrency, Developer APIs, FinTech, Trading Platform",—,"Santa Clara, California, United States, North America",www.shrimpy.io,,"$312,000",Seed,3,—,1
Seed Round - Spectrohm,Seed,Seed,"$2,000,000","May 2, 2022",Spectrohm,"Spectrohm uses radio waves to identify what's inside of objects, packages, and even people","Electronics, GovTech, Homeland Security, Image Recognition, Logistics",—,"Mclean, Virginia, United States, North America",spectrohm.com,,"$2,000,000",Seed,1,HCVC,7
Seed Round - Co:Create,Seed,Seed,"$25,000,000","May 10, 2022",Co:Create,Co:Create powers dynamic growth for NFT projects and Web3 brands.,"Bitcoin, Cryptocurrency",—,"Menlo Park, California, United States, North America",www.usecocreate.io,,"$25,000,000",Seed,1,Andreessen Horowitz,8
Seed Round - Leland,Seed,Seed,"$4,000,000","May 11, 2022",Leland,Leland is a coaching marketplace for education and career goals.,"Education, Marketplace",—,"Stanford, California, United States, North America",www.joinleland.com,,"$5,100,000",Seed,2,Contrary,2
Seed Round - Monovo,Seed,Seed,"$5,700,000","Apr 18, 2022",Monovo,"Monovo is a health technology company focused on building and commercializing solutions that advance health equity, literacy, and access.","Health Care, Information Technology, Medical",—,"Lehi, Utah, United States, North America",www.monovo.care,,"$10,854,000",Seed,5,—,—
Seed Round - Ender,Seed,Seed,"$5,500,000","Apr 1, 2022",Ender,"Ender is a competition platform where kids can win cash prizes for building apps, games, websites, and other real-world projects.","Education, Gaming, Social, Software",—,"Austin, Texas, United States, North America",joinender.com,,"$6,500,000",Seed,2,"Chicago Ventures, GSV Ventures, Learn Capital",9
Seed Round - Binance.US,Seed,Seed,"$200,000,000","Apr 6, 2022",Binance.US,Binance is a cryptocurrency exchange that provides a platform for trading various cryptocurrencies.,"Cryptocurrency, Financial Services, Internet, Trading Platform",—,"Palo Alto, California, United States, North America",www.binance.us,,"$200,000,000",Seed,1,—,13
Seed Round - Pearl Street Technologies,Seed,Seed,"$2,817,344","Apr 1, 2022",Pearl Street Technologies,Pearl Street Technologies develops next-generation software for the electric utility industry.,"Electrical Distribution, Energy, Information Technology, Software",—,"Pittsburgh, Pennsylvania, United States, North America",www.pearlstreettechnologies.com/,,"$3,792,238",Seed,4,Pear VC,1
Seed Round - Avestor Inc.,Seed,Seed,"$500,000","May 1, 2022",Avestor Inc.,Raising capital for private investments has always been too complex. Avestor streamlines the entire investment process from start to finish.,FinTech,—,"Portland, Oregon, United States, North America",www.avestorinc.com,,"$900,000",Seed,2,—,—
Seed Round - Triangle,Seed,Seed,"$1,000,000","May 5, 2022",Triangle,Big Data finance platform for sustainability and infrastructure,"Agriculture, AgTech, Blockchain, CleanTech, Financial Services, FinTech, Infrastructure, Solar, Sustainability",—,"New York, New York, United States, North America",www.triangle.digital,,"$2,000,000",Seed,3,Algorand Foundation,2
Pre Seed Round - Reach Social,Pre-Seed,Seed,"$220,000","May 15, 2022",Reach Social,"Reach Social offers services such as SaaS, advertising technology, marketing technology, social proof advertising, and creative technology.","Advertising, Information Technology, Internet, Marketing, Software",—,"Bozeman, Montana, United States, North America",reach-social.io,,"$220,000",Seed,1,—,—
Seed Round - TeamOut,Seed,Seed,"$2,200,000","Apr 1, 2022",TeamOut,TeamOut is the platform that makes retreat planning easy for remote teams.,"Information Technology, Software",—,"San Francisco, California, United States, North America",www.teamout.com,,"$3,200,000",Seed,2,—,3
Pre Seed Round - Labyrinth Labs,Pre-Seed,Seed,"$120,000","May 1, 2022",Labyrinth Labs,"Labyrinth Labs builds tools that enable anyone to leverage AI for illustration, photography, and 2D and 3D assets.","3D Technology, Artificial Intelligence, Augmented Reality, Machine Learning, Virtual Reality",—,"San Francisco, California, United States, North America",labyrinthlabs.xyz,,"$120,000",Seed,1,—,—
Seed Round - Original Syndicate,Seed,Seed,"$1,125,000","Apr 5, 2022",Original Syndicate,"Original Syndicate offers live and virtual brand experience, broadcast, music and entertainment, consumer and B2B event design.","Event Promotion, Events, Marketing",—,"Los Angeles, California, United States, North America",originalsyndicate.com/,,"$1,125,000",Seed,1,—,—
Seed Round - Anja Health,Seed,Seed,"$4,500,000","May 9, 2022",Anja Health,Anja Health is a personalized doctor-backed cord blood banking company that freezes umbilical cord and placenta stem cells.,Health Care,—,"Los Angeles, California, United States, North America",anjahealth.com/,,"$4,500,000",Seed,2,Seven Seven Six,10
Pre Seed Round - Turn Racing,Pre-Seed,Seed,"$62,500","Mar 29, 2022",Turn Racing,Turn Racing designs and builds functional and affordable sim racing hardware,"Hardware, Simulation, Software, Virtual Reality",—,"Alexandria, Minnesota, United States, North America",www.turnracing.com/,,"$252,500",Seed,3,—,—
Seed Round - LootRush,Seed,Seed,"$12,000,000","May 5, 2022",LootRush,LootRush is a Web3 Videogame Platform.,"Blockchain, Cryptocurrency, Information Technology, Video Games, Web Design",—,"San Francisco, California, United States, North America",www.lootrush.com/,,"$12,000,000",Seed,2,Paradigm,4
Seed Round - Kable,Seed,Seed,"$2,650,000","Apr 4, 2022",Kable,Kable makes it easy for developers to add usage-based billing to their API products with just three lines of code,"Billing, Developer APIs, Internet, Payments, Software",—,"Los Angeles, California, United States, North America",kable.io,,"$2,925,000",Seed,2,—,1
Seed Round - Loops,Seed,Seed,"$3,200,000","Apr 28, 2022",Loops,Loops is a SaaS based company.,"SaaS, Software",—,"Washington, District of Columbia, United States, North America",loops.so,,"$3,200,000",Seed,2,Craft Ventures,10
Pre Seed Round - ilm.so,Pre-Seed,Seed,"$332,500","Apr 1, 2022",ilm.so,Ilmiya is an education engagement platform that unifies every aspect of the learning journey.,"E-Learning, EdTech, Education, Internet, Software",—,"Bloomington, Minnesota, United States, North America",ilmiya.com,,"$332,500",Seed,1,—,—
"Seed Round - GI Digital, Inc.",Seed,Seed,"$550,000","May 1, 2022","GI Digital, Inc.",Tele-Endoscopy Managed IT Service,"Health Care, Health Diagnostics, Information Technology",—,"New York, New York, United States, North America",gi.digital/,,"$550,000",Seed,2,—,—
Seed Round - Kwant,Seed,Seed,"$3,900,000","Mar 29, 2022",Kwant,Kwant is a workforce management and safety platform.,"Management Information Systems, Public Safety, Service Industry",—,"Brooklyn, New York, United States, North America",www.Kwant.ai/,,"$4,803,000",Seed,5,—,10
Seed Round - Wing Assistant,Seed,Seed,"$2,100,000","Mar 31, 2022",Wing Assistant,"Wing Assistant is an Information technology company that provides CRM management, virtual assistance, and social media management services.","CRM, Internet, SaaS, Software, Virtual Assistant","Hispanic / Latine Founded, Hispanic / Latine Led, South Asian Founded, South Asian Led","Irvine, California, United States, North America",wingassistant.com/,,"$2,205,000",Seed,3,Surface Ventures,3
Seed Round - Pagescreen,Seed,Seed,"$97,000","Apr 29, 2022",Pagescreen,Pagescreen provides solutions for website monitoring and screenshot automation.,"Consulting, Information Technology, SaaS, Software",—,"Philadelphia, Pennsylvania, United States, North America",pagescreen.net,,"$285,000",Seed,3,—,—
Seed Round - Veracify Media,Seed,Seed,"$500,000","Apr 27, 2022",Veracify Media,"Veracify is a SaaS, Mobile App called iTrust",Software,—,"Austin, Texas, United States, North America",veracifymedia.com,,"$500,000",Seed,1,—,1
Seed Round - MD Ally,Seed,Seed,"$4,000,000","Apr 1, 2022",MD Ally,MD Ally is a telehealth company that enables a virtual response tier for 9-1-1.,"Health Care, Navigation, Public Safety, Software","Black / African American Founded, Black / African American Led, Women Founded, Women Led","New York, New York, United States, North America",www.mdally.com,,"$8,500,000",Seed,5,—,—
Seed Round - Natural Intelligence Systems,Seed,Seed,"$750,000","May 9, 2022",Natural Intelligence Systems,Natural Intelligence Systems develops a pattern-based AI which is purpose-built for humans.,"Apps, Artificial Intelligence, Machine Learning, Semiconductor",—,"Boise, Idaho, United States, North America",www.naturalintelligence.ai,,"$6,709,929",Seed,4,—,1
"Seed Round - VNCTech Group, LP",Seed,Seed,"$200,000","May 15, 2022","VNCTech Group, LP",VNCDesigner is our premier platform delivering Strategy planning and execution capabilities.,"Business Development, Business Information Systems, Business Intelligence, Information Technology, Service Industry, Software, Training",—,"Southlake, Texas, United States, North America",www.vnctechgroup.com,,"$300,000",Seed,3,—,—
Pre Seed Round - MarsX,Pre-Seed,Seed,"$1,000,000","May 1, 2022",MarsX,MarsX is an AI-powered low code platform with micro apps.,"Mobile Apps, Open Source, Software, Web Development",—,"Ulster Park, New York, United States, North America",www.marsx.dev/,,"$1,000,000",Seed,1,—,—
"Pre Seed Round - Ora Biomedical, Inc.",Pre-Seed,Seed,"$245,000","May 15, 2022","Ora Biomedical, Inc.",Longevity Biotechnology Pharmaceutical Company,Medical,—,"Seattle, Washington, United States, North America",orabiomedical.com/,,"$245,000",Seed,1,—,—
Pre Seed Round - Diremo,Pre-Seed,Seed,"$350,000","Apr 16, 2022",Diremo,"The largest decentralized commerce marketplace. Discover and purchase more than 50,000 products sold with crypto.","Cryptocurrency, E-Commerce, Marketplace",—,"Earth, Texas, United States, North America",diremo.org,,"$350,000",Seed,1,—,—
Pre Seed Round - Outway,Pre-Seed,Seed,"$500,000","Apr 12, 2022",Outway,Driving conservation of natural lands by connecting and enabling land management organizations through collaborative mapping software,"GovTech, Information Technology, Mapping Services, Natural Resources, Outdoors, Software, Sustainability",—,"Boulder, Colorado, United States, North America",www.outway.io/,,"$500,000",Seed,2,—,—
Pre Seed Round - Ink,Pre-Seed,Seed,"$1,500,000","Apr 20, 2022",Ink,Ink enables creators to sign or draw on any form of digital content.,"Content, Digital Marketing, E-Signature",—,"Los Angeles, California, United States, North America",www.ink.id,,"$1,500,000",Seed,1,—,5
Seed Round - NyquistAI,Seed,Seed,"$6,000,000","Mar 23, 2022",NyquistAI,"NyquistAI builds a dependable, accessible, and cost-effective gateway to critical life science insights.","Artificial Intelligence, Business Development, Clinical Trials, Consulting, Health Care, Machine Learning, Management Consulting, Medical, Software","Women Founded, Women Led","Palo Alto, California, United States, North America",nyquistai.com/,,"$6,000,000",Seed,2,Peterson Ventures,4
Pre Seed Round - Kabata,Pre-Seed,Seed,"$2,000,000","May 5, 2022",Kabata,The world's smartest dumbbells.,"B2B, B2C, Fitness, Health Care, Wellness",—,"Los Angeles, California, United States, North America",kabatafitness.com,,"$2,000,000",Seed,1,—,11
Pre Seed Round - Inso Biosciences,Pre-Seed,Seed,"$2,275,000","Mar 28, 2022",Inso Biosciences,Inso Bio is a Cornell University-based early-stage biotech company that develops platform technology for biological sample processing.,"Biotechnology, Genetics, Life Science",—,"Ithaca, New York, United States, North America",www.inso.bio,,"$2,825,000",Seed,7,2048 Ventures,2
Seed Round - IMAJION,Seed,Seed,"$900,000","Apr 1, 2022",IMAJION,Extending jobsite data to builders in the field,"Augmented Reality, Construction, Software",—,"Henderson, Nevada, United States, North America",www.imajion.com/,,"$3,276,360",Seed,4,—,—
Seed Round - Tangram Vision,Seed,Seed,"$2,500,000","Apr 3, 2022",Tangram Vision,Infrastructure software to simplify sensor integration and management for vision-enabled devices.,"Autonomous Vehicles, Drone Management, Drones, Robotics, Sensor",—,"Boulder, Colorado, United States, North America",www.tangramvision.com,,"$4,000,000",Seed,3,—,—
Seed Round - Beeyonder,Seed,Seed,"$1,400,000","Apr 19, 2022",Beeyonder,Beeyonder is a virtual tour company that offers virtual travel experiences.,"Digital Entertainment, Leisure, Tourism, Travel, Virtual Assistant","Women Founded, Women Led","Boston, Massachusetts, United States, North America",beeyonder.com,,"$2,552,675",Seed,3,—,1
Pre Seed Round - Blerp,Pre-Seed,Seed,"$674,000","May 1, 2022",Blerp,Blerp is an audio expression platform that helps create digital voices through sound bites.,"Apps, Digital Entertainment, Gaming, Software, Video Streaming","East Asian Founded, East Asian Led","Salt Lake City, Utah, United States, North America",www.blerp.com,,"$2,848,000",Seed,9,—,—
Pre Seed Round - Just Travel,Pre-Seed,Seed,"R$1,230,000","May 1, 2022",Just Travel,Just Travel serves as a reference in the distribution of tourism products and customer service.,"Information Technology, Online Portals, Tourism",—,"Orlando, Florida, United States, North America",justtraveltour.com,,"R$1,230,000",Seed,1,—,2
Pre Seed Round - Kita Commerce,Pre-Seed,Seed,"$2,200,000","May 7, 2022",Kita Commerce,Kita Commerce modernizes how industrial companies take and process orders.,—,—,"San Francisco, California, United States, North America",kitacommerce.com,,"$2,200,000",Seed,1,—,—
Pre Seed Round - DeCrypted Innovation,Pre-Seed,Seed,"$250,000","Mar 27, 2022",DeCrypted Innovation,Blockchain Technology Company,"Blockchain, Cryptocurrency, Cyber Security, Information Technology, Software",—,"Little Rock, Arkansas, United States, North America",decryptedinnovation.co,,"$250,000",Seed,1,Venture Equity Partners,1
Pre Seed Round - Holium,Pre-Seed,Seed,"$895,000","Mar 21, 2022",Holium,"Holium is a software company designs and develops Realm, a brand-new operating system","Information Technology, Software",—,"Austin, Texas, United States, North America",holium.com,,"$2,895,000",Seed,2,—,—
Seed Round - Caramel,Seed,Seed,"$12,000,000","Mar 29, 2022",Caramel,Car checkout platform,—,—,"Los Angeles, California, United States, North America",www.drivecaramel.com,,"$24,000,000",Seed,2,—,—
Pre Seed Round - 1Konnection,Pre-Seed,Seed,"$1,700,000","Mar 31, 2022",1Konnection,"1Konnection is the leading marketplace for senior care businesses to connect, transact, and grow throughout their entire business lifecycle.","Business Intelligence, Commercial Real Estate, Elder Care, Health Care, Marketing, Marketplace, Real Estate",—,"Miami, Florida, United States, North America",www.1konnection.com/,,"$1,700,000",Seed,1,—,—
Seed Round - DigiShares,Seed,Seed,"$800,000","May 1, 2022",DigiShares,DigiShares is a provider of white-label platforms for tokenization of real estate and other assets.,"Blockchain, FinTech, Real Estate, Real Estate Investment",—,"Miami, Florida, United States, North America",digishares.io/,,"$2,000,000",Seed,6,—,1
Seed Round - Glimpse,Seed,Seed,"$6,200,000","Mar 29, 2022",Glimpse,Glimpse enables online brands to launch and distribute showrooms without the hefty costs of retail.,"E-Commerce, Marketing, Product Management, Rental, Sales Automation",—,"New York, New York, United States, North America",tryglimpse.com,,"$8,358,120",Seed,4,"GSR Ventures, Lisa Vangreddig",9
Seed Round - Finnt,Seed,Seed,"$2,900,000","May 1, 2022",Finnt,"Finnt is a multi-user banking app better spend, save and send as a group.","Debit Cards, Finance, Financial Services, FinTech, Mobile Apps",—,"Miami, Florida, United States, North America",www.finnt.com,,"$3,500,000",Seed,2,—,12
Pre Seed Round - Kaya,Pre-Seed,Seed,"$160,000","May 1, 2022",Kaya,Kaya is a virtual mental health platform that offers clinically-led groups connecting people with shared experiences.,"Health Care, Internet",—,"San Francisco, California, United States, North America",joinkaya.com,,"$1,100,000",Seed,5,—,2
Pre Seed Round - Everywhere,Pre-Seed,Seed,"$191,000","Apr 8, 2022",Everywhere,"Everywhere is a SaaS platform that uses machine learning to predict customer churn, upgrades, and other critical business outcomes.","Analytics, Consumer Research, Consumer Reviews, Customer Service, Enterprise Software, Information Technology, Machine Learning, SaaS, Software",—,"Santa Cruz, California, United States, North America",beeverywhere.io,,"$291,000",Seed,2,—,3
Seed Round - LGX Energy,Seed,Seed,"$1,375,000","Apr 8, 2022",LGX Energy,LGX Energy is an early-stage oil and gas exploration and production company that focuses its drilling activity in the Midwest.,"Energy, Financial Services, Oil and Gas",—,"Walla Walla, Washington, United States, North America",lgxenergycorp.com,,"$1,970,000",Seed,4,—,—
Seed Round - GreenPlaces,Seed,Seed,"$1,000,000","Apr 19, 2022",GreenPlaces,GreenPlaces all-in-one platform takes the complexity out of becoming a sustainable business,"Business Development, Enterprise Software, Legal Tech, Restaurants, Retail Technology, SaaS, Software, Sustainability",—,"Raleigh, North Carolina, United States, North America",www.greenplaces.com/,,"$18,000,000",Early Stage Venture,3,—,1
Pre Seed Round - Clearpol,Pre-Seed,Seed,"$400,000","May 1, 2022",Clearpol,Clearpol is an operating system for regulatory compliance and risk management for the healthcare industry.,"Health Care, Natural Language Processing, Software",—,"Los Angeles, California, United States, North America",www.clearpol.com,,"$400,000",Seed,2,—,1
Seed Round - Branch,Seed,Seed,"$12,500,000","May 11, 2022",Branch,"Branch is where creative rebels thrive, games evolve, and players shape the journey.","Gaming, Online Games, Software",—,"Seattle, Washington, United States, North America",branch.gg,,"$14,000,000",Seed,2,—,9
Seed Round - Quinsite,Seed,Seed,"$2,500,000","Mar 24, 2022",Quinsite,Quinsite offers a healthcare analytics platform that enhances decision making and improves operational efficiencies.,"Analytics, Health Care, Information Technology",—,"Chapel Hill, North Carolina, United States, North America",www.quinsite.com,,"$8,402,949",Early Stage Venture,3,Jeff Clark,2
Pre Seed Round - Noetic Digital,Pre-Seed,Seed,"$90,000","May 1, 2022",Noetic Digital,"B2B, agile market research SaaS, that automatically uncovers consumer-directed-insight at scale, through conversational-surveys.","Artificial Intelligence, Market Research",—,"Middletown, Delaware, United States, North America",noeticdigital.uk/beta/,,"$90,000",Seed,1,—,—
Pre Seed Round - Datawisp,Pre-Seed,Seed,"$435,000","Mar 28, 2022",Datawisp,Datawisp is a no-code data exploration and analysis platform for web3 and web2.,"Analytics, Business Intelligence, Data Visualization, Software",—,"New York, New York, United States, North America",www.datawisp.io,,"$4,035,000",Seed,2,—,1
Seed Round - Abode,Seed,Seed,"$3,750,000","Apr 6, 2022",Abode,Abode is an early-career retention platform that predict and prevent employee turnover for companies.,"Employment, Information Technology, Software",—,"Denver, Colorado, United States, North America",www.abodehr.com,,"$5,200,000",Seed,4,"Bonfire Ventures, Range Ventures",5
Pre Seed Round - Opus Talent Analytics,Pre-Seed,Seed,"$25,000","May 4, 2022",Opus Talent Analytics,Opus Analytics is an AI based data analytics software for Enterprise Businesses and Governments to help them make more informed decisions.,"Analytics, Big Data, SaaS, Software",—,"Lewes, Delaware, United States, North America",www.opusanalytics.ai/,,"$25,000",Seed,1,The Baobab Network,1
Pre Seed Round - Maplehouse,Pre-Seed,Seed,"$150,000","Apr 15, 2022",Maplehouse,Maplehouse is a college apparel company made for the off-duty college student.,"Consumer Goods, Fashion",—,"New York, New York, United States, North America",www.maplehouse.co,,"$150,000",Seed,2,—,—
Seed Round - Ness,Seed,Seed,"$15,500,000","May 10, 2022",Ness,The card that keeps you healthy. Request an invite to Ness Rewards at www.nesswell.com.,"Financial Services, FinTech, Health Care, Internet",—,"New York, New York, United States, North America",nesswell.com,,"$15,500,000",Seed,1,Will Ventures,10
Pre Seed Round - Her Forward,Pre-Seed,Seed,"$75,000","Apr 1, 2022",Her Forward,Her Forward is a women's magazine that covers women success stories around the globe.,—,—,"Dover, Delaware, United States, North America",herforward.com,,"$75,000",Seed,1,Michael Peres,1
Seed Round - Veloce Energy,Seed,Seed,"$3,500,000","Apr 23, 2022",Veloce Energy,Veloce Energy innovates technology and financing models to reduce physical and financial barriers to EV Charging infrastructure deployment.,"Electric Vehicle, Electrical Distribution, Embedded Software, Energy Storage, Power Grid",—,"Los Angeles, California, United States, North America",www.veloceenergy.com,,"$6,500,000",Early Stage Venture,6,Ecliptic Capital,1
Seed Round - Exosonic,Seed,Seed,"$4,000,000","May 6, 2022",Exosonic,Developing supersonic UAVs as a steppingstone towards quiet supersonic passenger flight,"Aerospace, Air Transportation","East Asian Founded, East Asian Led","Los Angeles, California, United States, North America",exosonic.com/,,"$4,150,000",Seed,6,—,—
Seed Round - Definitive Intelligence,Seed,Seed,"$6,500,000","May 3, 2022",Definitive Intelligence,Insights on demand - your personal data analyst for smarter decisions. Discover the power of AI-driven data science.,"Artificial Intelligence, Business Intelligence, Software",—,"Palo Alto, California, United States, North America",definitive.io/,,"$25,500,000",Early Stage Venture,2,—,—
Seed Round - Aerones,Seed,Seed,"$8,300,000","Apr 28, 2022",Aerones,Aerones is an innovative company that develops robotic technology for wind turbine blade maintenance services.,"Drone Management, Drones, Manufacturing, Robotics",—,"San Jose, California, United States, North America",www.aerones.com/,,"$46,101,029",Early Stage Venture,7,"Change Ventures, Future Positive Capital",9
Seed Round - Tech Chain Software - ResQ TRX,Seed,Seed,"$100,000","May 15, 2022",Tech Chain Software - ResQ TRX,"Mobile App, Web App, Payment, B2B, multi-sided, network effects, supply chain","Apps, Logistics, Mobile, Software, Transportation","East Asian Founded, East Asian Led, South Asian Founded, South Asian Led, Women Founded, Women Led","Houston, Texas, United States, North America",www.resqtrx.com,,"$580,000",Seed,3,—,1
Seed Round - Oko,Seed,Seed,"$2,975,000","May 1, 2022",Oko,Oko helps supply chain managers make better decisions,"Freight Service, Logistics, Software, Supply Chain Management",—,"Cleveland, Ohio, United States, North America",oko.trade/,,"$3,475,000",Seed,4,—,3
