Seed Round - Boson Motors,Seed,Seed,"$120,000","Sep 8, 2020",Boson Motors,Smart Electric Utility Vehicles and Powertrains,"Automotive, Farming, Industrial Automation",—,"San Jose, California, United States, North America",www.bosonmotors.com,,"$120,000",Seed,3,Techstars,1
Pre Seed Round - Color Intelligence,Pre-Seed,Seed,"$150,000","Sep 8, 2020",Color Intelligence,"Software, AITechnology","Artificial Intelligence, Content Creators, Film Production, iOS, Machine Learning, Media and Entertainment, Software, Video",—,"West Hollywood, California, United States, North America",colourlab.ai,,"$650,000",Seed,2,"James Richings, Steve Bayes",2
Seed Round - Atomic,Seed,Seed,"$125,000","Aug 25, 2020",Atomic,Atomic is a provider of personalized investment management services that companies embed into their services.,"B2C, Financial Services, FinTech, Personal Finance","Black / African American Founded, Black / African American Led","San Francisco, California, United States, North America",www.atomicvest.com,,"$25,125,000",Early Stage Venture,3,Y Combinator,1
Seed Round - Getlabs,Seed,Seed,"$3,000,000","Sep 1, 2020",Getlabs,Getlabs enables healthcare organizations to reach and diagnose patients remotely by dispatching nearby medical specialists to patients.,"Health Care, Health Diagnostics, Home Health Care, Medical, Personal Health",—,"Miami, Florida, United States, North America",getlabs.com,,"$39,999,991",Early Stage Venture,3,PivotNorth Capital,7
Seed Round - Change Finance,Seed,Seed,"$327,284","Sep 2, 2020",Change Finance,Change Finance is an independent investment adviser registered under the Investment Advisers.,Financial Services,—,"Longmont, Colorado, United States, North America",www.change-finance.com,,"$2,681,539",Seed,4,—,—
Seed Round - Fusioner,Seed,Seed,"$3,000,000","Aug 18, 2020",Fusioner,Online marketplace for music instruments and accessories,"E-Commerce, Internet, Marketing, Marketplace, Music, Retail",—,"Chicago, Illinois, United States, North America",fusioner.com/,,"$3,000,000",Seed,1,—,—
Seed Round - Bruvi,Seed,Seed,"$2,584,315","Aug 31, 2020",Bruvi,"Bruvi® reinvents single-serve coffee, with patent pending brewing technology and proprietary, Guilt Free Toss® B-Pods®","Coffee, Consumer Electronics, E-Commerce, Food and Beverage",—,"Beverly Hills, California, United States, North America",bruvi.com/,,"$10,541,315",Seed,3,—,—
Seed Round - Panda AI,Seed,Seed,"$3,300,000","Aug 18, 2020",Panda AI,Panda AI develops a B2B artificial intelligence platform designed to simplify work and combine various tasks.,"Artificial Intelligence, Information Technology, Machine Learning, SaaS",—,"Seattle, Washington, United States, North America",,,"$4,060,000",Seed,2,PSL Ventures,5
Seed Round - Vascarta,Seed,Seed,"$90,000","Sep 10, 2020",Vascarta,Vascarta is a drug development company with novel transdermal technology and a seasoned management team.,"Health Care, Medical, Pharmaceutical",—,"Summit, New Jersey, United States, North America",vascarta.com/,,"$788,500",Seed,3,—,—
Seed Round - Copper Banking,Seed,Seed,"$4,300,000","Aug 25, 2020",Copper Banking,Copper is an all-digital bank built specifically for teenagers to teach them in making smart financial decisions.,"EdTech, Financial Services, FinTech",—,"Seattle, Washington, United States, North America",getcopper.com/,,"$42,300,000",Early Stage Venture,3,PSL Ventures,5
Pre Seed Round - Nia Therapeutics,Pre-Seed,Seed,"$4,350,000","Aug 27, 2020",Nia Therapeutics,Nia Therapeutics develops a precision neurostimulation therapy for the treatment of memory loss.,"Biotechnology, Health Care, Life Science, Pharmaceutical",—,"Radnor, Pennsylvania, United States, North America",niatherapeutics.com/,,"$10,574,956",Seed,3,—,—
Seed Round - Hwy Haul,Seed,Seed,"$1,000,000","Aug 15, 2020",Hwy Haul,Hwy Haul is a next-generation digital freight platform for fresh produce.,"Freight Service, Logistics, Shipping, Supply Chain Management, Transportation",—,"Santa Clara, California, United States, North America",hwyhaul.com,,"$23,000,000",—,6,—,—
Seed Round - Digame,Seed,Seed,"$509,124","Sep 9, 2020",Digame,Digame Public Benefit Corporation produces small batch tequilas and mezcals.,Wine And Spirits,—,"Denver, Colorado, United States, North America",donaloca.com,,"$509,124",Seed,1,—,—
Seed Round - Radical Plastics,Seed,Seed,"$1,435,000","Aug 17, 2020",Radical Plastics,Radical Plastics is a radical solution to plastic pollution.,"Plastics and Rubber Manufacturing, Pollution Control","Women Founded, Women Led","Beverly, Massachusetts, United States, North America",www.radical-plastics.com/,,"$1,635,000",Seed,2,—,4
Seed Round - Farm Jenny,Seed,Seed,"$10,000","Aug 26, 2020",Farm Jenny,Farm Jenny is an Agricultural Technology company focused on animal health & productivity & operator enjoyment for small to mid-sized farms.,Electronics,—,"Pittsburgh, Pennsylvania, United States, North America",farmjenny.com,,"$60,000",Seed,3,—,1
Seed Round - Okteto,Seed,Seed,"$2,931,247","Sep 10, 2020",Okteto,"Okteto specializes in the fields of software development, software engineering, and the cloud computing industry.","Internet, Mobile Apps, Software","Hispanic / Latine Founded, Hispanic / Latine Led","San Francisco, California, United States, North America",okteto.com,,"$18,081,247",Early Stage Venture,4,"Haystack, Root Ventures",2
Pre Seed Round - Haus of Juxtapose,Pre-Seed,Seed,"$820,000","Aug 20, 2020",Haus of Juxtapose,Cosmetics brand company,"Consumer Goods, Cosmetics, E-Commerce","Women Founded, Women Led","Brooklyn, New York, United States, North America",www.hausofjuxtapose.com,,"$820,000",Seed,1,—,—
Pre Seed Round - BorrowDécor,Pre-Seed,Seed,"$50,000","Sep 1, 2020",BorrowDécor,BorrowDécor rents themed event decor packages for life's most important events. We deliver to your door and pick up next day.,"E-Commerce, Events, Rental, Wedding","Black / African American Founded, Women Founded, Women Led","Los Angeles, California, United States, North America",www.borrowdecor.com,,"$50,000",Seed,2,—,—
Seed Round - Labor Sync,Seed,Seed,"$1,200,000","Sep 1, 2020",Labor Sync,Labor Sync is a multilingual cloud-based employee time tracking solution.,"Information Services, Information Technology, Software",—,"Dumont, New Jersey, United States, North America",www.laborsync.com/,,"$2,900,000",Seed,2,—,—
Seed Round - Nexme,Seed,Seed,"$500,000","Aug 17, 2020",Nexme,"Nexme is an on-demand real estate platform that delivers instant access to homes and full-service, professional real estate agents.",Real Estate,"Hispanic / Latine Founded, Women Founded","Bellevue, Washington, United States, North America",nexme.com/,,"$500,000",Seed,1,—,1
Pre Seed Round - Volt,Pre-Seed,Seed,"$150,000","Sep 9, 2020",Volt,SendGrid for SMS,"Developer Tools, SMS, Software",—,"Tulsa, Oklahoma, United States, North America",www.textvolt.com,,"$3,288,000",Seed,3,Atento Capital,2
Seed Round - Sofi Exploration,Seed,Seed,"$798,750","Sep 4, 2020",Sofi Exploration,Sofi Exploration is a joint venture partnership that invests in oil and gas.,"Asset Management, Impact Investing, Oil and Gas",—,"Prosper, Texas, United States, North America",www.sofiexploration.com/,,"$1,533,215",Seed,4,—,—
Seed Round - My Wine Guide,Seed,Seed,"$650,000","Sep 1, 2020",My Wine Guide,SaaS Platform and Mobile App,"E-Commerce, SaaS",—,"Redwood City, California, United States, North America",www.mywineguide.com/,,"$650,000",Seed,1,—,—
Seed Round - Tipe,Seed,Seed,"$2,100,000","Sep 9, 2020",Tipe,Tipe is a next generation API-first CMS for developers.,Internet,"Black / African American Founded, Black / African American Led","San Francisco, California, United States, North America",tipe.io,,"$2,100,000",Seed,3,CRV,4
Seed Round - Plantt,Seed,Seed,"$1,000,000","Sep 10, 2020",Plantt,"Plantt connects to your sales and support tools, analyzing your conversations to create a tailor-made customer experience.",Software,—,"Los Angeles, California, United States, North America",plantt.io/,,"$1,000,000",Seed,1,—,2
Seed Round - Sports Engineering,Seed,Seed,"$668,500","Aug 28, 2020",Sports Engineering,"Sports Engineering specializes in identifying, developing, and commercializing innovative and disruptive sports technologies.","B2B, Product Design, Shoes, Sporting Goods, Sports",—,"Portsmouth, New Hampshire, United States, North America",sports.engineering,,"$2,318,500",Seed,3,—,—
Seed Round - O2TODAY,Seed,Seed,"$300,000","Aug 27, 2020",O2TODAY,O2TODAY is an consumer wellness and healthcare.,"Consumer Goods, Health Care, Manufacturing, Medical Device, Wellness",—,"Salt Lake City, Utah, United States, North America",www.o2today.com,,"$2,150,000",Seed,3,—,1
Seed Round - The Nudge,Seed,Seed,"$2,000,000","Aug 18, 2020",The Nudge,The social network that empowers people to get off their asses and have fun in the real world.,"Lifestyle, Subscription Service",Women Founded,"San Francisco, California, United States, North America",www.nudgetext.com,,"$13,540,000",Early Stage Venture,4,Lightspeed Venture Partners,2
Pre Seed Round - Hellosaurus,Pre-Seed,Seed,"$125,000","Aug 25, 2020",Hellosaurus,"Hellosaurus is an e-learning site for children that provides creative services, engaging games, and video courses.","E-Learning, Education, Online Portals",—,"New York, New York, United States, North America",www.hellosaurus.com/,,"$3,625,000",M&A,3,Y Combinator,1
Seed Round - Emme,Seed,Seed,"$2,500,000","Aug 27, 2020",Emme,"Emme is a healthcare technology company with a mission to put women's health in women's hands, starting with birth control.","Consumer, Health Care, Medical, Medical Device, Personal Health, Wellness, Women's","Women Founded, Women Led","San Francisco, California, United States, North America",www.emme.com/,,"$2,700,000",M&A,5,Magnetic Ventures,1
Pre Seed Round - Dripos,Pre-Seed,Seed,"$1,270,000","Sep 1, 2020",Dripos,The only piece of software a restaurant needs to operate.,"Consumer Software, Restaurants, SaaS, Software",—,"New York, New York, United States, North America",www.dripos.com,,"$6,395,000",Seed,5,PJC,1
Seed Round - LaunchNotes,Seed,Seed,"$1,800,000","Aug 26, 2020",LaunchNotes,"The Product Success Platform. Advancing and accelerating the product teams of today, so they can build the great technologies of tomorrow.","Collaboration, Developer Tools, Software",—,"Walnut, California, United States, North America",www.launchnotes.com,,"$16,800,000",Early Stage Venture,2,"Bull City Venture Partners, Cowboy Ventures",7
Seed Round - Delix Therapeutics,Seed,Seed,"$8,000,000","Sep 4, 2020",Delix Therapeutics,Delix Therapeutics focuses on harnessing the power of psychoplastogens novel neuroplasticity-promoting therapeutic.,"Biotechnology, Health Care, Life Science",—,"Boston, Massachusetts, United States, North America",www.delixtherapeutics.com,,"$118,000,000",Early Stage Venture,5,OMX Ventures,2
Pre Seed Round - Sken.ai,Pre-Seed,Seed,"$100,000","Aug 28, 2020",Sken.ai,"Sken.ai, offers a “DevOps first AppSec”.","Cyber Security, Developer Platform, Developer Tools, Machine Learning, SaaS",—,"Dublin, California, United States, North America",www.sken.ai,,"$400,000",M&A,3,Innovating Capital,1
Seed Round - ThruWave,Seed,Seed,"$6,400,000","Sep 3, 2020",ThruWave,"ThruWave produces millimeter wave imaging technology designed for markets including robotics, construction, and quality control.","3D Technology, GPU, Manufacturing, Robotics",Women Founded,"Seattle, Washington, United States, North America",www.thruwave.com/,,"$7,364,209",Seed,4,"The E14 Fund, Ubiquity Ventures",7
Seed Round - Reflective,Seed,Seed,"$1,300,000","Aug 18, 2020",Reflective,Reflective is an app that guides and automates work.,"Apps, Information Technology",—,"Seattle, Washington, United States, North America",reflective.co/,,"$1,300,000",Seed,1,Founders' Co-op,8
Seed Round - SafeBase,Seed,Seed,"$125,000","Aug 25, 2020",SafeBase,The Smart Trust Center for sharing your security posture and automating access to sensitive documents.,"Cloud Security, Cyber Security, Network Security, Sales Automation",—,"San Francisco, California, United States, North America",safebase.io,,"$20,125,000",Early Stage Venture,4,Y Combinator,1
Seed Round - PANTASTIC,Seed,Seed,"$2,300,000","Aug 19, 2020",PANTASTIC,PANTASTIC is an e-commerce platform that offers multi-category products.,E-Commerce,—,"Palo Alto, California, United States, North America",pantastic.com/,,"$2,300,000",Seed,1,—,5
Seed Round - CometChat,Seed,Seed,"$550,000","Aug 19, 2020",CometChat,"CometChat helps customers add voice, video, and text chat to their apps and websites.","Apps, Messaging, Mobile Apps, SaaS",—,"Denver, Colorado, United States, North America",www.cometchat.com/,,"$17,449,726",Early Stage Venture,7,Range Ventures,2
Seed Round - Rimsys,Seed,Seed,"$1,500,000","Aug 18, 2020",Rimsys,Rimsys is a provider of Regulatory Information Management (RIM) software for medical technology companies.,"Business Information Systems, Medical Device, Software",—,"Pittsburgh, Pennsylvania, United States, North America",www.rimsys.io/,,"$17,600,000",Early Stage Venture,3,Allos Ventures,1
Seed Round - Taika,Seed,Seed,"$2,700,000","Aug 13, 2020",Taika,Coffee that accentuates reality,Food and Beverage,—,"Walnut, California, United States, North America",taika.co,,"$2,700,000",Seed,2,Kindred Ventures,4
Seed Round - Nutrables,Seed,Seed,"$6,000,000","Aug 19, 2020",Nutrables,Nutrables is a vitamin gummy contract manufacturing company.,"Confectionery, Dietary Supplements, Manufacturing",—,"Chandler, Arizona, United States, North America",.nutrablesinc.com,,"$6,000,000",Seed,1,Greg Candelario,1
Pre Seed Round - ChargeNet Stations,Pre-Seed,Seed,"$796,000","Aug 15, 2020",ChargeNet Stations,"ChargeNet Stations specializes in the fields of SaaS, cleantech, electric vehicle supply equipment, and distributed energy resources.","CleanTech, Digital Marketing, Electric Vehicle, Energy, Energy Storage, SaaS, Software","South Asian Founded, Women Founded","San Diego, California, United States, North America",www.chargenetstations.com,,"$6,996,000",Seed,2,San Diego Angel Conference,1
Pre Seed Round - CriticalAsset,Pre-Seed,Seed,"$2,000,000","Sep 11, 2020",CriticalAsset,Your building's operating system.,"Construction, Property Management, Real Estate, SaaS, Software",—,"Manhattan Beach, California, United States, North America",www.criticalasset.com,,"$2,000,000",Seed,1,—,1
Seed Round - Fancision,Seed,Seed,"$150,000","Sep 3, 2020",Fancision,Fancision uses gamification and blockchain to engage and monetize football fans.,"Blockchain, eSports, Gaming, Sports",—,"Miami, Florida, United States, North America",fancision.io/,,"$150,000",Seed,1,Qatar Sportstech,1
Pre Seed Round - Transit Gigs,Pre-Seed,Seed,"$52,000","Aug 20, 2020",Transit Gigs,Transit Gigs is a recruitment start-up that helps transit agencies fill open positions.,"Content Marketing, Information Technology, Media and Entertainment, Public Transportation, Transportation",—,"Baltimore, Maryland, United States, North America",transitgigs.com/,,"$52,000",Seed,1,—,—
Seed Round - Root AI,Seed,Seed,"$7,200,000","Aug 13, 2020",Root AI,Root AI is a research company aiming to create intelligent robots that will help growers build the farms of the future.,"AgTech, Artificial Intelligence, Machine Learning, Robotics, Software",—,"Somerville, Massachusetts, United States, North America",root-ai.com,,"$10,459,891",M&A,5,PJC,8
Seed Round - Dapi,Seed,Seed,"$125,000","Aug 25, 2020",Dapi,Dapi is a platform that enables any application to accept payments instantly at near to 0 fees directly from bank accounts.,"Banking, Financial Services, FinTech, Payments",—,"San Francisco, California, United States, North America",dapi.co,,"$5,155,000",Seed,9,Y Combinator,2
Seed Round - Minerva,Seed,Seed,"$1,100,000","Aug 25, 2020",Minerva,Minerva is a platform enabling anyone to create and sharing clickable instructions for anything on the internet.,"Collaboration, Information Technology, Internet, Productivity Tools, SaaS, Software","East Asian Led, Hispanic / Latine Founded","Brooklyn, New York, United States, North America",www.minervaknows.com,,"$5,100,000",Seed,2,"Charge Ventures, Max Ventures",5
Pre Seed Round - Spora Health,Pre-Seed,Seed,"$20,000","Aug 31, 2020",Spora Health,Spora Health is a primary care provider designed for people of color.,"Fitness, Health Care, Wellness",—,"San Francisco, California, United States, North America",www.sporahealth.com,,"$4,220,000",—,4,—,1
Pre Seed Round - Helios Learn,Pre-Seed,Seed,"$10,000","Aug 27, 2020",Helios Learn,Reinventing distance education and remote learning.,"Education, Internet, Software, Training",—,"Middletown, Delaware, United States, North America",,,"$10,000",Seed,2,—,—
Pre Seed Round - BillionMinds,Pre-Seed,Seed,"$1,700,800","Sep 1, 2020",BillionMinds,WorkTech Skills Development SaaS,"EdTech, Human Resources, Information Technology, SaaS, Software",—,"Tulsa, Oklahoma, United States, North America",www.billionminds.com,,"$1,700,800",Seed,1,Atento Capital,1
Pre Seed Round - Pretred,Pre-Seed,Seed,"$120,000","Sep 8, 2020",Pretred,Pretred repurposes waste tires and plastics into innovative and efficient industrial use barriers and blocks.,"Building Material, Construction, Waste Management",—,"Lakewood, Colorado, United States, North America",pretred.com/,,"$3,720,480",Seed,3,Techstars,1
Pre Seed Round - Ohwow!,Pre-Seed,Seed,"$120,000","Sep 8, 2020",Ohwow!,"Ohwow! is a file sharing and remote collaboration app which is mobile-first, easy-to-use, and designed ground-up for media sharing.","Apps, File Sharing, Information Technology, Software",—,"Stanford, California, United States, North America",www.ohwowapps.com/,,"$260,000",Seed,2,—,1
Seed Round - Response,Seed,Seed,"$150,000","Aug 24, 2020",Response,The single store for all your vendors.,"B2B, Software",—,"San Francisco, California, United States, North America",www.tryresponse.com/,,"$150,000",Seed,1,—,1
Pre Seed Round - Deref,Pre-Seed,Seed,"$1,200,000","Sep 1, 2020",Deref,Empowering developer platform teams.,"Cloud Computing, Developer Platform, Developer Tools",—,"Seattle, Washington, United States, North America",www.deref.io,,"$1,200,000",Seed,1,—,1
Seed Round - InNeuroCo,Seed,Seed,"$287,107","Sep 8, 2020",InNeuroCo,InNeuroCo operates in the health care industry that creates a new medical device use in challenging tasks.,"Health Care, Medical, Medical Device",—,"Pembroke Pines, Florida, United States, North America",www.inneuroco.com/,,"$867,151",Seed,2,—,—
Seed Round - Clowder,Seed,Seed,"$1,100,000","Aug 14, 2020",Clowder,"Clowder is a business communication platform that connects team members, employees, and stakeholders through active mobile engagement.","Android, Apps, Communications Infrastructure, iOS, Mobile",—,"Alexandria, Virginia, United States, North America",www.clowder.com,,"$3,700,000",Seed,6,Active Capital,1
Pre Seed Round - Meaningful Gigs,Pre-Seed,Seed,"$1,100,000","Aug 30, 2020",Meaningful Gigs,Meaningful Gigs is a tech-enabled marketplace that up-skills and connects skilled African digital designers with enterprise companies.,"EdTech, Enterprise, Marketplace, Product Design, Skill Assessment",—,"Washington, District of Columbia, United States, North America",www.meaningfulgigs.com/,,"$7,100,000",Seed,2,—,4
Pre Seed Round - Odynn,Pre-Seed,Seed,"$475,000","Sep 1, 2020",Odynn,Consumer FinTech Mobile App,"Analytics, Apps, Artificial Intelligence, Finance, Financial Services, Loyalty Programs, Mobile Apps, Security, Software",—,"Lakeville, Connecticut, United States, North America",www.odynn.com/,,"$2,225,000",Seed,3,—,—
Seed Round - Wisy,Seed,Seed,"$900,000","Aug 15, 2020",Wisy,Image recognition platform to revolutionize new ways to see retail,"Artificial Intelligence, Consumer Goods, E-Commerce, Enterprise Software, Fast-Moving Consumer Goods, Grocery, SaaS, Sales","Black / African American Founded, East Asian Founded, Hispanic / Latine Founded, Women Founded, Women Led","San Francisco, California, United States, North America",wisy.ai/,,"$2,150,000",Seed,3,—,2
Pre Seed Round - FashionDx Inc,Pre-Seed,Seed,"$120,000","Aug 15, 2020",FashionDx Inc,"The complete AI Stylist for e-com, in-store clienteling & conversational commerce !","Artificial Intelligence, Computer Vision, E-Commerce, Fashion, Machine Learning, Personalization, Retail Technology","Women Founded, Women Led","Fremont, California, United States, North America",www.fashiondx.co,,"$120,000",Seed,1,—,2
Seed Round - LUMINARE,Seed,Seed,"$2,000,000","Aug 26, 2020",LUMINARE,"SaaS, Healthcare, Workflow optimization within EHR","Analytics, Data Visualization, Hospital, Information Services, Productivity Tools, Real Time",—,"Houston, Texas, United States, North America",www.luminare.io,,"$7,047,491",Seed,4,—,—
Seed Round - Biftek,Seed,Seed,"$400,000","Aug 15, 2020",Biftek,Biftek produces growth medium supplement to ease the cost problem of cultured meat by introducing novel approaches.,Biotechnology,—,"Newark, New Jersey, United States, North America",biftek.co/,,"$1,505,000",Seed,5,Big Idea Ventures,1
Pre Seed Round - Blue Ocean Gear,Pre-Seed,Seed,"$300,000","Sep 1, 2020",Blue Ocean Gear,Blue Ocean Gear provides sensored tracking buoys to address the commercial fishing industry's informational and environmental challenges,"Aquaculture, GreenTech, Information Services, Information Technology, Internet of Things, Location Based Services, Marine Technology, Sustainability","Women Founded, Women Led","San Mateo, California, United States, North America",blueoceangear.com,,"$7,085,000",Early Stage Venture,11,—,—
Seed Round - Intera Oncology,Seed,Seed,"$884,382","Aug 14, 2020",Intera Oncology,Intera Oncology specializes in improving the survival of colorectal cancer and cholangiocarcinoma patients.,"Health Care, Health Diagnostics, Medical, Medical Device",—,"Wellesley, Massachusetts, United States, North America",www.interaoncology.com/,,"$3,700,921",Seed,3,—,—
Pre Seed Round - StageConnect,Pre-Seed,Seed,"$110,000","Aug 27, 2020",StageConnect,StageConnect is a production-grade remote audience interaction software for Hybrid and Virtual Events.,"Event Management, Events, Software",—,"Nashua, New Hampshire, United States, North America",stageconnect.co,,"$1,482,814",Seed,3,—,—
Seed Round - Epihub,Seed,Seed,"$125,000","Aug 25, 2020",Epihub,Epihub develops a computer platform designed to automate assessments from students.,"E-Learning, Education, Software",Black / African American Founded,"New York, New York, United States, North America",epihub.com/,,"$125,000",Seed,2,Y Combinator,1
Pre Seed Round - Productable,Pre-Seed,Seed,"$120,000","Aug 27, 2020",Productable,Productable is an innovation management platform that sets organizations up with everything they need to innovate successfully.,"Information Technology, Innovation Management, SaaS, Software",—,"Austin, Texas, United States, North America",www.beproductable.com/,,"$120,000",Seed,1,Sputnik ATX,2
Pre Seed Round - Trivia Rescue,Pre-Seed,Seed,"$125,000","Sep 1, 2020",Trivia Rescue,Entertainment and Content Service for the Hospitality Industry,—,—,"Denver, Colorado, United States, North America",www.triviarescue.com,,"$125,000",Seed,1,—,—
Pre Seed Round - H2Ok Innovations,Pre-Seed,Seed,"$120,000","Sep 7, 2020",H2Ok Innovations,H2Ok Innovations is an IoT-enabled analytics platform.,"Agriculture, Aquaculture, Industrial Automation, Internet of Things, Manufacturing",Women Founded,"Cambridge, Massachusetts, United States, North America",www.h2okinnovations.com,,"$7,019,999",—,5,Techstars,1
Pre Seed Round - Qonversion,Pre-Seed,Seed,"$850,000","Aug 14, 2020",Qonversion,"The subscription data platform for mobile-first companies. Best subscription analytics, subscription management and growth tools.","Analytics, App Marketing, Developer Platform, Developer Tools, iOS, Mobile Apps, Mobile Payments, SaaS, Software",—,"San Francisco, California, United States, North America",qonversion.io,,"$2,850,000",Seed,2,AddVenture,2
Pre Seed Round - Onboardbase,Pre-Seed,Seed,"$35,000","Sep 5, 2020",Onboardbase,Collaboratively work with app secrets and credentials securely with team work and contractors in mind.,"Cloud Security, Developer Tools, Productivity Tools, Software",—,"Miami, Florida, United States, North America",onboardbase.com/,,"$230,000",Seed,3,Thomas Schranz,1
Seed Round - Txcin,Seed,Seed,"$950,999","Sep 5, 2020",Txcin,Txcin offers health care services for patients.,Health Care,—,"Dallas, North Carolina, United States, North America",txcin.org/,,"$950,999",Seed,1,—,—
Seed Round - Protokinetix,Seed,Seed,"$237,450","Sep 1, 2020",Protokinetix,ProtoKinetix is a research and development company that specializes in cell survival solutions.,"Biotechnology, Health Care, Life Science, Medical Device",—,"Marietta, Ohio, United States, North America",www.protokinetix.com,,"$3,833,900",Seed,18,—,—
Pre Seed Round - Mudrex,Pre-Seed,Seed,"$250,000","Sep 1, 2020",Mudrex,Mudrex is a cryptocurrency company that specializes in autopilot smart crypto investment.,"Asset Management, Cryptocurrency, FinTech, Trading Platform",—,"San Francisco, California, United States, North America",mudrex.com,,"$22,069,245",—,5,—,1
Pre Seed Round - Earth Rides,Pre-Seed,Seed,"$100,000","Aug 25, 2020",Earth Rides,Like Uber but with Teslas.,"Ride Sharing, Transportation",—,"Nashville, Tennessee, United States, North America",www.earthrideshare.com/,,"$2,054,500",—,4,—,—
